Авторы,Идентификаторы авторов,Ссылка,Пристатейные ссылки
"Bessonov V.","54883126700;","https://www.scopus.com/inward/record.uri?eid=2-s2.0-84855399436&partnerID=40&md5=da358f6a0d823192063e8ccde0c03606","Platt, V., (1958) Strategic Intelligence Information Work, , note; von Clausewitz, C., (2000) On War, , note; Bessonov, V., (2003) Introduction to the Analysis of the Russian Macroeco-nomic Dynamics In the Transition Period, , note; Ritz, G., (1927) Mathematical Methods In Statistics, , note; Bobrov, S., (1930) Economic Statistics: Introduction to the Study of The Methods of Processing Time Series In Economic Statistics, , note; Konyus, A., (1933) Current Economic Situation, Encyclopedic Dictionary of Russian Bibliography Institute Granat, 51, pp. 220-264. , note; Findley, D.F., New Capabilities and Methods of the X-12-ARIMA Seasonal-Adjustment Program (1998) Journal of Business and Economic Statistics, 16 (2), pp. 127-152; Gomez, V., Maravall, A., (1996) Programs TRAMO (Time Series Regression With Arima Noise, Missing Observations, and Outliers) and SEATS (Signal Extraction In Arima Time Series): Instructions For the User, p. 9628. , note; Bessonov, V., Introduction to the Analysis of the Russian Macroeco-nomic Dynamics In the Transition Period; note; note; Klyukin, P., (2010) Current Economic Analysis Institute In Personalities: Biographical Essay, , note; (2006) Historical Statistics of the United States, 5. , note; Bessonov, V., The User's View of Russian Statistics (2009) Voprosy Statistiki, 5, pp. 50-61; note; Forsyth, F.G., Fowler, R.F., The Theory and Practice of Chain Price Index Numbers (1981) Journal of the Royal Statistical Society, Ser. A, 144, pp. 224-246. , note; note; Bloem, A.M., Dippelsman, R.J., Mæhle, N.O., (2001) Quarterly National Accounts Manual: Concepts, Data Sources, and Compilation, , note; Bessonov, V., (2005) Problems In the Analysis of the Russian Macroeconomic Dynamics In the Transitional Period, , note; Bessonov, V., (2005) Problems In the Analysis of the Russian Macroeconomic Dynamics In the Transitional Period, , note; Fisher, I., (1927) The Making of Index Numbers; Parks, R.W., Inflation and Relative Price Variability (1978) Journal of Political Economy, 86 (1), pp. 79-95; note; Bessonov, V., Trends in the Russian Economy in the Context of the World Crisis (2009) Ekonomicheskaya Politika, 1, pp. 59-68; Bessonov, V., Problems of the Analysis of the Russian Macroeconomic Dynamics In the Transitional Period; note"
"Avdasheva S., Shastitko A.","7801623030;14621167700;","https://www.scopus.com/inward/record.uri?eid=2-s2.0-84859252334&doi=10.1080%2f14631377.2011.622571&partnerID=40&md5=a9cac875edc7065509bdcc83e0153dd2","Broadman, H.G., Reducing structural dominance and entry barriers in Russian industry (2000) Review of industrial organization, 17 (2), pp. 155-175; Dobrynskaya, V., Optimal monetary policy under incomplete pass-through and asymmetric price rigidity: Empirical evidence from Russia (2009) Monetary policy, trade and convergence: The case of transition economies, pp. 47-78. , In: Spanjers W., editors Berlin, Germany: LIT In; Ernst, Young, (2011) Obzor pishchevoi promyshlennosti, 2010 god, , http://www.ey.com/Publication/vwLUAssets/Food-and-Beverage-survey-2010-RU/$FILE/Food-and-Beverage-survey-2010-RU.pdf, Available from [Accessed 9 May 2011], [online]; Estrin, S., Prevezer, M., A survey on institutions and new firm entry: How and why do entry rates differ in emerging markets (2010) Economic systems, 34 (3), pp. 289-308; Evans, D.S., Padilla, A.J., Excessive prices: Using economics to define administrable legal rules (2005) Journal of competition law and economics, 1 (1), pp. 97-122; Freixas, X., Guesnerie, R., Tirole, J., Planning under incomplete information and the ratchet effect (1985) The review of economic studies, 52 (2), pp. 173-191; Geradin, D., (2007) The necessary limits to the control of 'excessive' prices by competition authorities-a view from Europe, , http://ssrn.com/abstract=1022678, Tilburg university legal studies working paper [online]. Available from SSRN, [Accessed 9 May 2011]; Geradin, D., The perils of antitrust proliferation: The process of 'decentralized globalization' and the risks of over-regulation of competitive behavior (2009) Chicago journal of international law, 10 (1), pp. 189-211; Gudofsky, J., Kriaris, E.L., Vital, L., Abuse of joint dominance-is the cure worse than the disease? (2010) Canadian bar association annual competition law conference, , http://www.cba.org/cba/cle/PDF/COMP10_Gudofsky_paper.pdf, 30 September-1 October 2010, Gatineau, Quebec [online]. Available from [Accessed 9 May 2011]; Joskow, P.L., Transaction cost economics, antitrust rules, and remedies (2002) Journal of law, economics, and organization, 18 (1), pp. 95-116; Pittman, R., Competition law in Central and Eastern Europe: Five years later (1998) Antitrust bulletin, 43 (1), pp. 179-228; Pittman, R., Russian railways reform and the problem of non-discriminatory access to infrastructure (2004) Annals of public and cooperative economics, 75 (2), pp. 167-192; Radaev, V., Power imbalance, institutional change, and relational conflicts in the Russian retail market (2010) American sociological association annual meeting, , http://www.allacademic.com/meta/p_mla_apa_research_citation/4/1/1/5/0/p411509_index.html, 13 August 2010, Atlanta [online]. Available from [Accessed 9 May 2011]; Rodriguez, A.E., Menon, A., (2010) The limits of competition policy: The shortcomings of antitrust in developing and reforming economies, , Kluwer Law International; Simachev, Y.V., (2009) Assessment of policy measures to support Russia's real economy, , http://www.suomenpankki.fi/bofit_en/tutkimus/tutkimusjulkaisut/online/Documents/bon0609.pdf, Bank of Finland research publications, BOFIT online, no. 6 [online]. Available from; Yasin, Y., (2004) Structural changes in the Russian industry, , Moscow: SU-HSE Publishing House [Accessed 9 May 2011]; Yasin, Y., (2010) Russian manufacturing revisited: Industrial enterprises at the start of the 2008 financial crisis, , http://www.suomenpankki.fi/bofit_en/tutkimus/tutkimusjulkaisut/online/Documents/bon0510.pdf, Bank of Finland research publications, BOFIT online, no. 5 [online]. Available from [Accessed 9 May 2011]"
"Chernyak E., Chugunova O., Askarova J., Nascimento S., Mirkin B.","55973447100;55973441900;55973769000;7003805775;35428028600;","https://www.scopus.com/inward/record.uri?eid=2-s2.0-84890932879&partnerID=40&md5=ba45be1a381c38d05bd01ce284f2b8ea","(1998) ACM Computing Classification System, , http://www.acm.org/about/class/1998, Cited 9 September 2008; Eshaghian-Wilner, M.M., Khitun, A., Navab, S., Wang, K.L., The spin-wave nanoscale reconfigurable mesh and the labeling problem (2007) ACM Journal on Emergering Technologies in Computing Systems (JETC), 3, p. 2; Nikol'skaya, I.Yu., Yefremenkova, V.M., Mathematics in VINITI RAS: From abstract journal to databases (2008) Scientific and Technical Information Processing, 35 (3), pp. 128-138; Mercadé, J., Espinosa, A., Adsuara, J.-E., Adrados, R., Segura, J., Maes, T., Orymold: Ontology based gene expression data integration and analysis tool applied to rice (2009) BMC Bioinformatics, 10, p. 158. , doi:10.1186/1471-2105-10-158; Mirkin, B., Nascimento, S., Fenner, T., Pereira, L.M., Fuzzy thematic clusters mapped to higher ranks in a taxonomy (2010) International Journal of Software and Informatics, 4 (3), pp. 257-275; Mirkin, B., Nascimento, S., Pereira, L.M., Cluster-lift method for mapping research activities over a concept tree (2010) Recent Advances in Machine Learning, 2, pp. 245-247; Pampapathi, R., Mirkin, B., Levene, M., A suffix tree approach to anti-spam email filtering (2006) Machine Learning, 65 (1), pp. 309-338; Patwardhan, J., Dwyer, C., Lebeck, A.R., A self-organizing defect tolerant SIMD architecture (2007) ACM Journal on Emergering Technologies in Computing Systems (JETC), 3, p. 2; Sato, M., Sato, Y., Jain, L.C., (1997) Fuzzy Clustering Models and Applications, , Physics- Verlag. ISBN:3790810266; Karkaletsis, V., Fragkou, P., Petasis, G., Iosif, E., Ontology based information extraction from text (2011) Lecture Notes in Computer Science, 6050, pp. 89-109. , Knowledge-Driven Multimedia Information Extraction and Ontology Evolution; Von Luxburg, U., A tutorial in spectral clustering (2006) Statistics and Computing, 17 (4), pp. 395-416"
"Mirkin B.","35428028600;","https://www.scopus.com/inward/record.uri?eid=2-s2.0-84857321345&partnerID=40&md5=3445916cf5c33af826c83baafd0b8cc9","Berthold, M., Hand, D., (2003) Intelligent Data Analysis, , Springer-Verlag; Breiman, L., Friedman, J.H., Olshen, R.A., Stone, C.J., (1984) Classification and Regression Trees, , Belmont, Ca: Wadswarth; Duda, R.O., Hart, P.E., Stork, D.G., (2001) Pattern Classification, , Wiley-Interscience, ISBN 0-471-05669-3; Green, S.B., Salkind, N.J., (2003) Using SPSS for the Windows and Mackintosh: Analyzing and Understanding Data, , Prentice Hall; Hair, J.F., Black, W.C., Babin, B.J., Anderson, R.E., (2010) Multivariate Data Analysis, , 7th Edition, Prentice Hall, ISBN-10: 0-13-813263-1; Han, J., Kamber, M., (2010) Data Mining: Concepts and Techniques, , 3d Edition, Morgan Kaufmann Publishers; Haykin, S.S., (1999) Neural Networks, , 2nd ed, Prentice Hall, ISBN 0132733501; Kendall, M.G., Stewart, A., (1973) Advanced Statistics: Inference and Relationship, , 3d edition, Griffin: London, ISBN: 0852642156; Lebart, L., Morineau, A., Piron, M., (1995) Statistique Exploratoire Multidimensionelle, , Dunod, Paris, ISBN 2-10-002886-3; Lohninger, H., (1999) Teach Me Data Analysis, , Springer-Verlag, Berlin-New York-Tokyo, 1999. ISBN 3-540-14743-8; Manning, C.D., Raghavan, P., Schütze, H., (2008) Introduction to Information Retrieval, , Cambridge University Press; Mirkin, B., (2005) Clustering for Data Mining: A Data Recovery Approach, , Chapman & Hall/CRC; Mirkin, B., (2011) Core Concepts in Data Analysis: Summarization, Correlation, Visualization, , Springer, London; Mitchell, T.M., (2005) Machine Learning, , McGraw Hill; Soukup, T., Davidson, I., (2002) Visual Data Mining, , Wiley and Son; Tukey, J.W., (1977) Exploratory Data Analysis, , Addison- Wesley, Reading MA; Vapnik, V., (2006) Estimation of Dependences Based on Empirical Data, , Springer Science + Business Media Inc., 2d edition; Webb, A., (2002) Statistical Pattern Recognition, , Wiley and Son; Weiss, S.M., Indurkhya, N., Zhang, T., Damerau, F.J., (2005) Text Mining: Predictive Methods for Analyzing Unstructured Information, , Springer Science+Business Media. ISBN 0-387-95433-3"
"Poelmans J., Elzinga P., Neznanov A., Viaene S., Kuznetsov S.O., Ignatov D., Dedene G.","24504357900;24504058300;55329014600;55960020100;7202573378;56926915100;6603898706;","https://www.scopus.com/inward/record.uri?eid=2-s2.0-84890917510&partnerID=40&md5=ccac53312d1f38032ece9159fa0bdeca","Collier, P.M., Policing and the intelligent application of knowledge (2006) Public Money & Management, 26 (2), pp. 109-116; Elzinga, P., Poelmans, J., Viaene, S., Dedene, G., Morsing, S., Terrorist threat assessment with formal concept analysis (2010) Proc. IEEE International Conference on Intelligence and Security Informatics, pp. 77-82. , May 23-26, 2010 Vancouver, Canada. ISBN 978-1-42446460-9/10; Poelmans, J., Dedene, G., Verheyden, G., Van Der Mussele, H., Viaene, S., Peters, E., Combining business process and data discovery techniques for analyzing and improving integrated care pathways (2010) Lecture Notes in Computer Science, Advances in Data Mining. Applications and Theoretical Aspects, 10th Industrial Conference (ICDM), , Leipzig, Germany, July 12-14, 2010. Springer; Poelmans, J., Elzinga, P., Viaene, S., Dedene, G., A case of using formal concept analysis in combination with emergent self organizing maps for detecting domestic violence (2009) Lecture Notes in Artificial Intelligence, 5633 (11), p. 402. , Perner, P. (Eds.). Industrial conference on data mining ICDM 2009. Leipzig (Germany), 20-22 July 2009; Poelmans, J., Elzinga, P., Viaene, S., Dedene, G., Formal concept analysis in knowledge discovery: A survey (2010) Lecture Notes in Computer Science, 6208, pp. 139-153. , 18th international conference on conceptual structures (ICCS 2010): from information to intelligence 26-30 July, Kuching, Sarawak, Malaysia. Springer; Rabiner, L.R., A tutorial on hidden markov models and selected applications in speech recognition (1989) Proceedings IEEE, 77 (2), pp. 257-286; Stumme, G., Wille, R., Wille, U., Conceptual knowledge discovery in databases using formal concept analysis methods (1998) PKDD, pp. 450-458; Ultsch, A., Maps for visualization of high-dimensional data spaces (2003) Proc. WSOM'03, pp. 225-230. , Kyushu, Japan; Ultsch, A., Hermann, L., Architecture of emergent self-organizing maps to reduce projection errors (2005) Proc. ESANN 2005, pp. 1-6; Wille, R., (1982) Restructuring Lattice Theory: An Approach Based on Hierarchies of Concepts, 1, pp. 445-470. , Rival (Ed.): Ordered sets, Reidel. Dordrecht-Boston; Wolff, K.E., States, transitions and life tracks in temporal concept analysis (2005) Formal Concept Analysis, LNAI 3626, pp. 127-148. , B. Ganter et al. (Eds.). Springer, Heidelberg"
"Braverman A., Feigin B., Finkelberg M., Rybnikov L.","7005928142;7006562936;6602282553;26031611100;","https://www.scopus.com/inward/record.uri?eid=2-s2.0-80355144467&doi=10.1007%2fs00220-011-1300-3&partnerID=40&md5=603acdb1f777f90f3e951aed2f82600b","Alday, L.F., Gaiotto, D., Gukov, S., Tachikawa, Y., Verlinde, H., Loop and surface operators in N = 2 gauge theory and Liouville modular geometry (2010) Jhep, 1001, p. 113; Alday, L.F., Gaiotto, D., Tachikawa, Y., Liouville correlation functions from four-dimensional gauge theories. Lett (2010) Math. Phys., 91 (2), pp. 167-197; Alday, L.F., Tachikawa, Y., Affine SL(2) conformal blocks from 4d gauge theories (2010) Lett. Math. Phys., 94 (1), pp. 87-114; Awata, H., Yamada, Y., Five-dimensional AGT Relation and the deformed β-ensemble (2010) Prog. Theor. Phys., 124, pp. 227-262; Braverman, A., Instanton counting via affine Lie algebras. I. Equivariant J-functions of (affine) flag manifolds and Whittaker vectors (2004) Algebraic structures and moduli spaces, CRM Proc, pp. 113-132. , Lecture Notes 38, Providence, RI: Amer. Math. Soc; Braverman, A., Spaces of quasi-maps and their applications (2006) International Congress of Mathematicians, (II), pp. 1145-1170. , Zürich: Eur. Math. Soc; Braverman, A., Etingof, P., (2006) Instanton Counting via Affine Lie Algebras II: From Whittaker Vectors to the Seiberg-Witten Prepotential. In: Studies in Lie Theory, Progr. Math., 243, pp. 61-78. , Boston: Birkhäuser Boston; Braverman, A., Finkelberg, M., Gaitsgory, D., (2006) Uhlenbeck Spaces via Affine Lie Algebras. In: The Unity of Mathematics (Volume Dedicated to I. M. Gelfand's 90th Birthday), Progr. Math. 244, pp. 17-135. , Boston, MA: Birkhäuser Boston; Braverman, A., Finkelberg, M., Gaitsgory, D., Mirković, I., Intersection cohomology of Drinfeld's compactifications (2002) Selecta Math. (N.S.), 8 (3), pp. 381-418; Brundan, J., Goodwin, S.M., Good grading polytopes (2007) Proc. London Math. Soc., 94, pp. 155-180; Brundan, J., Goodwin, S., Kleshchev, A., Highest weight theory for finite W-algebras (2008) Int. Math. Res. Not, p. 53. , Art. ID rnn051,(2008; Brundan, J., Kleshchev, A., (2008) Representations of Shifted Yangians and Finite W-Algebras. Mem. Amer. Math. Soc. 196, No. 918, , Providence, RI: Amer. Math. Soc; Etingof, P., (1999) Whittaker Functions on Quantum Groups and Q-Deformed Toda Operators. In: Differential Topology, Infinite-Dimensional Lie Algebras, and Applications, pp. 9-25. , Providence, RI: Amer. Math. Soc; Feigin, B., Frenkel, E., Representations of affine Kac-Moody algebras, bosonization and resolutions (1990) Lett. Math. Phys., 19, pp. 307-317; Finkelberg, M., Mirković, I., Semi-Infinite Flags. I. Case of Global Curve ℙ1 (1999) Differential Topology, Infinite-Dimensional Lie Algebras, and Applications, pp. 81-112. , Providence, RI: Amer. Math. Soc; Feigin, B., Finkelberg, M., Kuznetsov, A., Mirković, I., (1999) Semi-Infinite Flags. II. Local and Global Intersection Cohomology of Quasimaps' Spaces. In: Differential Topology, Infinite-Dimensional Lie Algebras, and Applications, pp. 113-148. , Providence, RI: Amer. Math. Soc; Feigin, B., Finkelberg, M., Negut, A., Rybnikov, L., Yangians and cohomology rings of Laumon spaces (2011) Selecta Math, , http://arxiv.org/abs/0812.4656v4, math. AG],to appear; Futorny, V., Molev, A., Ovsienko, S., Gelfand-Tsetlin bases for representations of finite W-algebras and shifted Yangians (2008) Lie theory and its applications in physics VII, pp. 352-363. , H. D. Doebner, V. K. Dobrev, eds., Proceedings of the VII International Workshop, Varna, Bulgaria, June 2007, Sofia: Heron Press; Givental, A., Kim, B., Quantum cohomology of flag manifolds and Toda lattices. Commun (1995) Math. Phys., 168 (3), pp. 609-641; Kim, B., cohomology of flag manifolds G/B and quantum Toda lattices (1999) Ann. Of Math., 149 (2), pp. 129-148; Laumon, G., Un Analogue Global du Cône Nilpotent (1988) Duke Math. J, 57, pp. 647-671; Laumon, G., Faisceaux Automorphes Liés aux Séries d'Eisenstein (1990) Perspect. Math., 10, pp. 227-281; Mironov, A., Morozov, A., On AGT relation in the case of U(3) (2010) Nucl. Phys. B, 825, pp. 1-37; Marshakov, A., Mironov, A., Morozov, A., On non-conformal limit of the AGT relations (2009) Phys. Lett. B, 682 (1), pp. 125-129; Maulik, D., Okounkov, A., Preparation; Taki, M., On AGT Conjecture for Pure Super Yang-Mills and W-algebra (2011) Jhep, 1105, p. 038"
"Smirnova N.V., Matveeva L.A.","56678323800;54795617700;","https://www.scopus.com/inward/record.uri?eid=2-s2.0-84555191623&doi=10.1016%2fj.sbspro.2011.11.203&partnerID=40&md5=61246546b94b4f80e1b44a2b6e83d709","Anderson, G.R., (2002) Cognitive Psychology, p. 496. , St. Petersburg: Piter; Bruner, G., Psychology of cognition: Beyond the limits of immediate information (1997) Translation from English, p. 412. , Moscow: Progress; Davydov, V.V., (1994) Psychological Problems in Teaching Young Learners. Age Psychology, pp. 160-163. , Edited by Feldshtein D. I. Moscow; Elkonin, D.B., (1989) Collection of Works on Psychology, p. 554. , Moscow: Pedagogika; Eremeeva, V.D., Chrisman, T.P., (2001) Boys and Girls - Two Worlds Apart, p. 184. , St. Petersburg: Tuskarora; Flavell, G.H., (1967) Genetic Psychology by J.Piege, p. 623. , Moscow: Prosvechenye; Galpirin, P.J., (1998) Psychology As Objective Science. Collection of Works on Psychology, p. 480. , Edited by Podolsky A. I. Voronezh; Gamezo, M.V., (1975) Theoretical Issues of Managing Human Cognitive Processes. about the Role and Functions of Signs and Sign Models in Managing Human Cognitive Processes, , Moscow; Glotova, G.A., (1990) Human and Sign. Semiotic-psychological Aspects of Human Ontogenesis, p. 253. , Sverdlovsk: Izdatelstvo Uralskogo Universiteta; Korshunov, A.M., (1979) Reflection, Activity, Cognition, p. 216. , Moscow: Politizdat; Leontyev, A.N., (1983) Collection of Works on Psychology, , Moscow: Pedogogika; Lindsay, P.H., Norman, D.A., (1974) Human Information Processing, p. 550. , Moscow: Mir; Lomov, B.F., (1959) Forming Graphical Knowledge and Skills with School Learners, p. 206. , Moscow: Izdatelstvo APN RSFCR; Matveeva, L.A., Young learner as an object and a subject of pedagogical influence (1989) Encoding, Prediction and Projection As Characteristics of the Young Learner Being the Subject of Learning Process, pp. 14-30. , Leningrad: LSPI; Piege, J., (1997) Speech and Cognition of A Child, p. 250. , St. Petersburg: Souz; Raev, A.I., The problem of developing cognitive processes (1983) Prediction, Encoding, and Projection As Cognitive Processes, pp. 21-33. , Leningrad; Rubinshtein, S.L., (1999) The Foundations of Psychology, p. 720. , St.Petersburg: Piterkom; Salmina, N.G., (1988) Sign and Symbol in Learning Process, p. 287. , Moscow: MSU; Solso, R.L., (1996) Cognitive Psychology, p. 600. , Moscow: Trivola; Turchin, A.S., Peculiarities of sign-symbolic development in ontogenesis (2006) Psychology, pp. 65-71. , Vestnik KSU by N.A.Nekrasov, (12th issue, #4; Vygotsky, L.S., (1983) The History of Development of Higher Psychic Functions, , (3rd. issue). Moscow; Zakharov, A.I., (2000) Nature of Child's Neurosis and Psychotherapy, p. 448. , Moscow: Izdatelstvo EKSMO-Press; Zinchenko, T.P., (1981) Recognizing and Encoding, p. 183. , Leningrad: Izdatelstvo Leningradskogo Universiteta"
"Costa A.F., Gusein-Zade S.M., Natanzon S.M.","24781683700;6701783976;6603742412;","https://www.scopus.com/inward/record.uri?eid=2-s2.0-84864271024&doi=10.1512%2fiumj.2011.60.4296&partnerID=40&md5=8115c288b01abc0c6eb65ed77d323de2","Alexeevski, A.V., Natanzon, S.M., Noncommutative two-dimensional topological field theories and Hurwitz numbers for real algebraic curves (2006) Selecta Math. (N.S.), 12 (3-4), pp. 307-377. , http://dx.doi.org/10.1007/s00029-006-0028-y, MR2305607 (2008a:57032); Alexeevski, A.V., Natanzon, S.M., Algebra of Hurwitz numbers of seamed surfaces (2006) Uspekhi Mat. Nauk, 61 (4-370), pp. 185-186. , Russian; (2006) Russian Math. Surveys, 61 (4), pp. 767-769. , http://dx.doi.org/10.1070/RM2006v061n04ABEH004345, English transl. MR2278840 (2007g:30064); Alexeevski, A.V., Natanzon, S.M., The algebra of bipartite graphs and Hurwitz numbers of seamed surfaces (2008) Izv. Ross. Akad. Nauk Ser. Mat., 72 (4), pp. 3-24. , Russian, with Russian summary; (2008) Izv. Math., 72 (4), pp. 627-646. , http://dx.doi.org/10.1070/IM2008v072n04ABEH002416, MR2452231 (2009i:57066); Alexeevski, A.V., Natanzon, S.M., Hurwitz numbers for regular coverings of surfaces by seamed surfaces and Cardy-Frobenius algebras of finite groups (2008) Geometry, Topology, and Mathematical Physics, Amer. Math. Soc. Transl. Ser. 2, 224, pp. 1-25. , Amer.Math. Soc., Providence, RI. MR2462353 (2010b:57041); Alling, N.L., Greenleaf, N., Foundations of the theory of klein surfaces (1971) Lecture Notes in Mathematics, 219. , Springer-Verlag, Berlin. MR0333163 (48 #11488); Baez, J.C., An introduction to spin foam models of BF theory and quantum gravity (1999) Geometry and Quantum Physics, 543, pp. 25-93. , http://dx.doi.org/10.1007/3-540-46552-92, (Schladming), Lecture Notes in Phys., Springer, Berlin. MR1770708 (2001g:83047); Bujalance, E., Etayo, J.J., Gamboa, J.M., Gromadzki, G., Automorphism groups of compact bordered klein surfaces: A combinatorial approach (1990) Lecture Notes in Mathematics, 1439. , Springer-Verlag, Berlin. MR1075411 (92a:14018); Costa, A.F., Natanzon, S.M., Porto, A.M., Counting the regular coverings of surfaces using the center of a group algebra (2006) European Journal of Combinatorics, 27 (2), pp. 228-234. , DOI 10.1016/j.ejc.2004.09.001, PII S0195669804001751; Hartnoll, S.A., Policastro, G., Spacetime foam in twistor string theory (2006) Adv. Theor. Math. Phys., 10 (2), pp. 181-216. , MR2249570 (2008b:81270); Kerekjarto, B., (1923) Vorlesungen Uber Topologie. 1. Flachentopologie, , Springer-Verlag, Berlin; Khovanov, M., Sl(3) link homology (2004) Algebr. Geom. Topol., 4, pp. 1045-1081. , http://dx.doi.org/10.2140/agt.2004.4.1045, electronic. MR2100691 (2005g:57032); Khovanov, M., Rozansky, L., Matrix factorizations and link homology (2008) Fund. Math., 199 (1), pp. 1-91. , http://dx.doi.org/10.4064/fm199-1-1, MR2391017 (2010a:57011); Khovanov, M., Rozansky, L., Topological Landau-Ginzburg models on the world-sheet foam (2007) Adv. Theor. Math. Phys., 11 (2), pp. 233-259. , MR2322554 (2009b:81181); Loktev, S., Natanzon, S.M., Generalized Topological Field Theories from Group Representations, , arXiv:math/0910. 3813; Miković, A., Spin Foam Models of String Theory, , arXiv:hep-th/0502092; MacKaay, M., Stošić, M., Vaz, P., Sl(N)-link homology (N ≥ 4) using foams and the Kapustin-Li formula (2009) Geom. Topol., 13 (2), pp. 1075-1128. , http://dx.doi.org/10.2140/gt.2009.13.1075, MR2491657 (2010h:57019); Natanzon, S.M., Cyclic Foam Topological Field Theory, , arXiv:math/0712. 3557; Natanzon, S.M., Klein surfaces (1990) Uspekhi Mat. Nauk, 45 (6-276), pp. 47-90. , 189 (Russian); (1990) Russian Math. Surveys, 45 (6), pp. 53-108. , http://dx.doi.org/10.1070/RM1990v045n06ABEH002713, English transl. MR1101332 (92i:14029); Natanzon, S.M., Moduli of real algebraic curves (1975) Uspehi Mat. Nauk, 30 (1-181), pp. 251-252. , (Russian). MR0407032 (53 #10815); Natanzon, S.M., Spaces of moduli of real curves (1978) Trudy Moskov. Mat. Obshch., 37, pp. 219-253. , 270 (Russian). MR514332 (82d:14018); Natanzon, S.M., Moduli of riemann surfaces, real algebraic curves, and their superanalogs (2004) Translations of Mathematical Monographs, 225. , American Mathematical Society, Providence, RI. Translated from the 2003 Russian edition by Sergei Lando. MR2075914 (2005d:32020); Oriti, D., Spin Foam Models of Quantum Space-time, , arXiv:gr-qc/0311066; Seppälä, M., Teichmüller spaces of Klein surfaces (1978) Ann. Acad. Sci. Fenn. Ser. A i Math. Dissertationes, 15, p. 37. , MR503039 (80g:32043); Porter, T., Turaev, V., Formal homotopy quantum field theories. I. Formal maps and crossed C-algebras (2008) J. Homotopy Relat. Struct., 3 (1), pp. 113-159. , MR2426178 (2009e:18025); Rozansky, L., Topological A-models on seamed Riemann surfaces (2007) Adv. Theor. Math. Phys., 11 (4), pp. 517-529. , MR2354074 (2008h:81156); Turaev, V., Turner, P., Unoriented topological quantum field theory and link homology (2006) Algebr. Geom. Topol., 6, pp. 1069-1093. , http://dx.doi.org/10.2140/agt.2006.6.1069, MR2253441 (2007f:57061)"
