Авторы,Идентификаторы авторов,Ссылка,Пристатейные ссылки
"Abalmasova N.E., Pain E.A.","55062296800;26868038700;","https://www.scopus.com/inward/record.uri?eid=2-s2.0-84922152815&doi=10.1134%2fS2079970511030026&partnerID=40&md5=93b92c247d6898c83e9bdb8f2d6b655c","Bourdieu, P., (2001) Prakticheskii Smysl (Practical Reason), , St. Petersburg: Aleteiya; Burtseva, T.A., Kuznetsova, A.V., Vorozhtsov, S.N., Regional brand management (2009) Marketing v Rossii i Zarubezhom, 69 (1), pp. 115-126; Vazhenina, I.S., Vazhenin, S.G., Image, reputation and trade brand (2008) EKO. Vseros. Ekon. Zhurnal, 8, pp. 3-16; Gel'man, V.Y., Political elites and strategies of regional identity (2003) Zh. Sotsiologii i sotsial'Noi Antropologii, 4 (2); Results of public-art program 2010 (2011) Sergey Gorshkovs' Project ""Angels in City"", , http://art59.ru/index.php?option=com-content&task=view&id=1717&Itemid=124, Cited February 26; Ilyumzhinov, K., Kalmykia is open for the world Parlamentskii Vestnik Kalmykii. 20.10.2010 (Kalmykiya Parliament Bulletin, 20.10.2010), 378 (81), p. 3; Kotler, F., (2005) Marketing Mest (Local Marketing), , St. Petersburg: Izd. Stockholmskaya Econom. Shkola v St. Petersburg; Koshelyuk, M.E., (2003) Tekhnologii Politicheskikh Vyborov (Technologies of Political Elections), , St. Petersburg: Piter; Krylov, M.P., (2010) Regional'Naya Identichnost' in Evropeyskoy Rissii (Regional Identity in European Part of Russia), , Moscow: Novii Khronograph; Krylov, M.P., Regional identity in historical core of European part of Russia (2005) Sociol. Issledovaniya, 3, pp. 13-23. , http://www.ecsocman.edu.rudata0276631216002-1.pdf, Cited November 10, 2010; Malinova, O.Y., Symbolic politics and design of macropolitical identity in post-soviet Russia (2010) Politicheskie Issledovaniya, 2, pp. 90-105; Morozov, A., (2009) Alisa Aksenova: Mayor of Suzdal' Was Retired. The Problems Remain, 7687 (24). , http://archi.ru/events/news/news-current-press.html?nid=17426&fl=1&sl=1, Portal Cultura, June 25, Cited April 7, 2011; Pavlova, E., (2011) Contemporary Art Emerged from A Museum and Walking Through the Dangerous City, , http://www.permmag.ru/article/node/public-art-indacity/, Cited February 26; Pain, E.A., Multicultural modernization: Evolution of theoretical views (2009) Obshchestvennye Nauki i Sovremennost' (Social Sciences and the Present), 6, pp. 37-54; Pain, E.A., (2009) Rasputitsa: Polemicheskie Rassuzhdeniya O Predopredelennosti Puti Rossii (Cross-road: Polemic Arguments on Providential Path of Russia), , Moscow: ROSSPEN; Pankrukhin, A.P., (2006) Marketing Territorii (Territorial Marketing), , St. Petersburg: Piter; Pakhomova, L.F., (2007) Modeli Protsvetaniya (Singapur, Malaziya, Tayland, Indoneziya) (Welfare Model (Singapore, Malaysia, Thailand, Indonesia)), , Moscow: Inst. Vostokovedeniya RAN; (2001) Politika i kul'Tura v Rossiyskoy Provintsii. Novgorodskaya, Voronezhskaya, Saratovskaya, Sverdlovskaya Oblsti (Politics and Culture in Russian Province. Novgorod, Voronezh, Saratov and Sverdlovsk Regions), , Vyzhenkov, S., Lukhterkhandt-Mikhaleva, G. and Kuz'mina, A., Eds., Moscow, St. Petersburg: Letnii Sad; Rozhkov, I.Y., (2006) Imidzhi Kitaya v Kontekste PR i Reklami (China Images in PR and Advertising Context), , Moscow: MGIMO (U) MID Rossii; Rozhkov, I.Y., Kismereshkin, V.G., (2006) Brendi i Imidzhi (Brands and Images), , Moscow: RIP-Kholding; Sogomonov, A., Contemporary city: Strategy of identity (2010) Neprikosnovennii Zapas, 2, pp. 244-254; Firsov, G.G., (2011) Spory O Ponyatii Public Art Kak Otrazhenie Razlichnikh Techenii Vnutri Samogo Public Art (Discussions on Public Art Definition As Reflection of Different Tendencies Inside of Public Art), , http://propublicart.ru/publication?id=12, Accessed February 26; Fukuyama, F., (2010) Velikii Razryv. Glava 1. Igra Po Pravilam (the Great Distruption: Human Nature and the Reconstitution of Social Order. Chapter 1. Play by the Rules), , http://www.gumer.info/bibliotek-Buks/Polit/fuku/01.php, Accessed December 3; Harrison, L., (2008) Glavnaya Istina Liberalizma: Kak Politika Mozhet Izmenit' kul'Turu i Spasti Eyo Ot Samoy Sebya (The Central Liberal Truth: How Politics Can Change A Culture and Save It from Itself), , Moscow: Novoe Izd; Shestopal, E.B., (2008) Obrazy Rossiyskoi Vlasti: Ot el'Tsina Do Putina (Characters of Russian Authority: From el'Tsin to Putin), , Moscow: ROSSPEN; Anholt, S., (2007) Competitive Identity. The New Brand Management for Nations, Cities and Regions, , Houndmills: Palgrave Macmillan; Anholt, S., Place branding: Is it marketing, or isn't it? (2007) Place Branding and Public Diplomacy, 4, pp. 1-4; Aronczyk, M., (2008) Branding the Nation: Mediating Space, Value, and Identity in the Context of Global Culture, , New York: New York University; Gvozdev, N., Re-imaging the orthodox tradition: Nurturing democratic values in Christian orthodox civilization (2008) Glavnaya Istina Liberalizma: Kak Politika Mozhet Izmenit' kul'Turu i Spasti Eyo Ot Samoy Sebya (The Central Liberal Truth: How Politics Can Change A Culture and Save It from Itself), pp. 10-11. , Harrison, L. Moscow: Novoe Izd; Kahn, J.A., Brand - New Approach (2006) Foreign Policy, 11 (12), pp. 90-92. , no. 157; Lloyd, G., Peel, D., New communicative challenges: Dundee, place branding and the reconstruction of a city image (2008) TPR, 79 (5), pp. 507-531; Ogilvy, G., Dundee, A Voyage of Discovery, pp. 13-28. , Edinburgh: Mainstream Publishing; Pasquinelli, C., The limits of place branding for local development: The case of tuscany and the arnovalley brand (2010) Local Economy, 25 (7), pp. 558-572; Petro, N., A tale of two regions: Novgorod and pskov as models of symbolic development (2008) Glavnaya Istina Liberalizma: Kak Politika Mozhet Izmenit' kul'Turu i Spasti Eyo Ot Samoy Sebya (The Central Liberal Truth: How Politics Can Change A Culture and Save It from Itself), p. 10. , Harrison, L., Moscow: Novoe Izd., 2008; Petro, N., Novgorod region: A Russian success story (2001) Post-Soviet Affairs, 15 (3); Pfeffer, J., (1992) Managing with Power: Politics and Influence in Organizations, , Harvard: Harvard Business School Press; Rostow, W.W., (1971) Politics and the Stages of Growth, , Cambridge: Cambridge University Press"
"Mkrtchyan N.V.","54788001400;","https://www.scopus.com/inward/record.uri?eid=2-s2.0-84922068554&doi=10.1134%2fS2079970511020110&partnerID=40&md5=f6bdf17d628e63541014c9714c1d2c7b","Rossii, N., (1993) Ezhegodnyi Demograficheskii Doklad (Population of Russia in 1993. Annual Demographic Report), p. 64. , Vishnevskii, A.G. and Zakharov, S.V., Eds., Moscow 1993"
"Savchenko A.V.","42962245900;","https://www.scopus.com/inward/record.uri?eid=2-s2.0-84926232662&partnerID=40&md5=835ab1700e7155b73ee3fa1389f1cf0c","Theodoridis, S., (2009) Pattern Recognition, 840p. , S. Theodoridis, C. Koutroumbas. - Elsevier Inc. - 4th Edition; Forsyth, D.A., (2003) Computer Vision: A Modern Approach, 693p. , D.A. Forsyth, J. Ponce Upper Saddle River, NJ: Prentice Hall; (2005) Face Processing: Advanced Modeling and Methods, 768p. , edited by W. Zhao, R. Chellappa. - Elsevier: Academic Press; Kullback, S., (1978) Information Theory and Statistics, 408p. , S. Kullback. - Dover Pub; Savchenko, V.V., Information theory of speech perception (2007) Izvestia vuzov Rossii. Radioelektronika, 6, pp. 3-9. , (in Russian) V.V. Savchenko; Savchenko, A.V., Method of directed enumeration of alternatives in the problem of automatic recognition of halftone images (2009) Optoelectronics, Instrumentation and Data Processing, 3 (45), pp. 255-261. , A.V. Savchenko (in Russian); Fukunaga, K., (1991) Introduction to Statistical Pattern Recognition, 591p. , 2nd ed. K. Fukunaga. - New York: Academic Press, Inc; Myasnikov, V.V., Analysis of the methods for construction of linear local features (2010) Computer optics, 34 (3), pp. 193-201. , (in Russian) V.V. Myasnikov, A.U. Bavrina, O.A. Titova; Shapiro, L., (2001) Computer vision, 752p. , L. Shapiro, G. Stockman. - Prentice Hall; Bibikov, S.A., Correction of shadow artifacts on colorful digital images (2010) Computer optics, 34 (1), pp. 124-131. , (In Russian) S.A. Bibikov, A.V. Nikonorov, V.A. Fursov; Swain, M.J., Color indexing (1991) International Journal of Computer Vision, pp. 11-32. , M.J. Swain, D.H. Ballard; Wong, K.M., Dominant Color Image Retrieval using Merged Histogram (2003) Proc. the 2003 Int. Symposium, 2, pp. 908-911. , K.M. Wong, C.H. Cheung, L.M. Po; Yoo, G.-H., Content-based image retrieval using shifted histogram (2007) ICCS, LNCS 4489, pp. 894-897. , Gi-Hyoung Yoo, Beob Kyun Kim and Kang Soo You; Shi, J., Normalized cuts and image segmentation (1997) IEEE Conference Computer Vision and pattern Recognition, pp. 731-737. , J. Shi, L. Sandford, J. Ponce; Kukharev, G.A., Find pictures of persons in large databases (2009) World measurement, 4 (98), pp. 22-30. , (in Russian) G.A. Kukharev; Kohonen, T., (2001) Self Organizing Maps, 500p. , T. Kohonen. - New York: Springer Berlin Heidelberg; Tsypkin, Y.Z., (1968) Adaptation and training in automated systems, 400p. , Y.Z. Tsypkin - Moscow: ""Nauka"" Publisher - (in Russian); Savchenko, A.V., (2011) Pattern recognition: Method of directed enumeration of alternatives in the classification problem with large database, 140p. , A.V. Savchenko / Lambert Academic Publishing - (in Russian); Beis, J., Shape indexing using approximate nearest-neighbour search in highdimensional spaces (1997) Conference on Computer Vision and Pattern Recognition, pp. 1000-1006. , J. Beis, D.G. Lowe; Fursov, V.A., Face recognition on the basis of conjugation indexes in the space of summarizing invariants (2008) Computer optics, 32 (4), pp. 400-402. , (in Russian) V.A. Rursov, N.E. Kozin; Kukharev, G.A., Algorithms of two-dimensional principal component analysis for face recognition (2010) Computer optics, 34 (4), pp. 119-125. , (in Russian) G.A. Kukharev, N.L. Schegoleva; Savchenko, A.V., Automated system for face recognition Computer program. The certificate of state registration N 2009616508 under the demand on 2009615314 from 28.09.2009, , A.V. Savchenko (in Russian); The Essex Face database, , http://cswww.essex.ac.uk/mv/allfaces/index.html; The AT&T (ORL) database, , www.uk.research.att.com/pub/data/att_faces.zip"
"Mkrtchyan N.V.","54788001400;","https://www.scopus.com/inward/record.uri?eid=2-s2.0-84922161254&doi=10.1134%2fS2079970511030087&partnerID=40&md5=cac748c28dd5f2da7cecbd062025aca7","A Teper' O Tom, Chto Proizoshlo v Severnom Tushino? (What is Happened in Severnoe Tushino?), , http://itogi-perepisi.livejournal.com/2384.html, Blog ""Itogi perepisi 2010""; Bogoyavlenskii, D., Vse li rossiskie narody verno poschitali? (Were Russian Nationalities Correctly Counted?) (2008) Demo Scope Weekly, 319-320. , http://demoscope.ru/weekly/2008/0319/tema01.php, February 4-17; (2002) V Perepisi Uchavstovalo 93% Naseleniya Strany (93% of Country Population Are Participated in Census), , www.strana.ru, Accessed October 23; VTsIOM, , http://wciom.ru/index.php?id=195&uid=13982, Press-issue no. 1621; Gaifullin, R., (2010) Nashli Zemlyu Za Volgoi (Land behind the Volga), , Kommersant in Volgograd. Accessed March 13; Don capital does not agree to lose a status of city million (2010) Panorama, Rostov Region, , Cited September 24; Zaionchkovskaya, Z.A., Mkrtchyan, N.V., A role of migration in dynamics of number and composition of Moscow population (2009) Immigranty v Moskve (Immigrants in Moscow), pp. 18-44. , Zaionchkovskaya, Zh.A., Ed; Il'ichev, G., Lot, M., (2011) Novaya Gazeta, , March 30; (2002) Informatsionnyi-statisticheskii Sbornik FMS MVD Rossii (Information and Statistic Bulletin of Russian FMS MVD), 1, p. 53. , Moscow; Kvasha, M., Glushenkova, M., Population in diminution order (2011) Den'Gi, , April 4; (2010) Levada-Tsentr, , http://www.levada.ru/press/2010110101.html, News Release November 1; Maksudov, S., Chechnya population: Is census correct? (2005) Naselenie i Obshchestvo, 96; Russian minister on chechnya affairs doubts on reliability of the results of population census in Republic of Chechnya (2002) RIA Novosti, , Cited October 30; Mkrtchyan, N.V., Migration in South federal district (2003) Problemy Migratsii i Opyt Ee Regulirovaniya v Polietnicheskom Kavkazskom Regione, Tezisy Mezhdunarodnoi Nauchnoi Konferentsii (Migration Problems and Experience of Its Control in Poly-Ethical Caucasian Region, Abstract of Papers, the International Scientific Conference), pp. 156-164. , Stavropol': Izd. SGU; Mkrtchyan, N., (2005) Migration in Russia: Western Drift, 185-186. , http://demoscope.ru/weekly/2005/0185/tema01.php, Demoscope Weekly. January 10-23; (2006) Naselenie Rossii 2003-2004. Odinadtsatyi-dvenadtsatyi Ezhegodnyi Demographicheskii Doklad (Population of Russia 2003-2004. Eleventh-Twelve Annual Demographic Report), p. 356. , Vishnevskii, A.G., Ed., Moscow: Nauka; (2007) Naselenie Rossii 2003-2005. Trinadtsatyi Ezhegodnyi Demographicheskii Doklad (Population of Russia 2005. Thirteenth Annual Demographic Report), p. 245. , Vishnevskii, A.G., Ed., Moscow: Izd. Dom GU VShE; Petrova, A.S., Each Fifth Was Not Taken A Census in Moscow, , http://www.fom.ru/reports/frames/of024002.html, Website of Public Opinion Fund; Prokhorova, A., (2010) Imaging Russia, , http://www.polit.ru/analytics/2010/11/11/perepis.html, Accessed November 11; Prytkov, R., (2010) Voronezh Never Became A City of Million Population, , http://www.perepis-2010.ru/smi/detail.php?ID=5690, Moe! Online. October 9; (2010) Rosstat. Press-Release, , Accessed November 3; Surinov, A., Who we are? (2010) Rossiiskaya Gazeta, , March 28; (2010) Frontir, 2, pp. 24-27; Khloponin focuses the straggle with falsification of population census in NCFD (2010) Interfaks, , Cited September 24; Chudinovskikh, O.S., Critical level of migration registration in Russia (2004) Voprosy Statistiki, 10, pp. 27-36; Chudinovskikh, O., (2008) Migration Statistics is Hardly Registering Everything, 335-336. , http://demoscope.ru/weekly/2008/0335/tema01.php, Demoscope Weekly. Cited June 2-15; (2010) Expert Meeting ""Consensus Evaluation of Population of Labor Migrants in Russia"", , http://www.indem.ru/Ceprs/Migration/OsItExSo.htm, Moscow. General Results. Accessed July"
"Gordin V.E.","55903521700;","https://www.scopus.com/inward/record.uri?eid=2-s2.0-84922201908&doi=10.1134%2fS2079970511040046&partnerID=40&md5=aa77294e0c3515b6fa64c0a64f9e0e2a","(2000) Vozrozhdenie Gorodov Cherez kul'Turu (Urban Rebirth Through Culture), , St. Petersburg: Notabene; Gordin, V., Sushchinskaya, M., Yatskevich, I., Theoretical and practical approaches to development of cultural tourism (2001) Kul'Turnyi Turizm: Konvergentsiya kul'Tury i Turizma Na Poroge XXi Veka (Cultural Tourism: Convergence of Culture and Tourism on the Threshold of XXi Century), pp. 144-146. , Braun, Ya., Andersen, V. and Gordin, V., Eds., St. Petersburg: SPb GUEF; Ille, M., Activity of St. Petersburg citizens in consumption of art literature (2007) Teleskop: Zhurnal Sotsiologicheskikh i Marketingovykh Issledovanii, (2); Karpova, G.A., (2002) Rynochnoe Regulirovanie v Turizme (Market Regulation in Tourism), , St. Petersburg: SPb GUEF; Kvartal'nov, V.A., (2002) Turizm (Tourism), , Moscow: Finansy i Statistika; (2009) Kommersant (Business Man), , Cited on January 30; Nikeshin, N.A., Rybakova, Y.L., World expansion of cultural tourism (2008) Materialy Foruma Po v'Ezdnomu i Vnutrennemu Turizmu ""Novyi Vzglyad Na Rossiyu"" (Transactions of Forum on Inbound and Domestic Tourism ""New Look on Russia""), pp. 3-4. , St. Petersburg; ICOMOS, (2002) International Tourism Charter; Cultural Tourism in Europe, CAB International, pp. 3-18. , Richards, G., Ed., Oxon, UK; Official Web Portal of Administration of St. Petersburg, , http://www.gov.spb.ru/day/cultur, Culture; http://www.gov.spb.ru/gov/admin/otrasl/invest; http://www.gov.spb.ru/gov/admin/otrasl/invest/turcentr/555program; Privatization of Russian Architectural Monuments and the Development of Hotel Business, , http://www.yurclub.ru/docs/civil/article99.html; http://www.save-spb.ru/page/politics; Russian Architecture Portal, , http://www.archi.ru/events; Baltic Travel Company - D.S.K., , http://www.tsarball/com/engl/spb/index/htm, Website"
"Gromov E., Logvinova K., Morozov V., Tyutin V.","56802827200;8284266700;37079439900;6603597680;","https://www.scopus.com/inward/record.uri?eid=2-s2.0-79961238208&partnerID=40&md5=f70f5d965f80944d48a76f2d5327ab3d","Dean, D.S., Drummong, L.L., Horgan, R.R., Perturbations schemes for flow in random media (1994) J. Phys. A: Math. Gen., 27, pp. 5135-5144; Stepanyants, Y.A., Teodorovich, E.V., Effective hydraulic conductivity of randomly heterogeneous porous medium (2003) Water Research, 39 (3-12), pp. 1-11; Erochenkova, G., Lima, R., A fractional diffusion equation a marker in porous media (2001) Chaos, 11 (3), pp. 495-499; Logvinova, K., Neel, M.-Cr., Fractional diffusion in heterogeneous media: Iterative metod (2004) Izvestia Ingeneronoi Akademii Nauk: Applied Mathematics and Mechanics, 7, pp. C33-C44. , in Russian; Logvinova, K.V., Neel, M.-Cr., A fractional equation for anomalous diffusion in a randomly heterogeneous porous media (2004) Chaos, 14 (4), pp. 982-987; Samko, S., Kilbas, A., Marichev, O., Fractional integrals and derivatives: Theory and applications (1993) Gordon and Breach Science Publishers, p. 996; Kozyrev, O., Logvinova, K., Models for the Average of the Solutions to a P. D. E. with Stochastic Coefficients (2010) European Journal of Scientific Research, 45 (3), pp. 383-390; Kozyrev, O., Logvinova, K., Small scale models for the spreading of matter in disordered porous media (2010) European Journal of Scientific Research, 45 (1), pp. 64-78; Kozyrev, O., Logvinova, K., Morozov, V., Disordered structures models for heterogeneous media (2011) European Journal of Scientific Research, 49 (3), pp. 464-467"
"Babkin E., Karpunina M., Aseeva N.","6701533991;55274973600;15847630900;","https://www.scopus.com/inward/record.uri?eid=2-s2.0-80054120269&doi=10.1007%2f978-3-642-24511-4_9&partnerID=40&md5=dd28b748c4d245f340d32c515cb0b963","Kant, K., Mohapatra, P., (2004) Computer, , Internet Data Centers. IEEE Computer Society, Los Alamitos 0018-9162/04; Babkin, E., Petrova, M., Application of genetic algorithms to increase an overall performance of artificial neural networks in the domain of synthesis DDBs optimal structures (2006) Information Techonology and Control, 35 (3 A), pp. 285-294. , Proc. of The 5th International Conference on Perspectives in Business Informatics Research (BIR 2006), Kaunas University of Technology, Lithuania, October 6-7. ISSN: 1392-124X; Kulba, V.V., Kovalevskiy, S.S., Kosyachenko, S.A., Sirotyuck, V.O., (1999) Theoretical Backgrounds of Designing Optimum Structures of the Distributed Databases, , M.: SINTEG; Chakrapani, J., Skorin-Kapov, J., Massively parallel tabu search for the quadratic assignment problem (1993) Annals of Operations Research, 41, pp. 327-341; Fiechter, C.-N., A parallel tabu search algorithm for large traveling salesman problems (1994) Discrete Applied Mathematics, 51, pp. 243-267; Garcia, B.-L., A parallel implementation of the tabu search heuristic for vehicle routing problems with time window constraints (1994) Computers Ops. Res., 21 (9), pp. 1025-1033; Porto Stella, C.S., Kitajima Joao Paulo, F.W., Ribeiro Celso, C., Performance evaluation of a parallel tabu search task scheduling algorithm (2000) Parallel Computing, 26, pp. 73-90; Babkin, E., Karpunina, M., Comparative study of the Tabu machine and Hopfield networks for discrete optimization problems (2008) Proc. of the 14th International Conference on Information and Software Technologies, IT 2008, Kaunas, Lithuania, April 24-25, pp. 25-41. , ISSN 2029-0020; Babkin, E., Karpunina, M., The analysis of tabu machine parameters applied to discrete optimization problems (2009) Proceedings of 2009 ACS/IEEE International Conference on Computer Systems and Aplications, AICCSA 2009, Rabat, Morocco, May 10-13, pp. 153-160. , http://www.congreso.us.es/aiccsa2009, Sponsored by IEEE Computer Society, Arab Computer Society, and EMI, Morocco IEEE Catalog Number: CFP09283-CDR. ISBN: 978-1-4244-3806-8. Library of Congress: 200990028; Sun, M., Nemati, H.R., Tabu Machine: A New Neural Network Solution Approach for Combinatorial Optimization Problems (2003) Journal of Heuristics, 9, pp. 5-27; Babkin, E., Karpunina, M., About one method of DDBs structure synthesis based on the Hopfield artificial neural networks (2005) Bulleten of Russian Academy of Engineering Science, Applied Mathematics and Mechanics, 12, pp. 37-46. , Prokchorov, A.M. (ed.) Moscow - Nizhny Novgorod: NSTU"
"Gurkov I., Settles A.","6603320551;53264788000;","https://www.scopus.com/inward/record.uri?eid=2-s2.0-84856389094&doi=10.2753%2fIMO0020-8825410400&partnerID=40&md5=5db41b0b40676799b8451f329ec2bea2","Dolgopyatova, T., Iwasaki, I., Yakovlev, A., (2009) Organization and Development of Russian Business: A Firm-level Analysis, , Basingstoke, UK: Palgrave Macmillan; Dorofeev, V., What does astonish (Me)? (2009) Supplement to Kommersant, 209 (4264), p. 6. , November 10 (in Russian); Gurkov, I., Change of control and business re-engineering in Russian privatized companies (1996) International Executive, 38 (3), pp. 359-388; Gurkov, I., Ownership and control in Russian privatised companies: New evidence from a repeated survey (1998) Communist Economies and Economic Transformation, 10 (2), pp. 259-270; Gurkov, I., Innovative actions and innovation (in)capabilities of Russian industrial companies - An extension of a quasi-longitudinal study (2006) Post-Communist Economies, 18 (3), pp. 297-313. , DOI 10.1080/14631370600881812, PII X3M32UT4J482TVW5; Gurkov, I., Strategy process as formulation and realization of corporate goals: The synthesis of surveys in Russian firms (2009) Journal for East European Management Studies, 14 (1), pp. 48-64; Gurkov, I., The strategy process in Russian non-strategic companies: Coping with economic recession (2009) Post-communist Economies, 21 (4), pp. 439-451; Gurkov, I., Asselbergs, G., Ownership and control in Russian privatized companies (1995) Communist Economies and Economic Transformations, 7 (2), pp. 238-256; Smirnov, D., To receive accordingly to the list (2009) Supplement to Kommersant, 209 (4264), p. 1. , November 10 (in Russian); (2009) Russian Economic Report, 19. , World Bank Washington, DC"
"Feigin E.","6701558236;","https://www.scopus.com/inward/record.uri?eid=2-s2.0-84861037408&doi=10.4310%2fMRL.2011.v18.n6.a8&partnerID=40&md5=6c6f7849811f2938d332bd44512f211f","Arzhantsev, I., Flag Varieties As Equivariant Compactifications of Gna, , arXiv: 1003.2358; Arzhantsev, I., Sharoiko, E., Hassett-Tschinkel Correspondence: Modality and Projective Hypersurfaces, , arXiv: 0912.1474; Barsky, D., (1980) Congruences pour les nombres de Genocchi de 2e esp̀ece, (34), p. 13. , Groupe d'étude d'Analyse ultramétrique, 8e année; Dellac, H., Problem 1735 (1900) L'Intermédiaire des Mathématiciens, 7, pp. 9-10; Dumont, D., Interprétations combinatoires des nombres de Genocchi (1974) Duke Math. J., 41, pp. 305-318; Dumont, D., Randrianarivony, A., Dérangements et nombres de Genocchi (1994) Discrete Math., 132, pp. 37-49; Dumont, D., Zeng, J., Further results on Euler and Genocchi numbers (1994) Aequationes Mathemicae, 47, pp. 31-42; Feigin, E., The PBW filtration (2009) Represent. Theory, 13, pp. 165-181; Feigin, E., The PBW filtration, Demazure modules and toroidal current algebras (2008) SIGMA, 4 (70), p. 21; Feigin, E., GMa Degeneration of Flag Varieties, , arXiv: 1007.0646; Fulton, W., (1997) Young Tableaux, with Applications to Representation Theory and Geometry, , Cambridge University Press; Feigin, E., Fourier, G., Littelmann, P., PBW Filtration and Bases for Irreducible Modules in Type An, , arXiv: 1002.0674; Feigin, E., Fourier, G., Littelmann, P., PBW Filtration and Bases for Symplectic Lie Algebras, , arXiv: 1010.2321; Gessel, I.M., Applications of the classical umbral calculus (2003) Algebra Universalis, 49 (4), pp. 397-434. , DOI 10.1007/s00012-003-1813-5; Han, G.-N., Zeng, J., On a q-sequence that generalizes the median Genocchi numbers (1999) Ann. Sci. Math. Québec, 23, pp. 63-72; Hassett, B., Tschinkel, Yu., Geometry of equivariant compactifications of Gna (1999) Int.Math. Res. Not., 20, pp. 1211-1230; Kreweras, G., Sur les permutations comptées par les nombres de Genocchi de 1-ìere et 2-ìeme esp̀ece (1997) Europ. J. Combinatorics, 18, pp. 49-58; Kumar, S., Kac-Moody groups, their flag varieties and representation theory (2002) Progress in Mathematics, 204, p. 606. , Birkhauser, Boston; Kumar, S., The nil Hecke ring and singularity of Schubert varieties (1996) Inventiones Math., 123, pp. 471-506; Sloane, N.J.A., Sequence A000366 The On-line Encyclopedia of Integer Sequences, , http://oeis.org; Viennot, G., Interprétations combinatoires des nombres d'Euler et de Genocchi (1981) Seminar on Number Theory, (11), p. 94. , Univ. Bordeaux I, Talence 1982"
