Авторы,Идентификаторы авторов,Ссылка,Пристатейные ссылки
"Pelinovsky E., Kharif C.","7004951110;55915319400;","https://www.scopus.com/inward/record.uri?eid=2-s2.0-79960707353&doi=10.5194%2fnhess-11-2043-2011&partnerID=40&md5=13ef0a32e8d38e8406f8829a70731b95","Akhmediev, N., Pelinovsky, E., Discussion & debate: Rogue waves-towards a unifying concept? (2010) Eur. Phys. J.-Spec. Top., 185; Babanin, A.V., Hsu, T.-W., Roland, A., Ou, S.-H., Doong, D.-J., Kao, C.C., Spectral wave modelling of Typhoon Krosa (2011) Nat. Hazards Earth Syst. Sci., 11, pp. 501-511. , doi:10.5194/nhess-11-501-2011; Bilyay, E., Ozbahceci, B.O., Yalciner, A.C., Extreme waves at Filyos, southern Black Sea (2011) Nat. Hazards Earth Syst. Sci., 11, pp. 659-666. , doi:10.5194/nhess-11-659-2011; Dao, M.H., Xu, H., Chan, E.S., Tkalich, P., Numerical modelling of extreme waves by Smoothed particle hydrodynamics (2011) Nat. Hazards Earth Syst. Sci., 11, pp. 419-429. , doi:10.5194/nhess-11-419-2011; Didenkulova, I., Anderson, C., Freak waves of different types in the coastal zone of the Baltic Sea (2010) Nat. Hazards Earth Syst. Sci., 10, pp. 2021-2029. , doi:10.5194/nhess-10-2021-2010; Dubard, P., Matveev, V.B., Multi-rogue waves solutions to the focusing NLS equation and the KP-I equation (2011) Nat. Hazards Earth Syst. Sci., 11, pp. 667-672. , doi:10.5194/nhess-11-667-2011; Gavrilov, N., Liapidevskii, V., Gavrilova, K., Large amplitude internal solitary waves over a shelf (2011) Nat. Hazards Earth Syst. Sci., 11, pp. 17-25. , doi:10.5194/nhess-11-17-2011; Gemmrich, J., Garrett, C., Dynamical and statistical explana tions of observed occurrence rates of rogue waves (2011) Nat. Hazards Earth Syst. Sci., 11, pp. 1437-1446. , doi:10.5194/nhess-11-1437-2011; Gramstad, O., Trulsen, K., Hamiltonian form of the modified nonlinear Schrodinger equation for gravity waves on arbitrary depth (2011) J. Fluid Mech., 670, pp. 404-426; Hu, Z.Z., Causon, D.M., Mingham, C.G., Qian, L., Numerical simulation of floating bodies in extreme free surface waves (2011) Nat. Hazards Earth Syst. Sci., 11, pp. 519-527. , doi:10.5194/nhess-11-519-2011; Islas, A., Schober, C.M., Rogue waves and downshifting in the presence of damping (2011) Nat. Hazards Earth Syst. Sci., 11, pp. 383-399. , doi:10.5194/nhess-11-383-2011; Jarry, N., Rey, V., Gouaud, F., Lajoie, D., Gravity wave amplification and phase crest re-organization over a shoal (2011) Nat. Hazards Earth Syst. Sci., 11, pp. 789-796. , doi:10.5194/nhess-11-789-2011; Kharif, C., Pelinovsky, E., Tinti, S., Extreme Sea Waves, Special Issue Nat. Hazards Earth Syst. Sci., , http://www.nat-hazards-earth-syst-sci.net/specialissue58.html, 2006; Kharif, C., Pelinovsky, E., Slunyaev, A., (2009) Rogue Waves in the Ocean, p. 216. , Springer; Kurkina, O.E., Talipova, T.G., Huge internal waves in the vicinity of the Spitsbergen Island (Barents Sea) (2011) Nat. Hazards Earth Syst. Sci., 11, pp. 981-986. , doi:10.5194/nhess-11-981-2011; Liu, P.C., Wu, C.H., Bechle, A.J., MacHutchon, K.R., Chen, H.S., Brief communication What do we know about freaque waves in the ocean and lakes and how do we know it? (2010) Nat. Hazards Earth Syst. Sci., 10, pp. 2191-2196. , doi:10.5194/nhess-10-2191-2010; Liu, P.C., Corrigendum to Brief communication ""what do we know about freaque waves in the ocean and lakes and how do we know it? (2010) Published in Nat. Hazards Earth Syst. Sci., 10, pp. 2191-2196; (2011) Nat. Hazards Earth Syst. Sci., 11, pp. 331-332. , doi:10.5194/nhess-11-331-2011; Makarenko, N.I., Maltseva, J.L., Interference of lee waves over mountain ranges (2011) Nat. Hazards Earth Syst. Sci., 11, pp. 27-32. , doi:10.5194/nhess-11-27-2011; Nikolkina, I., Didenkulova, I., Rogue waves in 2006-2010 (2011) Nat. Hazards Earth Syst. Sci., 11. , in press; Odent, V., Taki, M., Louvergneaux, E., Experimental spatial rogue patterns in an optical feedback system (2010) Nat. Hazards Earth Syst. Sci., 10, pp. 2727-2732. , doi:10.5194/nhess-10-2727-2010; Pelinovsky, E., Grimshaw, R., Didenkulova, I., Extreme surface and internal waves, Special Issue, Nonlin Processes Geophys., , http://www.nonlin-processes-geophys.net/specialissue106.html, 2009; Pelinovsky, E., Kharif, Ch., Rogue waves (2006) Eur. J. Mech. B.-Fluid., 25, p. 5; Pelinovsky, E., Kharif, C., (2008) Extreme Ocean Waves, 196. , Springer; Pelinovsky, E., Shurgalina, E., Chaikovskaya, N., The scenario of a single freak wave appearance in deep water-dispersive focusing mechanism framework (2011) Nat. Hazards Earth Syst. Sci., 11, pp. 127-134. , doi:10.5194/nhess-11-127-2011; Sergeeva, A., Pelinovsky, E., Talipova, T., Nonlinear randomwave field in shallow water: Variable Korteweg-de Vries framework (2011) Nat. Hazards Earth Syst. Sci., 11, pp. 323-330. , doi:10.5194/nhess-11-323-2011; Shemer, L., On Benjamin-Feir instability and evolution of a nonlinear wave with finite-amplitude sidebands (2010) Nat. Hazards Earth Syst. Sci., 10, pp. 2421-2427. , doi:10.5194/nhess-10-2421-2010; Toffoli, A., Cavaleri, L., Babanin, A.V., Benoit, M., Bitner-Gregersen, E.M., Monbaliu, J., Onorato, M., Stansberg, C.T., Occurrence of extreme waves in three-dimensional mechanically generated wave fields propagating over an oblique current (2011) Nat. Hazards Earth Syst. Sci., 11, pp. 895-903. , doi:10.5194/nhess-11-895-2011; Touboul, J., Kharif, C., Nonlinear evolution of the modula-tional instability under weak forcing and damping (2010) Nat. Hazards Earth Syst. Sci., 10, pp. 2589-2597. , doi:10.5194/nhess-10-2589-2010; Vella, C., Demory, F., Canut, V., Dussouillez, P., Fleury, T.J., First evidence of accumulation of mega boulders on the Mediterranean rocky coast of Provence (southern France) (2011) Nat. Hazards Earth Syst. Sci., 11, pp. 905-914. , doi:10.5194/nhess-11-905-2011"
"Savchenko A.V.","42962245900;","https://www.scopus.com/inward/record.uri?eid=2-s2.0-79960300921&doi=10.1007%2f978-3-642-21881-1_52&partnerID=40&md5=0ae612b946807b6642479320390467f6","Jia, Z., Amselang, L., Gros, P., Content-based image retrieval from a large image database (2008) Pattern Recognition, 11 (5), pp. 1479-1495; Russ, J., (2007) The Image Processing Handbook, , 5th edn. CRC Press, Boca Raton; Rui, Y., Huang, T., Chang, S.F., Image retrieval: Current techniques, promising directions and open issues (1999) Visual Communication and Image Representation, 10, pp. 39-62; Theodoridis, S., Koutroumbas, C., (2009) Pattern Recognition, , 4th edn. Elsevier, Amsterdam; Savchenko, A.V., Method of directed enumeration of alternatives in the problem of automatic recognition of half-tone images (2009) Optoelectronics, Instrumentation and Data Processing, 45 (3), pp. 83-91; Santini, S., (2001) Exploratory Image Databases: Content-Based Retrieval, , Academic Press, London; Kullback, S., (1978) Information Theory and Statistics, , Dover Pub., New York; Savchenko, A.V., Image retrieval using minimum information discrimination criterion (2010) The Proc. of IASTED ACIT-CDA, Novosibirsk, pp. 345-349; Essex Faces Database, , http://cswww.essex.ac.uk/mv/allfaces/index.html; Pedrycz, W., Kreinovich, V., Skowron, A., (2008) Handbook of Granular Computing, , Wiley, Chichester"
"Ignatov D.I., Kuznetsov S.O., Magizov R.A., Zhukov L.E.","56926915100;7202573378;42961943800;56962754300;","https://www.scopus.com/inward/record.uri?eid=2-s2.0-79960318872&doi=10.1007%2f978-3-642-21881-1_41&partnerID=40&md5=6dff5b1d4637728d608910a135b98ae7","Belohlavek, R., Vychodil, V., Factor analysis of incidence data via novel decomposition of matrices (2009) LNCS, 5548, pp. 83-97. , Ferré, S., Rudolph, S. (eds.) ICFCA 2009. Springer, Heidelberg; Belohlavek, R., Vychodil, V., Factorizing three-way binary data with triadic formal concepts (2010) LNCS, 6276, pp. 471-480. , Setchi, R., Jordanov, I., Howlett, R., Jain, L. (eds.) KES 2010. Springer, Heidelberg; Besson, J., Robardet, C., Boulicaut, J.F., Mining a new fault-tolerant pattern type as an alternative to formal concept discovery (2006) LNCS (LNAI), 4068, pp. 144-157. , Schärfe, H., Hitzler, P., Øhrstrøm, P. (eds.) ICCS 2006. Springer, Heidelberg; http://bibsonomy.org; Cerf, L., Besson, J., Robardet, C., Boulicaut, J.F., Data peeler: Contraint-based closed pattern mining in n-ary relations (2008) SDM, pp. 37-48. , SIAM, Philadelphia; Cerf, L., Besson, J., Robardet, C., Boulicaut, J.F., Closed patterns meet -ary relations (2009) TKDD, 3 (1); Clauset, A., Shalizi, C.R., Newman, M.E.J., Power-law distributions in empirical data (2009) SIAM Review, 51 (4), pp. 661-703; Ganter, B., Obiedkov, S., Implications in triadic formal contexts (2004) LNCS (LNAI), 3127, pp. 186-195. , Wolff, K., Pfeiffer, H., Delugach, H. (eds.) ICCS 2004. Springer, Heidelberg; Ganter, B., Wille, R., (1999) Formal Concept Analysis: Mathematical Foundations, , Springer, Heidelberg; Hartigan, J.A., Direct clustering of a data matrix (1972) Journal of the American Statistical Association, 67 (337), pp. 123-129; Ignatov, D.I., Kaminskaya, A.Y., Kuznetsov, S.O., Magizov, R.A., A concept-based biclustering algorithm (2010) Proceedings of the Eight International Conference on Intelligent Information Processing (IIP-8), pp. 140-143. , MAKS Press in russian; Jäschke, R., Hotho, A., Schmitz, C., Ganter, B., Stumme, G., Trias - An algorithm for mining iceberg tri-lattices (2006) ICDM, pp. 907-911. , IEEE Computer Society, Los Alamitos; Ji, L., Tan, K.L., Tung, A.K.H., Mining frequent closed cubes in 3d datasets (2006) VLDB, pp. 811-822. , Dayal, U., Whang, K.Y., Lomet, D.B., Alonso, G., Lohman, G.M., Kersten, M.L., Cha, S.K., Kim, Y.K. (eds.) ACM, New York; Lehmann, F., Wille, R., A triadic approach to formal concept analysis (1995) LNCS, 954, pp. 32-43. , Ellis, G., Levinson, R., Rich, W., Sowa, J. (eds.) ICCS 1995. Springer, Heidelberg; Mirkin, B., (1996) Mathematical Classification and Clustering, , Kluwer, Dordrecht; Newman, M.E.J., Power laws, pareto distributions and zipf's law (2005) Contemporary Physics, 46 (5), pp. 323-351; Wille, R., Restructuring lattice theory: An approach based on hierarchies of concepts (1982) Ordered Sets, pp. 445-470. , Rival, I. (ed.) Boston"
"Kuznetsov S.O., Ślȩzak D., Hepting D.H., Mirkin B.G.","7202573378;7004096337;7801380650;35428028600;","https://www.scopus.com/inward/record.uri?eid=2-s2.0-79960317607&doi=10.1007%2f978-3-642-21881-1&partnerID=40&md5=08a6598d95e0be60d55cd40c8e28c38d",
"Mirkin B.G., Kramarenko A.V.","35428028600;44861538100;","https://www.scopus.com/inward/record.uri?eid=2-s2.0-79960325288&doi=10.1007%2f978-3-642-21881-1_40&partnerID=40&md5=1fbc82141bda8dfd39e3c33deba6d8f1","Ganter, B., Wille, R., (1999) Formal Concept Analysis: Mathematical Foundations, , Springer, Heidelberg; Hartigan, J.A., Direct clustering of a data matrix (1972) Journal of the American Statistical Association, 67 (337), pp. 123-129; Hartigan, J.A., (1975) Clustering Algorithms, , Wiley, Chichester; Ignatov, D., Kuznetsov, S., Biclustering methods using lattices of closed subsets (2010) Proceedings of 12th National Conference on Artificial Intelligence, Moscow, FML, 1, pp. 175-182. , in Russian; Madeira, S.C., Oliveira, A.L., Biclustering algorithms for biological data analysis: A survey (2004) IEEE/ACM Transactions on Computational Biology and Bioinformatics (TCBB), 1 (1), pp. 24-45; Mirkin, B., Arabie, P., Hubert, L., Additive two-mode clustering: The error-variance approach revisited (1995) Journal of Classification, 12, pp. 243-263; Mirkin, B., (1996) Mathematical Classification and Clustering, p. 448. , Kluwer, Dordrecht; Mirkin, B., (2008) Two Goals for Biclustering: ""Box"" and ""Dual"" Methods, , unpublished manuscript; Pensa, R.G., Boulicaut, J.-F., Towards fault-tolerant formal concept analysis (2005) LNCS (LNAI), 3673, pp. 212-223. , Bandini, S., Manzoni, S. (eds.) AI*IA 2005. Springer, Heidelberg; Prelic, A., Bleuler, S., Zimmermann, P., Wille, A., Bühlmann, P., Gruissem, W., Hennig, L., Zitzler, E., A Systematic Comparison and Evaluation of Biclustering Methods for Gene Expression Data (2006) Bioinformatics, 22 (9), pp. 1122-1129; Rome, J.E., Haralick, R.M., Towards a formal concept analysis approach to exploring communities on the World Wide Web International Conference on Formal Concept Analysis, Lens, France (2005)"
"Golovachev S.","55300543000;","https://www.scopus.com/inward/record.uri?eid=2-s2.0-79960147078&doi=10.1007%2f978-3-642-21786-9_57&partnerID=40&md5=3c6de0a1f8c902241807074a1069dd0f","Back, A.D., Weigend, A.S., A first application of independent component analysis to extracting structure from stock returns (1997) International Journal of Neural Systems, 8 (5). , October; Bishop, C.M., (1995) Neural Networks for Pattern Recognition, p. 483. , Oxford University Press, Oxford; Bell, J.I., Sejnowsi, T.J., An information-maximisation approach to blind separation and blind deconvolution (1995) Neural Computation, 7 (6), pp. 1004-1034; Górriz, J.M., Puntonet, C.G., Moisés Salmerón, E.W., Lang time series prediction using ICA algorithms (2003) IEEE International Workshop on Intelligent Data Acquisition and Advanced Computing Systems: Technology and Applications, pp. 8-10. , Lviv, Ukraine, September; Hyvarinen, A., Oja, E., Independent component analysis: Algorithms and applications (2000) Neural Networks, 13 (4-5), pp. 411-430. , DOI 10.1016/S0893-6080(00)00026-5, PII S0893608000000265; Kröse, B., Van Der Smagt, P., (1996) An Introduction to Neural Networks, , 8th edn. (November); Lu, C.-J., Le, T.-S., Chiu, C.-C., Financial time series forecasting using independent component analysis and support vector regression (2009) Decision Support Systems, 47, pp. 115-125"
"Shamshurin I.","42662434400;","https://www.scopus.com/inward/record.uri?eid=2-s2.0-79960138448&doi=10.1007%2f978-3-642-21786-9_42&partnerID=40&md5=ca35257d50cfc490dd398215d982a9aa","Liu, B., (2006) Web Data Mining: Exploring Hyperlinks Contents and Usage Data, , Springer, Heidelberg; Segaran, T., (2007) Programming Collective Intelligence: Building Smart Web 2.0 Applications, , O'Reilly, Sebastopol; Hu, M., Liu, B., Mining and summarizing customer reviews (2004) ACM SIGKDD International Conference on Knowledge Discovery & Data Mining, , Seattle, Washington, USA; Berry, M.W., Browne, M., (2007) Lecture Notes in Data Mining, , World Scientific Publishing Co, Singapore; Giudici, P., Applied data mining (2003) Statistical Methods for Business and Industry, , Wiley, Chichester; Hatzivassiloglou, V., McKeown, K.R., Predicting the semantic orientation of adjectives Proceedings of the 35th Annual Meeting of the ACL and the 8th Conference of the European Chapter of the ACL, pp. 174-181. , ACL, New Brunswick; Lutz, M., (2010) Programming Python, , O'Reilly, Sebastopol; Van Rijsbergen, C.V., (1979) Information Retrieval, , 2nd edn. Butterworth London; Boston; Bird, S., Klein, E., Loper, E., (2009) Natural Language Processing with Python, , O'Reilly, Sebastopol; Stavrianou, A., Andritsos, P., Nicoloyannis, N., Overview and semantic issues of text mining (2007) SIGMOD Record, 36 (3), pp. 23-34. , http://www.sigmod.org/sigmod/record/issues/0709/p23.cesar-andritsos.pdf, DOI 10.1145/1324185.1324190; Poirier, D., Bothorel, C., Boulle, M., Two possible approaches for opinion analysis in film reviews: Statistic and linguistic (2008) EMOT-2008: LREC 2008 Workshop on Sentiment Analysis: Emotion Metaphor Ontology; Williams, G.K., Anand, S.S., Predicting the polarity strength of adjectives using- WordNet (2009) Third International AAAI Conference on Weblogs and Social Media; Turney, P.D., Mining the Web for Synonyms: PMI-IR versus LSA on TOEFL (2001) Lecture Notes in Computer Science, (2167), pp. 491-502. , Machine Learning: ECML 2001; Budanitsky, A., Hirst, G., Semantic distance in WordNet: An experimental, application-oriented evaluation of five measures (2001) Workshop on WordNet and Other Lexical Resources, Second Meeting of the North American Chapter of the Association for Computational Linguistics, , Pittsburgh; Turney, P.D., Thumbs up or thumbs down? semantic orientation applied to unsupervised classification of reviews (2002) Proceedings of the 40th Annual Meeting of the Association for Computational Linguistics (ACL 2002), pp. 417-424; Huang, A., Similarity measures for text document clustering (2008) Proceedings of the Sixth New Zealand Computer Science Research Student Conference NZCSRSC 2008, pp. 49-56. , Christchurch, New Zealand; Geisser, S., (1993) Predictive Inference, , Chapman and Hall, New York"
"Roytberg M.","6602080158;","https://www.scopus.com/inward/record.uri?eid=2-s2.0-79960131896&doi=10.1007%2f978-3-642-21786-9_4&partnerID=40&md5=5ff245341990b15c139bc6c373023ca2","Altschul, S.F., Gish, W., Miller, W., Basic local alignment search tool (1990) J. Mol. Biol., 215, pp. 403-410; Ma, B., Tromp, J., Li, M., PatternHunter: Faster and more sensitive homology search (2002) Bioinformatics, 18 (3), pp. 440-445; Brejová, B., Brown, D.G., Vinař, T., Optimal spaced seeds for hidden markov models, with application to homologous coding regions (2003) LNCS, 2676, pp. 42-54. , Baeza-Yates, R., Chávez, E., Crochemore, M. (eds.) CPM 2003. Springer, Heidelberg; Brejová, B., Brown, D.G., Vinař, T., Vector seeds: An extension to spaced seeds allows substantial improvements in sensitivity and specificity (2003) LNCS (LNBI), 2812, pp. 39-54. , Benson, G., Page, R.D.M. (eds.) WABI 2003. Springer, Heidelberg; Brejova, B., Brown, D., Vinar, T., Optimal spaced seeds for homologous coding regions (2004) Journal of Bioinformatics and Computational Biology, 1 (4), pp. 595-610; Brown, D.G., Optimizing multiple seeds for protein homology search (2005) IEEE/ACM Transactions on Computational Biology and Bioinformatics, 2 (1), pp. 29-38. , DOI 10.1109/TCBB.2005.13; Buhler, J., Keich, U., Sun, Y., Designing seeds for similarity search in genomic DNA (2003) Proceedings of the 7th Annual International Conference on Computational Molecular Biology (RECOMB 2003), pp. 67-75. , Berlin Germany April 2003. ACM Press, New York; Kucherov, G., Noe, L., Roytberg, M., Multiseed lossless filtration (2005) IEEE/ACM Transactions on Computational Biology and Bioinformatics, 2 (1), pp. 51-61. , DOI 10.1109/TCBB.2005.12; Li, M., Ma, B., Kisman, D., Tromp, J., Pattern Hunter II: Highly sensitive and fast homology search (2004) Journal of Bioinformatics and Computational Biology, , Earlier version in GIW 2003 (International Conference on Genome Informatics); Kucherov, G., Noe, L., Roytberg, M., A unifying framework for seed sensitivity and its application to subset seeds (2006) Journal of Bioinformatics and Computational Biology, 4 (2), pp. 553-569. , DOI 10.1142/S0219720006001977, PII S0219720006001977; Xu, J., Brown, D.G., Li, M., Ma, B., Optimizing multiple spaced seeds for homology search (2004) LNCS, 3109, pp. 47-58. , Sahinalp, S.C., Muthukrishnan, S.M., Dogrusoz, U. (eds.) CPM 2004. Springer, Heidelberg; Yang, I., Wang, S., Chen, Y., Huang, P., Ye, L., Huang, X., Chao, K., Efficient methods for generating optimal single and multiple spaced seeds (2004) Proceedings of the IEEE 4th Symposium on Bioinformatics and Bioengineering(BIBE 2004), pp. 411-416. , Taichung Taiwan May 19-21 2004. IEEE Computer Society Press, Los Alamitos; Sunyaev, S.R., Bogopolsky, G.A., Oleynikova, N.V., Vlasov, P.K., Finkelstein, A.V., Roytberg, M.A., From Analysis of Protein Structural Alignments Toward a Novel Approach to Align Protein Sequences (2004) Proteins: Structure, Function and Genetics, 54 (3), pp. 569-582. , DOI 10.1002/prot.10503; Stoye, J., Evers, D., Meyer, F., Rose: Generating sequence families (1998) Bioinformatics, 14 (2), pp. 157-163; Polyanovsky, V., Roytberg, M., Tumanyan, V., Reconstruction of genuine pair-wise sequence alignment (2008) J. Comput. Biol, , (April 24) (Epub ahead of print); Vogt, G., Etzold, T., Argos, P., An assessment of amino acid exchange matrices in aligning protein sequences: The twilight zone revisited (1995) J. Mol. Biol., 249, pp. 816-831; Domingues, F.S., Lackner, P., Andreeva, A., Structure-based evaluation of sequence comparison and fold recognition alignment accuracy (2000) J. Mol. Biol., 297, pp. 1003-1013; Mevissen, H.Th., Vingron, M., Quantifying the local reliability of a sequence alignment (1996) Protein Engineering, 9 (2), pp. 127-132; Vingron, M., Argos, P., Determination of reliable regions in protein sequence alignments (1990) Protein Engineering, 3 (7), pp. 565-569; Litvinov, I.I., Lobanov, M.Yu., Mironov, A.A., Finkelshtein, A.V., Roytberg, M.A., Information on the secondary structure improves the quality of protein sequence alignment (2006) Molecular Biology, 40 (3), pp. 474-480. , DOI 10.1134/S0026893306030149; Wallqvist, A., Fukunishi, Y., Murphy, L.R., Fadel, A., Levy, R.M., Iterative sequence/secondary structure search for protein homologs: Comparison with amino acid sequence alignments and application to fold recognition in genome databases (2000) Bioinformatics, 16 (11), pp. 988-1002"
"Mirkin B., Nascimento S., Fenner T., Felizardo R.","35428028600;7003805775;7003951786;44361041400;","https://www.scopus.com/inward/record.uri?eid=2-s2.0-79960150174&doi=10.1007%2f978-3-642-21786-9_2&partnerID=40&md5=ca3af701bdb20f461bcfc92447625867","(1998) ACM Computing Classification System, , http://www.acm.org/about/class/1998, Cited September 9, 2008; http://www.avs.com/solutions/avs-powerviz/utility_distribution.html, Cited November 27 2010; Beneventano, D., Dahlem, N., El Haoum, S., Hahn, A., Montanari, D., Reinelt, M., Ontology-driven semantic mapping (2008) Enterprise Interoperability III, Part IV, pp. 329-341. , Springer, Heidelberg; Buche, P., Dibie-Barthelemy, J., Ibanescu, L., Ontology mapping using fuzzy conceptual graphs and rules (2008) ICCS Supplement, pp. 17-24; Cali, A., Gottlob, G., Pieris, A., Advanced processing for ontological queries (2010) Proceedings of the VLDB Endowment, 3 (1), pp. 554-565; Dotan-Cohen, D., Kasif, S., Melkman, A., Seeing the forest for the trees: Using the gene ontology to restructure hierarchical clustering (2009) Bioinformatics, 25 (14), pp. 1789-1795; Gahegan, M., Agrawal, R., Jaiswal, A., Luo, J., Soon, K.-H., A platform for visualizing and experimenting with measures of semantic similarity in ontologies and concept maps (2008) Transactions in GIS, 12 (6), pp. 713-732; Ghazvinian, A., Noy, N., Musen, M., Creating mappings for ontologies in Biomedicine: Simple methods work (2009) AMIA 2009 Symposium Proceedings, pp. 198-202; Mansingh, G., Osei-Bryson, K.-M., Reichgelt, H., Using ontologies to facilitate post-processing of association rules by domain experts (2011) Information Sciences, 181 (3), pp. 419-434; Marinica, C., Guillet, F., Improving post-mining of association rules with ontologies (2009) The XIII International Conference Applied Stochastic Models and Data Analysis (ASMDA), pp. 76-80. , ISBN 978-9955-28-463-5; Mazza, R., (2009) Introduction to Information Visualization, , Springer, London, ISBN: 978-1-84800-218-0; Mirkin, B., Nascimento, S., Pereira, L.M., Cluster-lift method for mapping research activities over a concept tree (2010) Advances in Machine Learning II. SCI, 263, pp. 245-257. , Koronacki, J., Raś, Z.W., Wierzchoń, S.T., Kacprzyk, J. (eds.). Springer, Heidelberg; Mirkin, B., Nascimento, S., (2009) Analysis of Community Structure, Affinity Data and Research Activities Using Additive Fuzzy Spectral Clustering, p. 24. , TR-BBKCS-09-07; (2009) OWL 2 Web Ontology Language Overview, , http://www.w3.org/TR/2009/RECowl2overview20091027/, Cited November 27, 2010; (2011), http://www.connectingforhealth.nhs.uk/systemsandservices/data/uktc/snomed, SNOMED CT, Cited March 2011; Sosnovsky, S., Mitrovic, A., Lee, D., Prusilovsky, P., Yudelson, M., Brusilovsky, V., Sharma, D., Towards integration of adaptive educational systems: Mapping domain models to ontologies (2008) Procs. of 6th International Workshop on Ontologies and Semantic Web for ELearning (SWEL 2008) at ITS 2008, , http://compsci.wssu.edu/iis/swel/SWEL08/Papers/Sosnovsky.pdf, Dicheva, D., Harrer, A., Mizoguchi, R. (eds.); Thomas, H., O'sullivan, D., Brennan, R., Evaluation of ontology mapping representation (2009) Proceedings of the Workshop on Matching and Meaning, pp. 64-68"
