;Область, Авторы,Идентификаторы авторов,Ссылка,Ключевые слова автора,Ключевые слова указателя;;;;;;;;;;;;;;;;;;;;;;;;;;;;;;;;;;;;;;;;;;;;;;;;;;;;;;;;;;;;;;;;;;;;;;;;;;;;
1;"Khamadieva A.,""56898925100";",https://www.scopus.com/inward/record.uri?eid=2-s2.0-84943738025&doi=10.1007%2f978-3-319-15329-2_5&partnerID=40&md5=ddb2788ebf2b9f36c0bd07193018a76b"",""Place attributes"; Place marketing; Residents;" Residents’ utility"",""Commerce"; Branding strategies; Marketing strategy; Place attributes; Relevant target; Research gaps; Residents; Young peoples;" Marketing""";;;;;;;;;;;;;;;;;;;;;;;;;;;;;;;;;;;;;;;;;;;;;;;;;;;;;;;;;;;;;;;;
1;"Butryumova N., Karpycheva S., Grisheva K., Kasyanova E.,""57004778700";57004964600;57004981000;57004863400;",https://www.scopus.com/inward/record.uri?eid=2-s2.0-84949997792&doi=10.4067%2fS0718-27242015000400008&partnerID=40&md5=5c2cb0898dfbef229479b1fffbce65be"",""Case study"; Innovation infrastructure; Nizhny Novgorod region; Obstacles; Russia;" Small innovative companies"",";;;;;;;;;;;;;;;;;;;;;;;;;;;;;;;;;;;;;;;;;;;;;;;;;;;;;;;;;;;;;;;;;;;
1;"Rozhkov K.L., Skriabina N.I.,""56769813100";56770008000;",https://www.scopus.com/inward/record.uri?eid=2-s2.0-84938847310&doi=10.1108%2fJPMD-10-2014-0024&partnerID=40&md5=e169503ff2804edbdd40c9df2e4a7035"",""Place demand"; Place market segment; Place product; Place use;" Typology"",";;;;;;;;;;;;;;;;;;;;;;;;;;;;;;;;;;;;;;;;;;;;;;;;;;;;;;;;;;;;;;;;;;;;;;
1;"Klimanov D., Frolkina E.,""56951228100";56951131500;",https://www.scopus.com/inward/record.uri?eid=2-s2.0-84946563219&partnerID=40&md5=7e43728bd4381fa742bb8534bd51e3eb"",""CRM system"; Customer loyalty; Customer relationship management;" Pharmaceutical company"",";;;;;;;;;;;;;;;;;;;;;;;;;;;;;;;;;;;;;;;;;;;;;;;;;;;;;;;;;;;;;;;;;;;;;;;
1;"Onishchenko V., Penikas H.,""56902428200";55471176500;",https://www.scopus.com/inward/record.uri?eid=2-s2.0-84944248548&doi=10.1007%2f978-3-319-09946-0__15&partnerID=40&md5=7f8b06643095bfc7ae0c6e89669230ec"",""Copula"; Nonlinear time series; Onparametric estimation of copula;" Structural break"",";;;;;;;;;;;;;;;;;;;;;;;;;;;;;;;;;;;;;;;;;;;;;;;;;;;;;;;;;;;;;;;;;;;;;;;
1;"Yakovlev A., Tkachenko A., Demidova O., Balaeva O.,""36085487700";55744579000;6602926736;55440425400;",https://www.scopus.com/inward/record.uri?eid=2-s2.0-84940435266&doi=10.1080%2f01900692.2014.980909&partnerID=40&md5=167fd6a36ad5a77091100185db1c454c"",""institutional reforms"; natural experiment; procurement effectiveness;" public procurement"",";;;;;;;;;;;;;;;;;;;;;;;;;;;;;;;;;;;;;;;;;;;;;;;;;;;;;;;;;;;;;;;;;;;;;
1;"Sirotin V., Arkhipova M.,""57191847058";57191839300;",https://www.scopus.com/inward/record.uri?eid=2-s2.0-84994103446&partnerID=40&md5=184f01964de9049315917fe370207947"",""Cooperation and partnership"; Innovative development; Integral indicators; Panel data;" Regional innovation activity"",""Competition"; Decision making; Economics; Regional planning; Regression analysis; Cooperation and partnership; Innovative development; Integral indicators; Panel data; Regional innovation;" Multivariant analysis""";;;;;;;;;;;;;;;;;;;;;;;;;;;;;;;;;;;;;;;;;;;;;;;;;;;;;;;;;;;;
1;"Golichenko O., Samovoleva S.,""6505863853";57191843779;",https://www.scopus.com/inward/record.uri?eid=2-s2.0-84994127989&partnerID=40&md5=3a375896e55fc318350002c5ad35d549"",""Business bias and preferences"; Externalities; Innovation policy; International competition; Product and process innovations;" Technological spillover"",""Commerce"; Competition; Innovation; Intellectual property; International trade; Investments; Knowledge management; Laws and legislation; Motivation; Rational functions; Externalities; Innovation policies; International competitions; Process Innovation; Technological spillovers;" Economics""";;;;;;;;;;;;;;;;;;;;;;;;;;;;;;;;;;;;;;;;;;;;;;;;;;;;;;
1;"Saritas O.,""6506092892";",https://www.scopus.com/inward/record.uri?eid=2-s2.0-84930019903&doi=10.1108%2fFS-04-2015-0020&partnerID=40&md5=1547327fc90810e264418099759b6ac6"",,";;;;;;;;;;;;;;;;;;;;;;;;;;;;;;;;;;;;;;;;;;;;;;;;;;;;;;;;;;;;;;;;;;;;;;;;;;;
1;"Shakina E., Barajas A.,""55266716300";35572693800;",https://www.scopus.com/inward/record.uri?eid=2-s2.0-84942913126&doi=10.1108%2fJIC-03-2015-0025&partnerID=40&md5=deeafb576d1fb3a8e2046595f5456763"",""Cluster"; Intangible-intensive strategy; Intangibles;" Strategic profile"",";;;;;;;;;;;;;;;;;;;;;;;;;;;;;;;;;;;;;;;;;;;;;;;;;;;;;;;;;;;;;;;;;;;;;;;
1;"van der Aalst W.M.P., Guo S., Gorissen P.,""7007153024";56529947300;55361119700;",https://www.scopus.com/inward/record.uri?eid=2-s2.0-84923646652&doi=10.1007%2f978-3-662-46436-6_6&partnerID=40&md5=2ccf112f8cb8cb195b416b7c0539fa04"",""Comparative process mining"; Learning analytics; Online analytical processing;" Process mining"",""Compliance control"; Data mining; Education; Education computing; Geometry; Petri nets; Automated discovery; Female students; International students; Learning analytics; On-line analytical processing; Process mining; Process Modeling; Single process;" Students""";;;;;;;;;;;;;;;;;;;;;;;;;;;;;;;;;;;;;;;;;;;;;;;;;;;;;;;;
1;"Balabanova E., Efendiev A., Ehrnrooth M., Koveshnikov A.,""13004746300";36008134200;6504137294;39761993300;",https://www.scopus.com/inward/record.uri?eid=2-s2.0-84921027217&doi=10.1108%2fBJM-03-2014-0039&partnerID=40&md5=d15d3da700196f4d336833a8411fa761"",""Leadership"; Management styles; Managers;" Russia"",";;;;;;;;;;;;;;;;;;;;;;;;;;;;;;;;;;;;;;;;;;;;;;;;;;;;;;;;;;;;;;;;;;;;;
1;"Hui B.P.H., Chen S.X., Leung C.M., Berry J.W.,""37093285900";24740779400;7402612708;7402634538;",https://www.scopus.com/inward/record.uri?eid=2-s2.0-84924358879&doi=10.1016%2fj.ijintrel.2015.01.002&partnerID=40&md5=c89965a0736922bd2db74192dbe302f7"",""Acculturation"; Adaptation; Integration; Intercultural contact;" Multiculturalism"",";;;;;;;;;;;;;;;;;;;;;;;;;;;;;;;;;;;;;;;;;;;;;;;;;;;;;;;;;;;;;;;;;;;;
1;"Coates D., Wicker P.,""7102942663";26430186500;",https://www.scopus.com/inward/record.uri?eid=2-s2.0-84938501063&partnerID=40&md5=f7b4f24a81d366a2c431c8f793f19f97"",""Bid"; Olympic Games; Public choice;" Referendum"",";;;;;;;;;;;;;;;;;;;;;;;;;;;;;;;;;;;;;;;;;;;;;;;;;;;;;;;;;;;;;;;;;;;;;;;
1;"Molodchik M., Jardon C.,""55388213700";6506804139;",https://www.scopus.com/inward/record.uri?eid=2-s2.0-84947427484&doi=10.1108%2fTLO-11-2014-0061&partnerID=40&md5=b0959a421d4d869ced3cf9a8a750929b"",""Organizational culture"; Organizational learning; PLS-analysis; Russian study;" Transformational leadership"",";;;;;;;;;;;;;;;;;;;;;;;;;;;;;;;;;;;;;;;;;;;;;;;;;;;;;;;;;;;;;;;;;;;;;;
1;"Chepurenko A.,""6503981307";",https://www.scopus.com/inward/record.uri?eid=2-s2.0-84933504165&doi=10.1108%2fIJM-11-2013-0256&partnerID=40&md5=a2a2e2ec2eaff6b9ed4ee8daf86e6644"",""Data analysis"; Eastern Europe; Expatriates;" Immigration"",";;;;;;;;;;;;;;;;;;;;;;;;;;;;;;;;;;;;;;;;;;;;;;;;;;;;;;;;;;;;;;;;;;;;;;;;
1;"Ozhegov E.,""55880875200";",https://www.scopus.com/inward/record.uri?eid=2-s2.0-84944251986&doi=10.1007%2f978-3-319-09946-0__16&partnerID=40&md5=b7b8d53830f6bd48b9480e619c86cce4"",""Demand for loans"; Endogeneity;" Sample selection"",";;;;;;;;;;;;;;;;;;;;;;;;;;;;;;;;;;;;;;;;;;;;;;;;;;;;;;;;;;;;;;;;;;;;;;;;;
1;"Karminsky A.,""37053822300";",https://www.scopus.com/inward/record.uri?eid=2-s2.0-84944261568&doi=10.1007%2f978-3-319-09946-0__8&partnerID=40&md5=e91fded3820fe610675724465e917406"",""Econometric model"; Mapping; Rating; Rating scale;" Risk management"",";;;;;;;;;;;;;;;;;;;;;;;;;;;;;;;;;;;;;;;;;;;;;;;;;;;;;;;;;;;;;;;;;;;;;;;
1;"Zharova A.,""56964137900";",https://www.scopus.com/inward/record.uri?eid=2-s2.0-84947253859&doi=10.1108%2fIJLMA-07-2014-0044&partnerID=40&md5=175449e3af348dbd28c6d0876f8cdcc8"",""E-govern"; Information society; International principles; International programs; Interoperability; Legislation of the Russian federation; Standards; Technological understanding;" The European Union legislation"",";;;;;;;;;;;;;;;;;;;;;;;;;;;;;;;;;;;;;;;;;;;;;;;;;;;;;;;;;;;;;;;;;;;
1;"Dzyaloshinskiy I., Dzyaloshinskaya M.,""56993970400";56993862000;",https://www.scopus.com/inward/record.uri?eid=2-s2.0-84949226305&partnerID=40&md5=ba3833090e32f931f1683a66b0a5c7d2"",""Information security doctrine"; Media; Media security;" Media threats"",";;;;;;;;;;;;;;;;;;;;;;;;;;;;;;;;;;;;;;;;;;;;;;;;;;;;;;;;;;;;;;;;;;;;;;;
1;"Naidenova I., Parshakov P., Zavertiaeva M., Tomé E.,""55881002000";55881045400;56964415100;16417657800;",https://www.scopus.com/inward/record.uri?eid=2-s2.0-84947224419&doi=10.1108%2fMBE-11-2014-0039&partnerID=40&md5=3683f537175f980c0a381d4fa827a368"",""Equity funds"; Individual intellectual capital; Jensen’s alpha;" Russia"",";;;;;;;;;;;;;;;;;;;;;;;;;;;;;;;;;;;;;;;;;;;;;;;;;;;;;;;;;;;;;;;;;;;;;
1;"Endaltseva A.,""56667556000";",https://www.scopus.com/inward/record.uri?eid=2-s2.0-84942371046&doi=10.1016%2fj.pubrev.2015.05.015&partnerID=40&md5=acedc2404135baa7b6c77b970a310b7f"",""Communication in Russia"; Integrated communication; Integrated communications in Russia; Public relations in Russia;" Strategic communication"",";;;;;;;;;;;;;;;;;;;;;;;;;;;;;;;;;;;;;;;;;;;;;;;;;;;;;;;;;;;;;;;;;;;;;;;
1;"Dudok E., Guerreiro S., Babkin E., Pergl R., Van Kervel S.J.,""56549932900";24536769600;6701533991;26633154200;55440728400;",https://www.scopus.com/inward/record.uri?eid=2-s2.0-84937467918&doi=10.1007%2f978-3-319-19297-0_1&partnerID=40&md5=6915a5ffda55b8a1cf22114ae57895de"",""Demo methodology"; Enterprise operating system; Enterprise operational analysis; Governance risk compliance;" Process mining"",""Data mining"; Risk assessment; Business procedures; Conformance checking; Demo methodology; Enterprise engineering; Governance risks; Operational analysis; Process mining; Transactional data;" Quality control""";;;;;;;;;;;;;;;;;;;;;;;;;;;;;;;;;;;;;;;;;;;;;;;;;;;;;;;;;
1;"Tatuev A.A., Shash N.N., Nagoev A.B., Lyapuntsova E.V., Rokotyanskaya V.V.,""56584657100";56712769200;56983002800;6507410840;56658694500;",https://www.scopus.com/inward/record.uri?eid=2-s2.0-84949793828&partnerID=40&md5=47ff840b01858d463711642187de8a23"",""Debt loading"; Federal policy; Industry; Region; Regional policy;" Regional strategy"",";;;;;;;;;;;;;;;;;;;;;;;;;;;;;;;;;;;;;;;;;;;;;;;;;;;;;;;;;;;;;;;;;;
1;"Naumenko V.,""56902339000";",https://www.scopus.com/inward/record.uri?eid=2-s2.0-84944263132&doi=10.1007%2f978-3-319-09946-0__14&partnerID=40&md5=d2880fd8bc49d4cb110a1987a1c24c6e"",,";;;;;;;;;;;;;;;;;;;;;;;;;;;;;;;;;;;;;;;;;;;;;;;;;;;;;;;;;;;;;;;;;;;;;;;;;;;
1;"Andreeva E., Poletaeva T., Abdulrab H., Babkin E.,""57016355100";56337698400;6602972854;6701533991;",https://www.scopus.com/inward/record.uri?eid=2-s2.0-84951286129&doi=10.1007%2f978-3-319-24626-0_6&partnerID=40&md5=8062cb8d0dbdb8644a5b9b895ff09aa5"",""Domain ontology"; Knowledge management; Semantic data modeling; Semantic interoperability;" Supply network"",""Information analysis"; Information management; Knowledge management; Semantics; Supply chains; Business case; Domain ontologies; Knowledge integration; Ontology-based; Semantic data model; Semantic interoperability; Supply chain operations reference models; Supply networks;" Data integration""";;;;;;;;;;;;;;;;;;;;;;;;;;;;;;;;;;;;;;;;;;;;;;;;;;;;;;;
1;"Andreev N.,""56902326400";",https://www.scopus.com/inward/record.uri?eid=2-s2.0-84944235660&doi=10.1007%2f978-3-319-09946-0__1&partnerID=40&md5=b191ef5f9bec508bf58c1d03092abe78"",""Market liquidity"; Optimal portfolio selection; Portfolio liquidation;" Price impact"",";;;;;;;;;;;;;;;;;;;;;;;;;;;;;;;;;;;;;;;;;;;;;;;;;;;;;;;;;;;;;;;;;;;;;;;;
1;"Gilman M.,""56956604100";",https://www.scopus.com/inward/record.uri?eid=2-s2.0-84946847719&partnerID=40&md5=b7919bf713e482bccc7fa643d0f435bd"",,";;;;;;;;;;;;;;;;;;;;;;;;;;;;;;;;;;;;;;;;;;;;;;;;;;;;;;;;;;;;;;;;;;;;;;;;;;;
1;"Kutsenko E.,""55903194100";",https://www.scopus.com/inward/record.uri?eid=2-s2.0-84946161464&doi=10.17323%2f1995-459X.2015.1.32.55&partnerID=40&md5=6fac97bcaf17b42a20e2bb8f07ca4eee"",""Cluster"; Cluster policy; Open innovation;" Pilot innovative territorial clusters"",";;;;;;;;;;;;;;;;;;;;;;;;;;;;;;;;;;;;;;;;;;;;;;;;;;;;;;;;;;;;;;;;;;;;;;;;
1;"Dobryakova M., Kotelnikova Z.,""36639266100";56790466100;",https://www.scopus.com/inward/record.uri?eid=2-s2.0-84939648833&doi=10.17323%2f1995-459X.2015.1.6.19&partnerID=40&md5=c4a1d13fa001668060156a49dea0db13"",""Diffusion of innovation"; Humanities; Prospective research areas; Social construction of technology (SCOT); Social embeddedness;" Social sciences"",";;;;;;;;;;;;;;;;;;;;;;;;;;;;;;;;;;;;;;;;;;;;;;;;;;;;;;;;;;;;;;;;;;;;;
1;"Asaturov K., Teplova T., Hartwell C.A.,""56030635100";56030567300;6506261826;",https://www.scopus.com/inward/record.uri?eid=2-s2.0-84948948286&partnerID=40&md5=5dd3f44ef3195f13405efe1548024d74"",""Contagion"; DCC- GARCH; Poland; Russia;" Volatility spillovers"",";;;;;;;;;;;;;;;;;;;;;;;;;;;;;;;;;;;;;;;;;;;;;;;;;;;;;;;;;;;;;;;;;;;;;
1;"Barjis J., Pergl R., Babkin E.,""12143986300";26633154200;6701533991;",https://www.scopus.com/inward/record.uri?eid=2-s2.0-84951304374&doi=10.1007%2f978-3-319-24626-0&partnerID=40&md5=e2397efba7a2a34ed3d5f19f7deab95f"",,";;;;;;;;;;;;;;;;;;;;;;;;;;;;;;;;;;;;;;;;;;;;;;;;;;;;;;;;;;;;;;;;;;;;;;;;;
1;"Andreev N., Lapshin V.,""56902326400";55177754000;",https://www.scopus.com/inward/record.uri?eid=2-s2.0-84944239136&doi=10.1007%2f978-3-319-09946-0__2&partnerID=40&md5=4c3a34b448af2cf69e562dea34a0f9ab"",""Chaos theory"; Correlation integral; Microstructure; Price dynamics;" Recurrence plot"",";;;;;;;;;;;;;;;;;;;;;;;;;;;;;;;;;;;;;;;;;;;;;;;;;;;;;;;;;;;;;;;;;;;;;;
1;"Kotsemir M., Kuznetsova T., Nasybulina E., Pikalova A.,""55903946200";55861954300;57039170800;57039205600;",https://www.scopus.com/inward/record.uri?eid=2-s2.0-84953259054&doi=10.17323%2f1995-459X.2015.4.54.72&partnerID=40&md5=848326a38a79fe636d48ef339c88892a"",""Bibliometric analysis"; Expert interviews; International partnerships; Priorities for STI cooperation;" Science and technology cooperation"",";;;;;;;;;;;;;;;;;;;;;;;;;;;;;;;;;;;;;;;;;;;;;;;;;;;;;;;;;;;;;;;;;;;;
1;"Belousova V., Chichkanov N.,""55861727800";57190159951;",https://www.scopus.com/inward/record.uri?eid=2-s2.0-84978025189&doi=10.17323%2f1995-459x.2015.3.26.39&partnerID=40&md5=a90dd21edbf1187fdbe07257eed02d7c"",""Acceptance of technology"; Effort expectancy; Mobile banking; Perceived risk; Perceived usefulness;" Structural equation modeling (SEM)"",";;;;;;;;;;;;;;;;;;;;;;;;;;;;;;;;;;;;;;;;;;;;;;;;;;;;;;;;;;;;;;;;;;;;;
1;"Mitrova T., Kulagin V., Grushevenko D., Grushevenko E.,""6506380482";56274242400;57039179500;56274258900;",https://www.scopus.com/inward/record.uri?eid=2-s2.0-84953310163&doi=10.17323%2f1995-459X.2015.4.18.31&partnerID=40&md5=77ec0b4ad47c07f561459e0a73e57926"",""Alternative fuel"; Automotive transport; Energy efficiency; Forecast of demand; Oil products;" Technology"",";;;;;;;;;;;;;;;;;;;;;;;;;;;;;;;;;;;;;;;;;;;;;;;;;;;;;;;;;;;;;;;;;;;
1;"Chepurenko A.,""6503981307";",https://www.scopus.com/inward/record.uri?eid=2-s2.0-84937851165&doi=10.17323%2f1995-459X.2015.2.44.57&partnerID=40&md5=126b453eb958dc4363dad9df032b7e2e"",""Entrepreneurship theory"; Innovation entrepreneurship; Institutional entrepreneurship; Methodology; Russia;" Social entrepreneurship"",";;;;;;;;;;;;;;;;;;;;;;;;;;;;;;;;;;;;;;;;;;;;;;;;;;;;;;;;;;;;;;;;;;;;;;
1;"Sergeev A., Babkin E.,""56379652600";6701533991;",https://www.scopus.com/inward/record.uri?eid=2-s2.0-84937509259&doi=10.1007%2f978-3-319-19297-0_3&partnerID=40&md5=aee01d74ae0beaa8b663bff5485532fc"",""Competence"; DEMO; Enterprise engineering;" Enterprise restructuring"",""Competence"; DEMO; Enterprise engineering; Enterprise restructuring;" Modelling framework""";;;;;;;;;;;;;;;;;;;;;;;;;;;;;;;;;;;;;;;;;;;;;;;;;;;;;;;;;;;;;;;;;;;
1;"Adegbile A., Sarpong D.,""57039226000";37066444200;",https://www.scopus.com/inward/record.uri?eid=2-s2.0-84953320726&doi=10.17323%2f1995-459x.2015.4.73.80&partnerID=40&md5=9a8fe953d7339095310b70cfd6024a80"",""Conceptual consumption"; Intuitive logics methodology; Scenario planning;" Strategic foresight"",";;;;;;;;;;;;;;;;;;;;;;;;;;;;;;;;;;;;;;;;;;;;;;;;;;;;;;;;;;;;;;;;;;;;;;;
1;"Linton J., Vonortas N.,""7005943883";6602487131;",https://www.scopus.com/inward/record.uri?eid=2-s2.0-84937820091&doi=10.17323%2f1995-459X.2015.2.38.43&partnerID=40&md5=cfa3a0e7a7c196d3c2031b043bea1f21"",""peer review of R&D projects"; portfolio-based approach; project portfolio; Research and development (R&D);" research performance evaluation"",";;;;;;;;;;;;;;;;;;;;;;;;;;;;;;;;;;;;;;;;;;;;;;;;;;;;;;;;;;;;;;;;;;;;;;
1;"Gerasimova E., Bolsheva A.,""57160811900";57160978100;",https://www.scopus.com/inward/record.uri?eid=2-s2.0-84960216480&doi=10.1057%2f9781137512420.0023&partnerID=40&md5=377a81d9208fc38ec8d73a7b3f5cd05c"",,";;;;;;;;;;;;;;;;;;;;;;;;;;;;;;;;;;;;;;;;;;;;;;;;;;;;;;;;;;;;;;;;;;;;;;;;;;
1;"Larionova M.V., Rakhmangulov M., Shelepov A.,""56153880200";56153497100;56893481400;",https://www.scopus.com/inward/record.uri?eid=2-s2.0-84946842334&partnerID=40&md5=cddba47906f468d875bae4b241beab9b"",,";;;;;;;;;;;;;;;;;;;;;;;;;;;;;;;;;;;;;;;;;;;;;;;;;;;;;;;;;;;;;;;;;;;;;;;;;
1;"Larionova M.V., Rakhmangulov M., Sakharov A., Shelepov A.,""56153880200";56153497100;56956456800;56893481400;",https://www.scopus.com/inward/record.uri?eid=2-s2.0-84946835290&partnerID=40&md5=b1c35a103e09ad7c22b1e6fafe03bb64"",,";;;;;;;;;;;;;;;;;;;;;;;;;;;;;;;;;;;;;;;;;;;;;;;;;;;;;;;;;;;;;;;;;;;;;;;;
1;"Larionova M.V., Rakhmangulov M., Sakharov A., Shelepov A.,""56153880200";56153497100;56956456800;56893481400;",https://www.scopus.com/inward/record.uri?eid=2-s2.0-84946848576&partnerID=40&md5=f8f5efaf2cc323bd2e6f47816e27bf22"",,";;;;;;;;;;;;;;;;;;;;;;;;;;;;;;;;;;;;;;;;;;;;;;;;;;;;;;;;;;;;;;;;;;;;;;;;
1;"Larionova M.V., Rakhmangulov M., Sakharov A., Shelepov A., Nagornov V.,""56153880200";56153497100;56956456800;56893481400;56956995200;",https://www.scopus.com/inward/record.uri?eid=2-s2.0-84946830499&partnerID=40&md5=a0a9a73bec6fbbdf80fe76d09645b6fd"",,";;;;;;;;;;;;;;;;;;;;;;;;;;;;;;;;;;;;;;;;;;;;;;;;;;;;;;;;;;;;;;;;;;;;;;;
1;"Kirton J.J., Larionova M.,""6701350356";56153880200;",https://www.scopus.com/inward/record.uri?eid=2-s2.0-84946819835&partnerID=40&md5=6f698d0b6a76baae1a301411a90de040"",,";;;;;;;;;;;;;;;;;;;;;;;;;;;;;;;;;;;;;;;;;;;;;;;;;;;;;;;;;;;;;;;;;;;;;;;;;;
1;"Larionova M., Kirton J.J.,""56153880200";6701350356;",https://www.scopus.com/inward/record.uri?eid=2-s2.0-84946825994&partnerID=40&md5=84de48463bfd42b1e6e00f4a36326086"",,";;;;;;;;;;;;;;;;;;;;;;;;;;;;;;;;;;;;;;;;;;;;;;;;;;;;;;;;;;;;;;;;;;;;;;;;;;
1;"Van Der Aalst W.M.,""7007153024";",https://www.scopus.com/inward/record.uri?eid=2-s2.0-84939541826&doi=10.1007%2f978-3-642-45100-3_15&partnerID=40&md5=7663f738107a1279b26fe2e351b12bc3"",,""Administrative data processing"; Benchmarking; Enterprise resource management; Analysis of simulations; Business process management; Business process simulation; Business simulation; Key performance indicators; Operational decision making; Simulation approach; Simulation projects;" Risk assessment""";;;;;;;;;;;;;;;;;;;;;;;;;;;;;;;;;;;;;;;;;;;;;;;;;;;;;;;;;;;;;;;;
1;"Plakhotnik M.S., Rocco T.S., Collins J.C., Landorf H.,""36931179600";23398565100;47061177500;22635053400;",https://www.scopus.com/inward/record.uri?eid=2-s2.0-85006489444&doi=10.1080%2f13678868.2014.979009&partnerID=40&md5=a34a409ced776ef393a4bf54908a9b7b"",""Corporate culture"; Global human resource development; Multinational corporation; Nationality;" Social identity"",";;;;;;;;;;;;;;;;;;;;;;;;;;;;;;;;;;;;;;;;;;;;;;;;;;;;;;;;;;;;;;;;;;;;
1;"Pei J., Pardalos P.M., Liu X., Fan W., Yang S., Wang L.,""55377610200";7005330875;27170069000;55378224200;7406950447;57196330654;",https://www.scopus.com/inward/record.uri?eid=2-s2.0-84907164595&doi=10.3934%2fjimo.2015.11.399&partnerID=40&md5=11e0c3c5517d5c0ad082111b9868b2bf"",""Batching"; Heuristic algorithm; Supply chain scheduling;" Transportation"",";;;;;;;;;;;;;;;;;;;;;;;;;;;;;;;;;;;;;;;;;;;;;;;;;;;;;;;;;;;;;;;;;;;
1;"Vasilieva E., Rubtcova M., Kaisarova V., Kaisarov A., Pavenkov O.,""56712544900";56644950600;56902585700;56902560500;56644979900;",https://www.scopus.com/inward/record.uri?eid=2-s2.0-84944233518&partnerID=40&md5=e9e3547e58c2105e39f5d37244a7ff53"",""Governance performance"; Human capital;" Public servants"",";;;;;;;;;;;;;;;;;;;;;;;;;;;;;;;;;;;;;;;;;;;;;;;;;;;;;;;;;;;;;;;;;;;;;
12;"Polukhina E., Strelnikova A.,""57016670000";57195125526;",https://www.scopus.com/inward/record.uri?eid=2-s2.0-84951281008&partnerID=40&md5=328ed748798eb8b016a364dd0dffccac"",""Commodity"; Consumption; Cultural studies; Gift-exchange; Mixed of online and offline methods; Mobility of domestic items; Nethnography; Online communities;" Social solidarity"",";;;;;;;;;;;;;;;;;;;;;;;;;;;;;;;;;;;;;;;;;;;;;;;;;;;;;;;;;;;;;;;;;;
12;"Novikov N.A., Bryzgalov D.V., Chernyshev B.V.,""57050150500";36969128000;6701373995;",https://www.scopus.com/inward/record.uri?eid=2-s2.0-84954058429&doi=10.3389%2ffnhum.2015.00673&partnerID=40&md5=14c858b8a2e24728b9acf0ad1a3a2f3d"",""Alpha oscillations"; Cognitive control; Errors; Post-error trials; Posterror adaptations; Theta oscillations;" Time-frequency decomposition"",""attention"; error; modulation; monitoring; nerve cell network; scalp; task performance;" theta rhythm""";;;;;;;;;;;;;;;;;;;;;;;;;;;;;;;;;;;;;;;;;;;;;;;;;;;;;;;;;;;;
12;"Dranev Y., Chulok A.,""56989872200";56669650700;",https://www.scopus.com/inward/record.uri?eid=2-s2.0-84948983111&doi=10.1016%2fj.techfore.2015.09.024&partnerID=40&md5=a96d3e3f083a5bcd872416362930a415"",""Economic model"; Multifactor productivity; Scenario analysis; Technology road mapping;" Technology-push"",""Aircraft manufacture"; Commerce; Mapping; Productivity; Transportation; Economic modeling; Multifactor productivity; Road mapping; Scenario analysis; Technology pushes; Industrial economics; economics; factor productivity; market; modeling; qualitative analysis; quantitative analysis; technological development;" Russian Federation""";;;;;;;;;;;;;;;;;;;;;;;;;;;;;;;;;;;;;;;;;;;;;;;;;;;;
12;"Sokolova A.,""56691650900";",https://www.scopus.com/inward/record.uri?eid=2-s2.0-84949087715&doi=10.1016%2fj.techfore.2015.05.015&partnerID=40&md5=1108d7bafc0ab133e7879edbb7b20ee3"",""Evaluation"; Foresight;" Russia"",""Decision making"; Basic principles; Design and implementations; Evaluation; Foresight; Integrated approach; National level; Russia; Strategic decision making; Integrated control; decision making; future prospect; governance approach; integrated approach; planning method; strategic approach;" Russian Federation""";;;;;;;;;;;;;;;;;;;;;;;;;;;;;;;;;;;;;;;;;;;;;;;;;;;;;;;;;
12;"Rotondi V., Stanca L.,""56901291900";6602267755;",https://www.scopus.com/inward/record.uri?eid=2-s2.0-84944028752&doi=10.1016%2fj.joep.2015.09.008&partnerID=40&md5=9fc3ce3d41926c875b9b3f672ce18142"",""Bribery"; Corruption; Particularism;" Universalism"",";;;;;;;;;;;;;;;;;;;;;;;;;;;;;;;;;;;;;;;;;;;;;;;;;;;;;;;;;;;;;;;;;;;;;;;
12;"Zaytseva Y., Szymanski C., Gutyrchik E., Pechenkova E., Vlasova R., Wittmann M.,""36667808900";56549684100;35253306800;8548922700;56444277000;57188863036;",https://www.scopus.com/inward/record.uri?eid=2-s2.0-84984804798&doi=10.1002%2fpchj.115&partnerID=40&md5=997cebe84f08c611515e63eed76ed917"",""Disembodiment"; fMRI; Neurocognition; Schizotypal disorder; Self; Somatopsychic depersonalization; Time perception;" Touch"",""adult"; brain; case report; complication; depersonalization; human; male; neuropsychological test; nuclear magnetic resonance imaging; pathophysiology; physiology; psychomotor performance; schizotypal personality disorder; somatoform disorder; Adult; Brain; Depersonalization; Humans; Magnetic Resonance Imaging; Male; Neuropsychological Tests; Psychomotor Performance; Schizotypal Personality Disorder;" Somatoform Disorders""";;;;;;;;;;;;;;;;;;;;;;;;;;;;;;;;;;;;;;;;
12;"Antipov E.A., Pokryshevskaya E.B.,""36458182800";36458850000;",https://www.scopus.com/inward/record.uri?eid=2-s2.0-84949783680&partnerID=40&md5=706708bf81aaebfc9aca1649e47fc75c"",""Apartments"; Jinx number; Lucky number; Real estate;" Superstitions"",";;;;;;;;;;;;;;;;;;;;;;;;;;;;;;;;;;;;;;;;;;;;;;;;;;;;;;;;;;;;;;;;;;;;;;
12;"Linton J.D.,""7005943883";",https://www.scopus.com/inward/record.uri?eid=2-s2.0-84949530346&doi=10.1016%2fj.techfore.2015.05.001&partnerID=40&md5=24afe7a2bb1701bbc346e4f05164a641"",""Case"; Demonstration; Pedagogy; Process innovation;" Whisky"",""Computer aided software engineering"; Demonstrations; Teaching; Engineered materials; Enhance learning; Experiential learning; Pedagogy; Process Innovation; Product innovation; Teaching innovations; Whisky; Engineers; innovation; learning; teaching;" technological development""";;;;;;;;;;;;;;;;;;;;;;;;;;;;;;;;;;;;;;;;;;;;;;;;;;;;;;;;
12;"Kukshinov E.Y.,""57133020600";",https://www.scopus.com/inward/record.uri?eid=2-s2.0-84958950168&doi=10.4018%2fIJCBPL.2015100106&partnerID=40&md5=8ee21166de5a1e28df3fd0052a009798"",""Immersion"; Online Disinhibition Effect; Self-Concept; Self-Presentation;" Virtual Self"",";;;;;;;;;;;;;;;;;;;;;;;;;;;;;;;;;;;;;;;;;;;;;;;;;;;;;;;;;;;;;;;;;;;;;;;
12;"Kovaleva E.V., Mirkin B.G.,""56909717700";35428028600;",https://www.scopus.com/inward/record.uri?eid=2-s2.0-84947126382&doi=10.1007%2fs00357-015-9186-y&partnerID=40&md5=5a8bb37cf55efb1ebe6dee75543cd173"",""Bisecting k-means"; Cluster structure generator; Computational experiment; Divisive clustering; Principal directions; Random directions; Split base decomposition;" Uphierarchy"",";;;;;;;;;;;;;;;;;;;;;;;;;;;;;;;;;;;;;;;;;;;;;;;;;;;;;;;;;;;;;;;;;;;
