;Область, Авторы,Идентификаторы авторов,Ссылка,Ключевые слова автора,Ключевые слова указателя;;;;;;;;;;;;;;;;;;;;;;;;;;;;;;;;;;;;;;;;;;;;;;;;;;;;;;;;;;;;;;;;;;;;;;;;;;;;
10;"Bocharov P., Goryashko A., Nikulchev E.V.,""56841515000";6701426556;6504081534;",https://www.scopus.com/inward/record.uri?eid=2-s2.0-84941588292&doi=10.12988%2fams.2015.56415&partnerID=40&md5=c8525bf03251ed23703979e29698965d"",""coalition"; Coalition; Colonel blotto game; Game theory; general lotto game; Tournament;" Tournament"",";;;;;;;;;;;;;;;;;;;;;;;;;;;;;;;;;;;;;;;;;;;;;;;;;;;;;;;;;;;;;;;;;;;
10;"Zlotnik A., Romanova A.,""7101674545";56167257100;",https://www.scopus.com/inward/record.uri?eid=2-s2.0-84925289978&doi=10.1016%2fj.apnum.2014.05.003&partnerID=40&md5=933c8f18b8a8ddfbd8838a19c022034f"",""Crank-Nicolson discretization in time"; Discrete transparent boundary conditions; Error estimate; Numerov discretization in space; Practical error analysis; Richardson extrapolation; Schrödinger equation; Stability; Strang splitting; Time-dependent; Tunnel effect;" Uniqueness"",""Boundary value problems"; Convergence of numerical methods; Electron tunneling; Error analysis; Extrapolation; Finite difference method; Initial value problems; Strip metal; Dinger equation; Discrete transparent boundary conditions; Discretizations; Error estimates; Richardson extrapolation; Strang splitting; Time dependent; Uniqueness;" Boundary conditions""";;;;;;;;;;;;;;;;;;;;;;;;;;;;;;;;;;;;;;;;;;;;;;;
10;"Pirkovskii A.Yu.,""6507150595";",https://www.scopus.com/inward/record.uri?eid=2-s2.0-84928336462&doi=10.4171%2fJNCG%2f192&partnerID=40&md5=5a729540fea8a53aed20dca228766d7d"",""Forster's theorem"; Free polydisk; Fréchet algebra; HFG algebra; Quantum polydisk; Smash product;" Stein space"",";;;;;;;;;;;;;;;;;;;;;;;;;;;;;;;;;;;;;;;;;;;;;;;;;;;;;;;;;;;;;;;;;;;;;
10;"Ivanov O.U., Bartunov S.O.,""57022185600";55583130200;",https://www.scopus.com/inward/record.uri?eid=2-s2.0-84951871445&doi=10.1007%2f978-3-319-26123-2_19&partnerID=40&md5=1d1bb13d1455bdbd8869c2e8b675643e"",""Graph embedding"; Graph visualization; Link prediction; Representation learning;" Social network analysis"",""Forecasting"; Graphic methods; Image analysis; Learning algorithms; Social networking (online); Visualization; Computational resources; Graph embeddings; Graph visualization; Link prediction; Online learning algorithms; Representation learning; State-of-the-art methods; Vector representations;" Graph theory""";;;;;;;;;;;;;;;;;;;;;;;;;;;;;;;;;;;;;;;;;;;;;;;;;;;;;;;;
10;"Voskresenskiy V., Sukharev K., Musabirov I., Alexandrov D.,""56543641400";56543531000;56543502400;9243817900;",https://www.scopus.com/inward/record.uri?eid=2-s2.0-84924366627&doi=10.1007%2f978-3-319-15168-7_7&partnerID=40&md5=9e73f00db2775384a98f455666b23b91"",""Homeowners"; Neighbors cooperation;" Online communities"",""Apartment houses"; Information science; Online systems; Statistics; Websites; Homeowners; Latent dirichlet allocations; Neighbors cooperation; On-line communication; On-line communities; On-line observations; Patterns of communication; Social networking sites;" Social networking (online)""";;;;;;;;;;;;;;;;;;;;;;;;;;;;;;;;;;;;;;;;;;;;;;;;;;;;;;;;;
10;"Podolskii V.V.,""23092161300";",https://www.scopus.com/inward/record.uri?eid=2-s2.0-84950127860&doi=10.1007%2f978-3-319-20297-6_2&partnerID=40&md5=afde1935b9febf1c2d3e0e0856f42c4d"",,""Query processing"; Boolean circuit; Circuit complexity; Logical theories; Lower and upper bounds; Ontology-based data access; Query answering;" Ontology""";;;;;;;;;;;;;;;;;;;;;;;;;;;;;;;;;;;;;;;;;;;;;;;;;;;;;;;;;;;;;;;;;;;;
10;"Kutuzov A., Kuzmenko E.,""57194718597";56878851700;",https://www.scopus.com/inward/record.uri?eid=2-s2.0-84942565952&doi=10.1007%2f978-3-319-18111-0_4&partnerID=40&md5=0c5f0e972c12a36fa63e174ecd54b11b"",""Corpora comparison"; Deep learning; Lexical co-occurrence networks; Russian National Corpus; Semantic similarity; Vector representations of lexical units; Web as corpus;" Word2vec"",""Computational linguistics"; Linguistics; Semantics; Text processing; Websites; Co-occurrence networks; Corpora comparison; Deep learning; Lexical unit; Russian National Corpus; Semantic similarity; Web as corpus; Word2vec;" Semantic Web""";;;;;;;;;;;;;;;;;;;;;;;;;;;;;;;;;;;;;;;;;;;;;;;;;;;;;;
10;"Vassiliev V.A.,""7006638278";",https://www.scopus.com/inward/record.uri?eid=2-s2.0-84926688206&doi=10.1112%2fblms%2fbdv002&partnerID=40&md5=6813d491d246a386b53aad76fa5d9495"",,";;;;;;;;;;;;;;;;;;;;;;;;;;;;;;;;;;;;;;;;;;;;;;;;;;;;;;;;;;;;;;;;;;;;;;;;;;;
10;"Agranovich M.S.,""15126914300";",https://www.scopus.com/inward/record.uri?eid=2-s2.0-84938495764&partnerID=40&md5=f14088003c0ae6e21ca104dcad8564f9"",""Abel–Lidskii summability"; Completeness of root functions; Discrete spectrum; Lipschitz domain; Spectral problem;" Strongly elliptic system"",";;;;;;;;;;;;;;;;;;;;;;;;;;;;;;;;;;;;;;;;;;;;;;;;;;;;;;;;;;;;;;;;;;;;;;
10;"Kutuzov A.,""57194718597";",https://www.scopus.com/inward/record.uri?eid=2-s2.0-84951859718&doi=10.1007%2f978-3-319-25485-2_12&partnerID=40&md5=4186c927eb70ae6316fe196880314111"",,""Information retrieval"; Semantic Web; Semantics; Co-occurrence Graph; Distributional semantics; Linguistic data; Semantic clustering; Web search results; Word sense inductions;" World Wide Web""";;;;;;;;;;;;;;;;;;;;;;;;;;;;;;;;;;;;;;;;;;;;;;;;;;;;;;;;;;;;;;;;;;
10;"De Palma G., Mari A., Giovannetti V., Holevo A.S.,""55781428900";24832078800;7004137815;6603727683;",https://www.scopus.com/inward/record.uri?eid=2-s2.0-84930222002&doi=10.1063%2f1.4921265&partnerID=40&md5=ea2bb3914ca6b0c0ee38b444c6159bf0"",,";;;;;;;;;;;;;;;;;;;;;;;;;;;;;;;;;;;;;;;;;;;;;;;;;;;;;;;;;;;;;;;;;;;;;;;;
10;"Zlotnik A.,""7101674545";",https://www.scopus.com/inward/record.uri?eid=2-s2.0-84947093434&doi=10.1007%2f978-3-319-20239-6_12&partnerID=40&md5=828d5019f4d64212e1132487ef52ac50"",""Crank-Nicolson scheme"; Discrete transparent boundary conditions; Error estimates; Finite element method; Stability; Superconvergence; Time-dependent schrödinger equation;" Unbounded domain"",""Boundary conditions"; Boundary value problems; Convergence of numerical methods; Errors; Finite difference method; Geometry; Initial value problems; Stability; Crank-Nicolson scheme; Dinger equation; Discrete transparent boundary conditions; Error estimates; Super-convergence; Unbounded domain;" Finite element method""";;;;;;;;;;;;;;;;;;;;;;;;;;;;;;;;;;;;;;;;;;;;;;;;;;;;;;
10;"Onishchenko V., Penikas H.,""56902428200";55471176500;",https://www.scopus.com/inward/record.uri?eid=2-s2.0-84944248548&doi=10.1007%2f978-3-319-09946-0__15&partnerID=40&md5=7f8b06643095bfc7ae0c6e89669230ec"",""Copula"; Nonlinear time series; Onparametric estimation of copula;" Structural break"",";;;;;;;;;;;;;;;;;;;;;;;;;;;;;;;;;;;;;;;;;;;;;;;;;;;;;;;;;;;;;;;;;;;;;;;
10;"Zlotnik A., Zlotnik I.,""7101674545";14043052500;",https://www.scopus.com/inward/record.uri?eid=2-s2.0-84926624780&doi=10.1515%2fcmam-2015-0007&partnerID=40&md5=c25a92893424cdd4547c2d0916b7fde8"",""Cauchy Problem"; Discrete Transparent Boundary Conditions; Finite Element Method; Practical Error Analysis; Richardson Extrapolation; Stability;" Time-Dependent Schrödinger Equation"",""Boundary conditions"; Computation theory; Convergence of numerical methods; Error analysis; Extrapolation; Partial differential equations; Problem solving; Cauchy problems; Computational costs; Dinger equation; Discontinuous potentials; Discrete transparent boundary conditions; Non-smooth solutions; Numerical experiments; Richardson extrapolation;" Finite element method""";;;;;;;;;;;;;;;;;;;;;;;;;;;;;;;;;;;;;;;;;;;;;;;;;;;;;
10;"Burman Y., Lvovski S.,""15761699300";35362597800;",https://www.scopus.com/inward/record.uri?eid=2-s2.0-84921715596&partnerID=40&md5=e4e5f8b859737bbb45c8c303e34f5588"",""Chisini conjecture"; Monodromy; Picard–Lefschetz theory; Plane algebraic curve;" Projection"",";;;;;;;;;;;;;;;;;;;;;;;;;;;;;;;;;;;;;;;;;;;;;;;;;;;;;;;;;;;;;;;;;;;;;;
10;"Petrov L.F.,""26634317000";",https://www.scopus.com/inward/record.uri?eid=2-s2.0-84951023749&doi=10.1007%2f978-3-319-12307-3_51&partnerID=40&md5=22fbad3dceaf5b9df019658cd61043c4"",,""Algorithms"; Degrees of freedom (mechanics); Differential equations; Dynamical systems; Nonlinear dynamical systems; Nonlinear equations; Ordinary differential equations; Computing process; Initial conditions; Interactive computer algorithms; Non-autonomous dynamics; One and two degrees of freedoms; Operational control; Stability analysis; Strange attractors;" Computer control systems""";;;;;;;;;;;;;;;;;;;;;;;;;;;;;;;;;;;;;;;;;;;;;;;;;;;;;;;;;;;;
10;"Esterov A., Gusev G.,""8697123200";16419882600;",https://www.scopus.com/inward/record.uri?eid=2-s2.0-84918828341&doi=10.1016%2fj.jsc.2014.09.007&partnerID=40&md5=61f9b67056b943d5507e2c827dd8fd12"",""Classification"; Mixed volume; Newton polyhedra; Polynomial equations; Polynomial-time algorithm;" Search for solutions"",";;;;;;;;;;;;;;;;;;;;;;;;;;;;;;;;;;;;;;;;;;;;;;;;;;;;;;;;;;;;;;;;;;;;;
10;"van der Aalst W.M.P., Guo S., Gorissen P.,""7007153024";56529947300;55361119700;",https://www.scopus.com/inward/record.uri?eid=2-s2.0-84923646652&doi=10.1007%2f978-3-662-46436-6_6&partnerID=40&md5=2ccf112f8cb8cb195b416b7c0539fa04"",""Comparative process mining"; Learning analytics; Online analytical processing;" Process mining"",""Compliance control"; Data mining; Education; Education computing; Geometry; Petri nets; Automated discovery; Female students; International students; Learning analytics; On-line analytical processing; Process mining; Process Modeling; Single process;" Students""";;;;;;;;;;;;;;;;;;;;;;;;;;;;;;;;;;;;;;;;;;;;;;;;;;;;;;;;
10;"Galkin S., Mellit A., Smirnov M.,""55567948600";55354478700;55788441100;",https://www.scopus.com/inward/record.uri?eid=2-s2.0-84946217342&doi=10.1093%2fimrn%2frnu205&partnerID=40&md5=c8180c54ec98213863e038bc5ccfd2c7"",,";;;;;;;;;;;;;;;;;;;;;;;;;;;;;;;;;;;;;;;;;;;;;;;;;;;;;;;;;;;;;;;;;;;;;;;;;
10;"Komarov M., Konovalov N., Kazantsev N.,""6603888073";56458080100;36237354600;",https://www.scopus.com/inward/record.uri?eid=2-s2.0-84964556651&doi=10.1109%2fDSDIS.2015.125&partnerID=40&md5=926ca7d8b6412194f0841ec9069269fb"",""Agent-based theory"; business model; Internet of Service; Internet of Things; Smart home; Social Web of Service;" Web of Service"",""Automation"; Behavioral research; Computation theory; Intelligent buildings; Internet; Internet of things; Agent based; Business modeling; Internet of Services; Smart homes; Social webs; Web of Service;" Web services""";;;;;;;;;;;;;;;;;;;;;;;;;;;;;;;;;;;;;;;;;;;;;;;;;;;;;;;
10;"Kazarian M.È., Lando S.K.,""56271988700";6602320062;",https://www.scopus.com/inward/record.uri?eid=2-s2.0-84942055178&doi=10.1070%2fRM2015v070n03ABEH004952&partnerID=40&md5=ce45bcaf90332401e3547e2d9daacfc5"",""Boson-Fermion correspondence"; Hurwitz numbers; Integrable systems; Kadomtsev-Petviashvili hierarchy;" Toda lattice hierarchy"",";;;;;;;;;;;;;;;;;;;;;;;;;;;;;;;;;;;;;;;;;;;;;;;;;;;;;;;;;;;;;;;;;;;;;;
10;"Bodzenta A.,""56524415100";",https://www.scopus.com/inward/record.uri?eid=2-s2.0-84923253983&doi=10.1090%2fS0002-9939-2014-12420-8&partnerID=40&md5=ed1f7aa786dfc1140cd7b61c9fba019d"",,";;;;;;;;;;;;;;;;;;;;;;;;;;;;;;;;;;;;;;;;;;;;;;;;;;;;;;;;;;;;;;;;;;;;;;;;;;;
10;"Esterov A., Takeuchi K.,""8697123200";35345867200;",https://www.scopus.com/inward/record.uri?eid=2-s2.0-84927642693&doi=10.1353%2fajm.2015.0014&partnerID=40&md5=27222d8a3ce3d9409dc9e0a55ae4c96e"",,";;;;;;;;;;;;;;;;;;;;;;;;;;;;;;;;;;;;;;;;;;;;;;;;;;;;;;;;;;;;;;;;;;;;;;;;;;
10;"Zlotnik A.,""7101674545";",https://www.scopus.com/inward/record.uri?eid=2-s2.0-84931858408&doi=10.3934%2fkrm.2015.8.587&partnerID=40&md5=8cd12b6f1f84f46578ab3361ffc354e3"",""Approximate transparent boundary conditions"; Crank-nicolson scheme; Error estimates; Global richardson extrapolation; Numerov scheme; Stability; Time-dependent Schrödinger equation;" Unbounded domain"",";;;;;;;;;;;;;;;;;;;;;;;;;;;;;;;;;;;;;;;;;;;;;;;;;;;;;;;;;;;;;;;;;;;;
10;"Amerik E., Verbitsky M.,""56619370700";7004282961;",https://www.scopus.com/inward/record.uri?eid=2-s2.0-84950112235&doi=10.1093%2fimrn%2frnv133&partnerID=40&md5=e32c41be2653d842f1c65425c9e9ef4b"",,";;;;;;;;;;;;;;;;;;;;;;;;;;;;;;;;;;;;;;;;;;;;;;;;;;;;;;;;;;;;;;;;;;;;;;;;;;
10;"Dynnikov I., Skripchenko A.,""6602619480";55185138800;",https://www.scopus.com/inward/record.uri?eid=2-s2.0-84960081631&doi=10.1090%2fmosc%2f246&partnerID=40&md5=c1a923b2fdc47c9b7e9887a7e08052ed"",""Band complex"; Ergodicity; Measured foliation; Rauzy induction;" Rips machine"",";;;;;;;;;;;;;;;;;;;;;;;;;;;;;;;;;;;;;;;;;;;;;;;;;;;;;;;;;;;;;;;;;;;;;;
10;"Van Der Aalst W.M.P., Kalenkova A., Rubin V., Verbeek E.,""7007153024";36600541900;14016543900;7006780913;",https://www.scopus.com/inward/record.uri?eid=2-s2.0-84937468868&doi=10.1007%2f978-3-319-19488-2_15&partnerID=40&md5=e5d12b40bc792fa5ef6668f1a69e3747"",,""Data mining"; Economic and social effects; Iterative methods; Maximum principle; Expectation - maximizations; Generic process; Localized events; Location information; Process Discovery; Process mining; Process Modeling; Software systems;" Petri nets""";;;;;;;;;;;;;;;;;;;;;;;;;;;;;;;;;;;;;;;;;;;;;;;;;;;;;;;;;;;;
10;"Leonov G.A., Alexeeva T.A.,""7006784740";56698876700;",https://www.scopus.com/inward/record.uri?eid=2-s2.0-84925053376&doi=10.1134%2fS1064562415010020&partnerID=40&md5=cdf98d08ba9a1d51099bf3c33d8d530c"",,";;;;;;;;;;;;;;;;;;;;;;;;;;;;;;;;;;;;;;;;;;;;;;;;;;;;;;;;;;;;;;;;;;;;;;;;;;
10;"Belomestny D., Panov V.,""15069577900";55362066800;",https://www.scopus.com/inward/record.uri?eid=2-s2.0-84941127515&doi=10.1214%2f15-EJS1063&partnerID=40&md5=59f765e928ad6acadbf4bfad9be67386"",""Exponential functional"; Generalized Ornstein-Uhlenbeck process; Lévy process;" Mellin transform"",";;;;;;;;;;;;;;;;;;;;;;;;;;;;;;;;;;;;;;;;;;;;;;;;;;;;;;;;;;;;;;;;;;;;;;;
10;"Ozhegov E.,""55880875200";",https://www.scopus.com/inward/record.uri?eid=2-s2.0-84944251986&doi=10.1007%2f978-3-319-09946-0__16&partnerID=40&md5=b7b8d53830f6bd48b9480e619c86cce4"",""Demand for loans"; Endogeneity;" Sample selection"",";;;;;;;;;;;;;;;;;;;;;;;;;;;;;;;;;;;;;;;;;;;;;;;;;;;;;;;;;;;;;;;;;;;;;;;;;
10;"Karasev M.,""7004372754";",https://www.scopus.com/inward/record.uri?eid=2-s2.0-84924353874&doi=10.1134%2fS1061920815010045&partnerID=40&md5=b39a32f6768f3faf831e5e6d8600d900"",,";;;;;;;;;;;;;;;;;;;;;;;;;;;;;;;;;;;;;;;;;;;;;;;;;;;;;;;;;;;;;;;;;;;;;;;;;;;
10;"Karminsky A.,""37053822300";",https://www.scopus.com/inward/record.uri?eid=2-s2.0-84944261568&doi=10.1007%2f978-3-319-09946-0__8&partnerID=40&md5=e91fded3820fe610675724465e917406"",""Econometric model"; Mapping; Rating; Rating scale;" Risk management"",";;;;;;;;;;;;;;;;;;;;;;;;;;;;;;;;;;;;;;;;;;;;;;;;;;;;;;;;;;;;;;;;;;;;;;;
10;"Osipov D.,""24481886700";",https://www.scopus.com/inward/record.uri?eid=2-s2.0-84945933731&doi=10.1007%2f978-3-319-23440-3_8&partnerID=40&md5=368151b3f5b22541a6c0de484a1bd601"",""Capacity"; Multiuser interference; Order statistics;" Single user receiver"",""Artificial intelligence"; Computers; Capacity; Multi-user interference; Multiple access systems; Order statistics; Single users;" Channel capacity""";;;;;;;;;;;;;;;;;;;;;;;;;;;;;;;;;;;;;;;;;;;;;;;;;;;;;;;;;;;;;;;;;
10;"Popov V.L.,""13605069500";",https://www.scopus.com/inward/record.uri?eid=2-s2.0-84957803255&doi=10.2140%2fpjm.2015.279.423&partnerID=40&md5=d4b8c86915b87eeb7d58cc4e60df633d"",""Borel subgroup"; Module; Orbit; Reductive algebraic group;" Weight"",";;;;;;;;;;;;;;;;;;;;;;;;;;;;;;;;;;;;;;;;;;;;;;;;;;;;;;;;;;;;;;;;;;;;;;;
10;"Lyashevskaya O., Kashkin E.,""37090988800";56292369600;",https://www.scopus.com/inward/record.uri?eid=2-s2.0-84951871065&doi=10.1007%2f978-3-319-26123-2_34&partnerID=40&md5=b679f6cba8120e4afdf0f7b55d3631f0"",""Construction Grammar"; Corpus linguistics; Frames; Morphosyntax; Polysemy; Russian;" Semantic roles"",""Semantics"; Construction grammar; Corpus linguistics; Frames; Morphosyntax; Polysemy; Russian; Semantic roles;" Image analysis""";;;;;;;;;;;;;;;;;;;;;;;;;;;;;;;;;;;;;;;;;;;;;;;;;;;;;;;;;;;;
10;"Pospelov I.G., Radionov S.A.,""6603057053";56748128600;",https://www.scopus.com/inward/record.uri?eid=2-s2.0-84938352389&doi=10.12988%2fams.2015.54353&partnerID=40&md5=fd48523332ab3e57fd25eb3ee0a94b33"",""Optimal dividend policy";" Stochastic control"",";;;;;;;;;;;;;;;;;;;;;;;;;;;;;;;;;;;;;;;;;;;;;;;;;;;;;;;;;;;;;;;;;;;;;;;;;
10;"Burov A.A., Kosenko I.I.,""14120866400";6602748639;",https://www.scopus.com/inward/record.uri?eid=2-s2.0-84924086437&doi=10.1016%2fj.ijnonlinmec.2015.01.011&partnerID=40&md5=15eb6112fc13e9741e3b4866a56318ca"",""Dumb-bell of a variable length"; Keplerian orbit; Necessary conditions of stability; Newtonian attraction; Orbital dynamics;" Relative equilibria"",""Astronomy"; Keplerian orbits; Newtonians; Orbital dynamics; Relative equilibria; Variable length;" Bells""";;;;;;;;;;;;;;;;;;;;;;;;;;;;;;;;;;;;;;;;;;;;;;;;;;;;;;;;;;;;;;;
10;"Batsyn M., Ponomarenko A.,""37111907600";55345834600;",https://www.scopus.com/inward/record.uri?eid=2-s2.0-84955291930&doi=10.1007%2f978-3-319-27926-8_7&partnerID=40&md5=73bdc940f730a036c2cdcb15914db95a"",""Insertion heuristic"; Site-dependent; Soft time windows; Split-deliveries;" Truck and trailer"",""Artificial intelligence"; Big data; Learning systems; Optimization; Sales; Transportation routes; Truck trailers; Trucks; Unloading; Vehicle routing; Vehicles; Insertion heuristic; Randomized mechanism; Site-dependent; Soft time windows; Split delivery; Transportation problem; Truck and trailer routing problems; Vehicle assignment;" Truck transportation""";;;;;;;;;;;;;;;;;;;;;;;;;;;;;;;;;;;;;;;;;;;;;;;;;;;
10;"Savchenko A.V.,""42962245900";",https://www.scopus.com/inward/record.uri?eid=2-s2.0-84984600768&doi=10.1007%2f978-3-319-19941-2_23&partnerID=40&md5=6d32f694b8f4c27a50ee06d077ebe252"",""Approximate nearest neighbor"; Directed enumeration method; Face recognition; Kullback-Leibler divergence;" Statistical pattern recognition"",""Artificial intelligence"; Face recognition; Heuristic methods; Nearest neighbor search; Optimization; Speech recognition; Composite objects; Directed enumeration methods; Kullback Leibler divergence; Medium-sized database; Minimum information; Optimal greedy algorithm; Statistical pattern recognition; Statistical recognition;" Pattern recognition""";;;;;;;;;;;;;;;;;;;;;;;;;;;;;;;;;;;;;;;;;;;;;;;;;;;;;;;;;
10;"Koldanov A.P., Kalyagin V.A., Pardalos P.M.,""6603418986";13002922100;7005330875;",https://www.scopus.com/inward/record.uri?eid=2-s2.0-84955243226&doi=10.1007%2f978-3-319-27926-8_3&partnerID=40&md5=e0f420ae791f43b20adba306edc5e1f8"",""Hochberg procedure"; Holm procedure; Market network; Sharp ratio; Stepwise multiple testing statistical procedures;" Stock selection"",""Artificial intelligence"; Learning systems; Statistical methods; Statistical tests; Hochberg procedure; Holm procedure; Multiple testing; Sharp ratios; Stock selections;" Big data""";;;;;;;;;;;;;;;;;;;;;;;;;;;;;;;;;;;;;;;;;;;;;;;;;;;;;;;;;;;
10;"Makarov I.,""57203060623";",https://www.scopus.com/inward/record.uri?eid=2-s2.0-84983127836&doi=10.1007%2fs11787-015-0117-9&partnerID=40&md5=eceb46636bd086fc3f96f02651c6e627"",""closed class"; finite total equivalence system;" Many-valued logic"",";;;;;;;;;;;;;;;;;;;;;;;;;;;;;;;;;;;;;;;;;;;;;;;;;;;;;;;;;;;;;;;;;;;;;;;;;
10;"Maslov V.P.,""7202893841";",https://www.scopus.com/inward/record.uri?eid=2-s2.0-84924352662&doi=10.1007%2fs11232-015-0264-4&partnerID=40&md5=970b9b72637b97208f5fcffa0d7b89a0"",""Boltzmann statistics"; Bose-Einstein statistics; Gibbs paradox; parastatistics; spinodal;" van der Waals model"",";;;;;;;;;;;;;;;;;;;;;;;;;;;;;;;;;;;;;;;;;;;;;;;;;;;;;;;;;;;;;;;;;;;;;;
10;"Makhlin I.Y.,""56556846000";",https://www.scopus.com/inward/record.uri?eid=2-s2.0-84924972436&doi=10.1007%2fs10688-015-0079-y&partnerID=40&md5=bfe6ca0594531fa1f7cde4cad4659a6c"",""affine Lie algebras"; Brion’s theorem; character formulas; convex polyhedra;" representation theory"",";;;;;;;;;;;;;;;;;;;;;;;;;;;;;;;;;;;;;;;;;;;;;;;;;;;;;;;;;;;;;;;;;;;;;;;
10;"Grines V.Z., Noskova M.K., Pochinka O.V.,""55978243000";57159753500;6507516545;",https://www.scopus.com/inward/record.uri?eid=2-s2.0-84960106013&doi=10.1090%2fmosc%2f249&partnerID=40&md5=078f61044aba55c8417792267fedf836"",""DA-diffeomorphism"; Energy function;" Structurally stable"",";;;;;;;;;;;;;;;;;;;;;;;;;;;;;;;;;;;;;;;;;;;;;;;;;;;;;;;;;;;;;;;;;;;;;;;
10;"Belomestny D.V., Prokhorov A.V.,""15069577900";7201653860;",https://www.scopus.com/inward/record.uri?eid=2-s2.0-84947801601&doi=10.1137%2fS0040585X97T987363&partnerID=40&md5=faf4140941a72081c6d30a69b57671dc"",""Characterization"; Independent linear statistics;" Stability"",";;;;;;;;;;;;;;;;;;;;;;;;;;;;;;;;;;;;;;;;;;;;;;;;;;;;;;;;;;;;;;;;;;;;;;;;
10;"Dudok E., Guerreiro S., Babkin E., Pergl R., Van Kervel S.J.,""56549932900";24536769600;6701533991;26633154200;55440728400;",https://www.scopus.com/inward/record.uri?eid=2-s2.0-84937467918&doi=10.1007%2f978-3-319-19297-0_1&partnerID=40&md5=6915a5ffda55b8a1cf22114ae57895de"",""Demo methodology"; Enterprise operating system; Enterprise operational analysis; Governance risk compliance;" Process mining"",""Data mining"; Risk assessment; Business procedures; Conformance checking; Demo methodology; Enterprise engineering; Governance risks; Operational analysis; Process mining; Transactional data;" Quality control""";;;;;;;;;;;;;;;;;;;;;;;;;;;;;;;;;;;;;;;;;;;;;;;;;;;;;;;;;
10;"Hansen K.A., Podolskii V.V.,""8954556100";23092161300;",https://www.scopus.com/inward/record.uri?eid=2-s2.0-85027953658&doi=10.1016%2fj.ic.2014.09.008&partnerID=40&md5=f430bf391f84e2379f9a750fa575df4f"",""Communication complexity"; Polynomial threshold functions;" Threshold circuits"",""Polynomials"; Threshold elements; Communication complexity; Degree restrictions; Polynomial degree; Polynomial length; Polynomial threshold functions; Structural studies; Super-polynomials; Threshold circuits;" Boolean functions""";;;;;;;;;;;;;;;;;;;;;;;;;;;;;;;;;;;;;;;;;;;;;;;;;;;;;;;;;;;;;;
10;"Buzmakov A., Kuznetsov S.O., Napoli A.,""56018681500";7202573378;7005873419;",https://www.scopus.com/inward/record.uri?eid=2-s2.0-84959420367&doi=10.1007%2f978-3-319-23525-7_10&partnerID=40&md5=b08703d98aa205ca69544d57cab5bf99"",""Interval tuple Data"; Nonmonotonic constraints;" Pattern mining"",""Artificial intelligence"; Data mining; Anti-monotonicity; Exponential explosion; Infrequent patterns; Interval tuple Data; Monotonic functions; Nonmonotonic; Pattern mining; Pattern selection;" Learning systems""";;;;;;;;;;;;;;;;;;;;;;;;;;;;;;;;;;;;;;;;;;;;;;;;;;;;;;;;;;;;;
10;"Bolshakova E.I., Efremova N.E.,""13608846000";57022201400;",https://www.scopus.com/inward/record.uri?eid=2-s2.0-84951872515&doi=10.1007%2f978-3-319-26123-2_29&partnerID=40&md5=e72c7269f04488ce38d4bd08105dedbc"",""Automatic term extraction"; Lexico-syntactic patterns; Multiword terms; Term occurrences in scientific text;" Text variants of terms"",""Character recognition"; Extraction; Image analysis; Syntactics; Text processing; Automatic term extraction; Lexico-syntactic patterns; Multiword terms; Scientific texts; Text variants of terms;" Natural language processing systems""";;;;;;;;;;;;;;;;;;;;;;;;;;;;;;;;;;;;;;;;;;;;;;;;;;;;;;;;;;;;
10;"Sidorova M.V., Divochiy A., Vachtomin Y.B., Smirnov K.V.,""56878620300";22979146300;8561959900;22945547300;",https://www.scopus.com/inward/record.uri?eid=2-s2.0-84943405670&doi=10.1117%2f12.2178131&partnerID=40&md5=aa0b8d80115e04d561eb244721d0c203"",""Single-photon detecting"; SNSPD; SSPD; Superconductivity; TCSPC;" Telecommunication wavelength"",""Avalanche photodiodes"; Infrared devices; Optical data processing; Optical fiber coupling; Photodetectors; Photons; Single mode fibers; Superconductivity; Timing jitter; Single photons; SNSPD; SSPD; TCSPC; Telecommunication wavelengths;" Particle beams""";;;;;;;;;;;;;;;;;;;;;;;;;;;;;;;;;;;;;;;;;;;;;;;;;;;;;
10;"Zhikharevich B.S., Rusetskay O.V., Mladenović N.,""6507980618";56521742800;55947364100;",https://www.scopus.com/inward/record.uri?eid=2-s2.0-84923083276&doi=10.1016%2fj.endm.2014.11.028&partnerID=40&md5=608f25e2bfa10c1c60c7278ea3318706"",""Clustering"; K-Means; Ranking; Socio-economic;" Variable neighborhood search"",";;;;;;;;;;;;;;;;;;;;;;;;;;;;;;;;;;;;;;;;;;;;;;;;;;;;;;;;;;;;;;;;;;;;;
10;"Bernstein A.V., Kuleshov A.P., Yanovich Yu.A.,""55926029700";25621485600;57003326000;",https://www.scopus.com/inward/record.uri?eid=2-s2.0-84958231165&doi=10.1117%2f12.2228741&partnerID=40&md5=41e33bafd0ce3893bc88c397a5f2e97a"",""conformal embedding"; Image manifold; isometry embedding; low-dimensional parameterization; manifold learning; tangent spaces;" tangent vector fields"",""Computer vision"; Parameterization; Vectors; conformal embedding; Image manifolds; isometry embedding; Low dimensional; Manifold learning; Tangent space; Tangent vectors;" Vector spaces""";;;;;;;;;;;;;;;;;;;;;;;;;;;;;;;;;;;;;;;;;;;;;;;;;;;;;;;;;
10;"Chepyzhov V.V.,""6603478247";",https://www.scopus.com/inward/record.uri?eid=2-s2.0-84921873237&doi=10.3934%2fdcdsb.2015.20.811&partnerID=40&md5=20d20be01332eceb302ee2618067cd44"",""Dissipative 2d Euler system"; Trajectory attractor;" Zero viscosity limit"",";;;;;;;;;;;;;;;;;;;;;;;;;;;;;;;;;;;;;;;;;;;;;;;;;;;;;;;;;;;;;;;;;;;;;;;;;
10;"Naumenko V.,""56902339000";",https://www.scopus.com/inward/record.uri?eid=2-s2.0-84944263132&doi=10.1007%2f978-3-319-09946-0__14&partnerID=40&md5=d2880fd8bc49d4cb110a1987a1c24c6e"",,";;;;;;;;;;;;;;;;;;;;;;;;;;;;;;;;;;;;;;;;;;;;;;;;;;;;;;;;;;;;;;;;;;;;;;;;;;;
