;Область, Авторы,Идентификаторы авторов,Ссылка,Ключевые слова автора,Ключевые слова указателя;;;;;;;;;;;;;;;;;;;;;;;;;;;;;;;;;;;;;;;;;;;;;;;;;;;;;;;;;;;;;;;;;;;;;;;;;;;;
11;"Skripchenko A., Troubetzkoy S.,""55185138800";55962797900;",https://www.scopus.com/inward/record.uri?eid=2-s2.0-84940069556&doi=10.1088%2f0951-7715%2f28%2f9%2f3443&partnerID=40&md5=7d52cc488bc07b9bcfa622b5d17fb827"",""billiards"; complexity;" entropy"",";;;;;;;;;;;;;;;;;;;;;;;;;;;;;;;;;;;;;;;;;;;;;;;;;;;;;;;;;;;;;;;;;;;;;;;;
11;"Aseeva N.V., Gromov E.M., Tyutin V.V.,""15847630900";56707638200;6603597680;",https://www.scopus.com/inward/record.uri?eid=2-s2.0-84943233856&doi=10.1007%2fs11141-015-9594-1&partnerID=40&md5=f15b2de9e75dfa5a66a2638e3785aaa9"",,""Nonlinear equations"; Solitons; Cubic nonlinearities; Long-wavelength regions; Low-frequency waves; Short wavelengths; Soliton dynamics; Soliton solutions; Spatially inhomogeneous; Stimulated scattering;" Control nonlinearities""";;;;;;;;;;;;;;;;;;;;;;;;;;;;;;;;;;;;;;;;;;;;;;;;;;;;;;;;;;;;;;;
11;"Aminev D.A., Manokhin A.I., Semenenko A.N., Uvaisov S.U.,""56818934800";56818820100;6602685214;14049539200;",https://www.scopus.com/inward/record.uri?eid=2-s2.0-84940849803&doi=10.1007%2fs11018-015-0750-y&partnerID=40&md5=c6e38a7513faf0d0f78132bc0ea7a348"",""radio-electrical component"; temperature sensor;" thermocouple"",""Error compensation"; Printed circuits; Thermocouples; Timing circuits; Accuracy of measurements; Electrical components; Measurements of; Temperature measuring;" Temperature sensors""";;;;;;;;;;;;;;;;;;;;;;;;;;;;;;;;;;;;;;;;;;;;;;;;;;;;;;;;;;;;;;
11;"Kharchev S., Zabrodin A.,""6602105147";7004036132;",https://www.scopus.com/inward/record.uri?eid=2-s2.0-84928024767&doi=10.1016%2fj.geomphys.2015.03.010&partnerID=40&md5=5b0db507f31c25336788b4686d60df12"",""Addition formulae"; Elliptic functions;" Identities for theta functions"",";;;;;;;;;;;;;;;;;;;;;;;;;;;;;;;;;;;;;;;;;;;;;;;;;;;;;;;;;;;;;;;;;;;;;;;;
11;"Harnad J., Orlov A.Y.,""9845784800";7202403709;",https://www.scopus.com/inward/record.uri?eid=2-s2.0-84939959462&doi=10.1007%2fs00220-015-2329-5&partnerID=40&md5=a762137a6cee8bf0eb8fcf1286a1cbb1"",,";;;;;;;;;;;;;;;;;;;;;;;;;;;;;;;;;;;;;;;;;;;;;;;;;;;;;;;;;;;;;;;;;;;;;;;;;;
11;"Muslimov A.E., Butashin A.V., Mikhailov V.I., Shapiev I.M., Ismailov A.M., Novoselova E.G., Smirnov I.S., Kanevsky V.M.,""39061834300";35468754500;56250176400;56531950400;56198462400;56565693900;7202245163;24561345400;",https://www.scopus.com/inward/record.uri?eid=2-s2.0-84938879456&doi=10.1134%2fS106377451504015X&partnerID=40&md5=a8fd1c4427322319275c9325710d52a0"",,""Aspect ratio"; Cadmium telluride; Chemical vapor deposition; Epitaxial growth; Mica; Sapphire; Tellurium; Tellurium compounds; CdTe; Different substrates; High aspect ratio; Micro-tubes; Muscovite substrates; Sapphire substrates; Thermochemical activation; Vapor Phase;" Substrates""";;;;;;;;;;;;;;;;;;;;;;;;;;;;;;;;;;;;;;;;;;;;;;;;;;;;
11;"Levin A.M., Olshanetsky M.A., Zotov A.V.,""7403194458";6603044041;35448469200;",https://www.scopus.com/inward/record.uri?eid=2-s2.0-84940205116&doi=10.1007%2fs11232-015-0306-y&partnerID=40&md5=6fbfa12c4306c6b51054a52fa9bd4526"",""multidimensional Lax pair"; Painlevé equation;" quantum R-matrix"",";;;;;;;;;;;;;;;;;;;;;;;;;;;;;;;;;;;;;;;;;;;;;;;;;;;;;;;;;;;;;;;;;;;;;;;
11;"Avdeev R.,""14826625600";",https://www.scopus.com/inward/record.uri?eid=2-s2.0-84937253597&doi=10.1007%2fs00029-015-0180-3&partnerID=40&md5=8ca6438cc3a1287e0a2ec6ac4424f801"",""Algebraic group"; Homogeneous space; Representation; Solvable subgroup; Spherical subgroup; Spherical variety;" Wonderful variety"",";;;;;;;;;;;;;;;;;;;;;;;;;;;;;;;;;;;;;;;;;;;;;;;;;;;;;;;;;;;;;;;;;;;;;
11;"Gurevich D., Rubtsov V., Saponov P., Škoda Z.,""7004262397";7006537725;6602409805;17435881400;",https://www.scopus.com/inward/record.uri?eid=2-s2.0-84931282022&doi=10.1007%2fs00023-014-0350-4&partnerID=40&md5=81db1b585d5fd4f486389a6ff244048d"",,";;;;;;;;;;;;;;;;;;;;;;;;;;;;;;;;;;;;;;;;;;;;;;;;;;;;;;;;;;;;;;;;;;;;;;;;
11;"Maslov V.P.,""7202893841";",https://www.scopus.com/inward/record.uri?eid=2-s2.0-84940849307&doi=10.1134%2fS1061920815030061&partnerID=40&md5=0d2e7487078b3100e85fc9a3c495d85c"",,";;;;;;;;;;;;;;;;;;;;;;;;;;;;;;;;;;;;;;;;;;;;;;;;;;;;;;;;;;;;;;;;;;;;;;;;;;;
11;"Solntsev V.A.,""7005233274";",https://www.scopus.com/inward/record.uri?eid=2-s2.0-84958087771&doi=10.1109%2fTPS.2015.2440479&partnerID=40&md5=207d0983fc2641a644b117c5f67461b4"",""Backward wave"; beam-wave interaction; folded waveguide; orotron; passband; periodic slow-wave system (SWS); stopband;" traveling-wave tube (TWT)"",""Amplifiers (electronic)"; Cutoff frequency; Difference equations; Electron beams; Electrons; Equivalent circuits; Microwave tubes; Traveling wave tubes; Waveguides; Backward waves; Beam-wave interactions; Folded waveguides; Orotrons; Pass bands; Slow-wave systems; Stopband; Travelingwave tube (TWT);" Slow wave structures""";;;;;;;;;;;;;;;;;;;;;;;;;;;;;;;;;;;;;;;;;;;;;;;;;;;
11;"Kononov Y., Morozov A.,""56708346700";7202104775;",https://www.scopus.com/inward/record.uri?eid=2-s2.0-84934925275&doi=10.1016%2fj.physletb.2015.06.043&partnerID=40&md5=8200ac68dc15aae65c3f62c25a7fef57"",,";;;;;;;;;;;;;;;;;;;;;;;;;;;;;;;;;;;;;;;;;;;;;;;;;;;;;;;;;;;;;;;;;;;;;;;;;;
11;"Budkov Y.A., Kolesnikov A.L., Kiselev M.G.,""46861146000";56258168600;7005285779;",https://www.scopus.com/inward/record.uri?eid=2-s2.0-84940189971&doi=10.1209%2f0295-5075%2f111%2f28002&partnerID=40&md5=af172e879e743a2ea68da55b72b6b7f4"",,";;;;;;;;;;;;;;;;;;;;;;;;;;;;;;;;;;;;;;;;;;;;;;;;;;;;;;;;;;;;;;;;;;;;;;;;;
11;"Kononov Y., Morozov A.,""56708346700";7202104775;",https://www.scopus.com/inward/record.uri?eid=2-s2.0-84940179173&doi=10.1134%2fS0021364015120127&partnerID=40&md5=5351263fd6f5eef2f08cb8d960940d63"",,";;;;;;;;;;;;;;;;;;;;;;;;;;;;;;;;;;;;;;;;;;;;;;;;;;;;;;;;;;;;;;;;;;;;;;;;;;
11;"Abzalov A., Bakhmatov I., Musaev E.T.,""56708889200";23093121300;35223818100;",https://www.scopus.com/inward/record.uri?eid=2-s2.0-84934902799&doi=10.1007%2fJHEP06%282015%29088&partnerID=40&md5=83ed156ffd5b750728a75b68b2200e3e"",""Gauge Symmetry"; String Duality;" Supergravity Models"",";;;;;;;;;;;;;;;;;;;;;;;;;;;;;;;;;;;;;;;;;;;;;;;;;;;;;;;;;;;;;;;;;;;;;;;
11;"Tyutnev A.P., Parris P.E., Saenko V.S.,""7005402871";22968571200;7103137190;",https://www.scopus.com/inward/record.uri?eid=2-s2.0-84934982758&doi=10.1016%2fj.chemphys.2015.06.001&partnerID=40&md5=941cb6b399cfe6b3f7344455fd76a3d1"",""Green function"; Multiple trapping model;" Theory versus experiment"",";;;;;;;;;;;;;;;;;;;;;;;;;;;;;;;;;;;;;;;;;;;;;;;;;;;;;;;;;;;;;;;;;;;;;;;
11;"Potomskii S.Y., Kosinskii A.V.,""49362041600";6602679552;",https://www.scopus.com/inward/record.uri?eid=2-s2.0-84943455182&doi=10.1007%2fs11018-015-0699-x&partnerID=40&md5=fe5da78157c3abfb3df8f456eea7ac4e"",""Inductive sensor"; Linear characteristic of conversion;" Time type AD converter"",""Frequency converters"; Inductive sensors; AD converters; Analog to digital converters; Digital codes; Displacement phase; Functional circuits; Linear characteristics; Linear displacements; Mathematical descriptions;" Analog to digital conversion""";;;;;;;;;;;;;;;;;;;;;;;;;;;;;;;;;;;;;;;;;;;;;;;;;;;;;;;;;;;;;;
11;"Feigin B., Jimbo M., Miwa T., Mukhin E.,""7006562936";57193339345;7201645478;7005230792;",https://www.scopus.com/inward/record.uri?eid=2-s2.0-84934880988&doi=10.1088%2f1751-8113%2f48%2f24%2f244001&partnerID=40&md5=88a18c0b2bad4c1e3d5cfc3cc62e2d39"",""Bethe ansatz"; quantum toroidal algebra;" shuffle algebra"",";;;;;;;;;;;;;;;;;;;;;;;;;;;;;;;;;;;;;;;;;;;;;;;;;;;;;;;;;;;;;;;;;;;;;;
11;"Yakushkina T., Saakian D.B., Bratus A., Hu C.-K.,""56407166900";6603916128;7003579612;56524821300;",https://www.scopus.com/inward/record.uri?eid=2-s2.0-84934910531&doi=10.7566%2fJPSJ.84.064802&partnerID=40&md5=1ddb7001bc8bf6c7192a821bd814845e"",,";;;;;;;;;;;;;;;;;;;;;;;;;;;;;;;;;;;;;;;;;;;;;;;;;;;;;;;;;;;;;;;;;;;;;;;;
11;"Kagan M.Y., Mitskan V.A., Korovushkin M.M.,""7102277369";12760285700;18436867200;",https://www.scopus.com/inward/record.uri?eid=2-s2.0-84931266599&doi=10.1140%2fepjb%2fe2015-60198-x&partnerID=40&md5=fc0a6c78695bbd4efbc80dcefcfca636"",""Solid State and Materials"",""Graphene"; Perturbation techniques; Phase diagrams; Van der Waals forces; Critical temperatures; Extended Hubbard model; Second order of perturbation theory; Solid State and Materials; Super conducting phasis; Superconducting phase; Superconducting state; Van der waals potentials;" Coulomb interactions""";;;;;;;;;;;;;;;;;;;;;;;;;;;;;;;;;;;;;;;;;;;;;;;;;;;;;;;;;;;;;
11;"Gromov E.M., Malomed B.A.,""56707638200";35555126200;",https://www.scopus.com/inward/record.uri?eid=2-s2.0-84934880790&doi=10.1088%2f0031-8949%2f90%2f6%2f068021&partnerID=40&md5=4a25a215337fb2c14125a1fd9ea6d4a1"",""method of moments"; nonlinear Schrödinger equation; soliton;" Zakharov system"",";;;;;;;;;;;;;;;;;;;;;;;;;;;;;;;;;;;;;;;;;;;;;;;;;;;;;;;;;;;;;;;;;;;;;;;
11;"Kardakova A.I., Coumou P.C.J.J., Finkel M.I., Morozov D.V., An P.P., Goltsman G.N., Klapwijk T.M.,""39861647200";55356159800;12767354500;56488446900;41861081500;7006771637;7006694350;",https://www.scopus.com/inward/record.uri?eid=2-s2.0-84919781927&doi=10.1109%2fTASC.2014.2364516&partnerID=40&md5=a61fe0a0b5a2db00eafacabdeb30d7df"",""ALD"; electron-phonon interaction; thin films;" TiN"",""Atomic layer deposition"; Electron-phonon interactions; Metallic films; Phonons; Relaxation time; Temperature distribution; Thin films; Tin; Titanium compounds; Electron phonon; Energy relaxation time; Mean free path; Measured values; Strong disorders; Temperature dependence; Temperature range; Titanium nitride films;" Titanium nitride""";;;;;;;;;;;;;;;;;;;;;;;;;;;;;;;;;;;;;;;;;;;;;;;;;
11;"Trifonov A., Tong C.-Y.E., Blundell R., Ryabchun S., Gol'Tsman G.,""55578726300";7202716181;7005148075;15766226900;7006771637;",https://www.scopus.com/inward/record.uri?eid=2-s2.0-84919819696&doi=10.1109%2fTASC.2014.2374417&partnerID=40&md5=739688a0248a1e282d2c86c402351237"",""Allan variance"; hot-electron-bolometer mixer; relaxation oscillation;" stability"",""Convergence of numerical methods"; Hot electrons; Infrared detectors; Modulation; Optical pumping; Probes; Allan variance; Gain fluctuations; Hot electron bolometer mixer; Megahertz frequencies; Microwave injection; Output power fluctuations; Relaxation oscillation; Superconducting state;" Bolometers""";;;;;;;;;;;;;;;;;;;;;;;;;;;;;;;;;;;;;;;;;;;;;;;;;;;;;;
11;"Tong C.-Y.E., Trifonov A., Shurakov A., Blundell R., Gol'tsman G.,""7202716181";55578726300;55266061300;7005148075;7006771637;",https://www.scopus.com/inward/record.uri?eid=2-s2.0-84921416667&doi=10.1109%2fTASC.2014.2377670&partnerID=40&md5=37dbc20e48085b23668b7f3f173019b0"",""Direct detector"; hot-electron-bolometer mixer; power measurement; relaxation oscillations;" THz radiation"",""Bolometers"; Electric power measurement; Hot electrons; Infrared detectors; Microwaves; Radiation; Radiation effects; Signal receivers; Cryogenic amplifier; Direct detectors; Hot electron bolometer mixer; Linear relationships; Relaxation oscillation; Synchronous detection; Terahertz radiation; THz radiation;" Terahertz waves""";;;;;;;;;;;;;;;;;;;;;;;;;;;;;;;;;;;;;;;;;;;;;;;;;;;
11;"Seliverstov S., Maslennikov S., Ryabchun S., Finkel M., Klapwijk T.M., Kaurova N., Vachtomin Y., Smirnov K., Voronov B., Goltsman G.,""55266490000";8503067600;15766226900;12767354500;7006694350;6507396101;8561959900;22945547300;57200973381;7006771637;",https://www.scopus.com/inward/record.uri?eid=2-s2.0-84921384259&doi=10.1109%2fTASC.2014.2372171&partnerID=40&md5=17fdb5a9c7e09b561d087a144ac3cf91"",""Frequency response"; hot electron bolometer;" radiation detectors"",""Antennas"; Frequency response; Hot electrons; Infrared detectors; Numerical methods; Radiation detectors; Terahertz waves; Cryogenic temperatures; Distributed elements; Energy resolutions; Heat balance equations; Hot electron bolometer; Numerical calculation; Orders of magnitude; Terahertz radiation;" Bolometers""";;;;;;;;;;;;;;;;;;;;;;;;;;;;;;;;;;;;;;;;;;;;;;;;;
11;"Molotkov S.N., Potapova T.A.,""7005147387";7005641777;",https://www.scopus.com/inward/record.uri?eid=2-s2.0-84930697330&doi=10.1088%2f1612-2011%2f12%2f6%2f065201&partnerID=40&md5=d5c2f6f3177a50464d7a50695d39b274"",""quantum key distribution"; unambiguous measurements;" unambiguous state discrimination"",";;;;;;;;;;;;;;;;;;;;;;;;;;;;;;;;;;;;;;;;;;;;;;;;;;;;;;;;;;;;;;;;;;;;;;;;
11;"Korneev A.A., Korneeva Y.P., Mikhailov M.Y., Pershin Y.P., Semenov A.V., Vodolazov D.Y., Divochiy A.V., Vakhtomin Y.B., Smirnov K.V., Sivakov A.G., Devizenko A.Y., Goltsman G.N.,""7006297830";36617215400;7102391679;7004174066;56879243200;6603815487;22979146300;6505889206;22945547300;7004373913;35558280500;7006771637;",https://www.scopus.com/inward/record.uri?eid=2-s2.0-84921328662&doi=10.1109%2fTASC.2014.2376892&partnerID=40&md5=8f60d928fadaf62c82c90d4793cf015e"",""Infrared single-photon detectors"; superconducting MoSi films;" vortices in superconducting thin films."",""Avalanche photodiodes"; Magnetic fields; Niobium compounds; Particle beams; Silicon compounds; Superconducting films; Thin films; Vortex flow; Dark count rate; High energy photons; Low energy photons; Photon count; Response mechanisms; Single-photon detectors; Superconducting single-photon detectors; Vortex penetration;" Photons""";;;;;;;;;;;;;;;;;;;;;;;;;;;;;;;;;;;;;;;;;;;;;;
11;"Lobanov Y., Shcherbatenko M., Finkel M., Maslennikov S., Semenov A., Voronov B.M., Rodin A.V., Klapwijk T.M., Gol'tsman G.N.,""9333900400";56095501200;12767354500;8503067600;56879243200;57200973381;7101726289;7006694350;7006771637;",https://www.scopus.com/inward/record.uri?eid=2-s2.0-84923246689&doi=10.1109%2fTASC.2014.2376191&partnerID=40&md5=39907aec2fd75f524bb6712268318a5f"",""Hot-Electron-Bolometer mixer"; optical antenna;" polarization-sensitive detection"",""Antennas"; Electromagnetic wave absorption; Electron temperature; Electrons; Hot electrons; Infrared detectors; Light absorption; Mixers (machinery); Polarization; Superconducting films; Absorption efficiency; Heterodyne detection; Hot electron bolometer mixer; Incident radiation; IV characteristics; Optical antennae; Orthogonal polarizations; Polarization-sensitive detection;" Bolometers""";;;;;;;;;;;;;;;;;;;;;;;;;;;;;;;;;;;;;;;;;;;;;;;
11;"Aminov G., Levin A., Olshanetsky M., Zotov A.,""36933897200";7403194458;6603044041;35448469200;",https://www.scopus.com/inward/record.uri?eid=2-s2.0-84938069574&doi=10.1134%2fS0021364015090040&partnerID=40&md5=41da83962192b62fd65b3c8aeaee1338"",,";;;;;;;;;;;;;;;;;;;;;;;;;;;;;;;;;;;;;;;;;;;;;;;;;;;;;;;;;;;;;;;;;;;;;;;;
11;"Obolenskaya L.N., Zaporozhets M.A., Kuzmicheva G.M., Savinkina E.V., Podbelskiy V.V., Amarantov S.V., Sadovskaya N.V., Prokudina N.A., Avilov A.S., Nikolajchik V.I.,""56663191300";25032137100;7003775581;8419176500;36245602900;6506260862;6602701296;9040930400;55948689800;56663132400;",https://www.scopus.com/inward/record.uri?eid=2-s2.0-84930204999&doi=10.1134%2fS1063774515030116&partnerID=40&md5=57db757573e43afd2d94a7d9945ad075"",,""Aromatic compounds"; Azo dyes; Nanoparticles; Oxides; Photocatalysis; Titanium; Titanium dioxide; Analytical method; High photocatalytic activities; Methyl orange dyes; Methylene blue dye; Morphological features; Nanoparticle sizes; Photocatalytic property; Visible spectral range;" Dyes""";;;;;;;;;;;;;;;;;;;;;;;;;;;;;;;;;;;;;;;;;;;;;;;;;;;
11;"Tsuboi Z., Zabrodin A., Zotov A.,""6701328886";7004036132;35448469200;",https://www.scopus.com/inward/record.uri?eid=2-s2.0-84930226801&doi=10.1007%2fJHEP05%282015%29086&partnerID=40&md5=22c20edc7abbe03af220f48030a3965a"",""Bethe Ansatz"; Integrable Equations in Physics; Integrable Hierarchies;" Lattice Integrable Models"",";;;;;;;;;;;;;;;;;;;;;;;;;;;;;;;;;;;;;;;;;;;;;;;;;;;;;;;;;;;;;;;;;;;;;;
11;"Chumachenko E.N., Portnoi V.K., Logashina I.V.,""7004559856";7005646840;6506347069;",https://www.scopus.com/inward/record.uri?eid=2-s2.0-84943358418&doi=10.1007%2fs11015-015-0062-0&partnerID=40&md5=3db7d81684e19fcb320546e1810fd2c6"",""Mechanical properties of materials"; Mechanical tests; Modeling;" Superplasticity"",""Mechanical properties"; Mechanical testing; Models; Strain rate; Superplasticity; Titanium alloys; Mechanical properties of materials; Strain and strain rates; Structural parameter; Superplastic conditions; Test method;" Materials properties""";;;;;;;;;;;;;;;;;;;;;;;;;;;;;;;;;;;;;;;;;;;;;;;;;;;;;;;;;;;
11;"Petrukhin N.S., Ruderman M.S., Pelinovsky E.,""6603394745";7006487390;7004951110;",https://www.scopus.com/inward/record.uri?eid=2-s2.0-84937760809&doi=10.1007%2fs11207-015-0682-3&partnerID=40&md5=f6c2335d8361d2ceda6a52d817cc188a"",""Corona"; Coronal magnetic loops; Wave reflection;" Waves"",";;;;;;;;;;;;;;;;;;;;;;;;;;;;;;;;;;;;;;;;;;;;;;;;;;;;;;;;;;;;;;;;;;;;;;
11;"Norman G.E., Saitov I.M., Stegailov V.V.,""7102607294";36020574400;6603823822;",https://www.scopus.com/inward/record.uri?eid=2-s2.0-84933513445&doi=10.1134%2fS1063776115040135&partnerID=40&md5=f5f361316a5a65022009064578cdfe61"",,""Calculations"; Plasma density; Reflection; Dielectric functions; Dielectric tensors; First-principles calculation; Fresnel formula; Incident radiation; Kramers-Kronig transformation; Long-wavelength limits; Plasma frequencies;" Density functional theory""";;;;;;;;;;;;;;;;;;;;;;;;;;;;;;;;;;;;;;;;;;;;;;;;;;;;;;;;;;;;;;
11;"Galin M.A., Klushin A.M., Kurin V.V., Seliverstov S.V., Finkel M.I., Goltsman G.N., Müller F., Scheller T., Semenov A.D.,""36453659600";7004017589;7004379048;55266490000;12767354500;7006771637;8445833900;6602910274;7402498907;",https://www.scopus.com/inward/record.uri?eid=2-s2.0-84927645691&doi=10.1088%2f0953-2048%2f28%2f5%2f055002&partnerID=40&md5=4ef3196df2cd0161412e7bc5e546ec2b"",""cal oscillator"; eterodyne receiver; Josephson junctions;" ot-electron bolometer"",""Infrared detectors"; Josephson junction devices; Mixers (machinery); Terahertz waves; Continuous-wave radiation; Electron bolometer; External resonators; Heterodyne receivers; Hot electron bolometer mixer; Josephson; Satisfactory solutions; Terahertz technology;" Bolometers""";;;;;;;;;;;;;;;;;;;;;;;;;;;;;;;;;;;;;;;;;;;;;;;;;;;;
11;"Tamm M.V., Nazarov L.I., Gavrilov A.A., Chertovich A.V.,""7006098030";56382800500;35764520500;6602290805;",https://www.scopus.com/inward/record.uri?eid=2-s2.0-84930506429&doi=10.1103%2fPhysRevLett.114.178102&partnerID=40&md5=7467884a08325e2bd266c803e8a5d347"",,""Chromosomes"; Monomers; Quantum entanglement; Anomalous diffusion; Dissipative particle dynamics; Initial state; Scaling theories; Thermal motion; Fractals; chromatin; algorithm; biological model; chemical model; chemistry; chromatin; computer simulation; diffusion; fractal analysis; genetics; human; Algorithms; Chromatin; Computer Simulation; Diffusion; Fractals; Humans; Models, Chemical;" Models, Genetic""";;;;;;;;;;;;;;;;;;;;;;;;;;;;;;;;;;;;;;;;;;;;;
11;"Danilov V.G., Gaydukov R.K.,""7201827676";56034996400;",https://www.scopus.com/inward/record.uri?eid=2-s2.0-84937202110&doi=10.1134%2fS106192081502003X&partnerID=40&md5=def316a1ee12d673d2971411ce6311b6"",,";;;;;;;;;;;;;;;;;;;;;;;;;;;;;;;;;;;;;;;;;;;;;;;;;;;;;;;;;;;;;;;;;;;;;;;;;;
11;"Maslov V.P.,""7202893841";",https://www.scopus.com/inward/record.uri?eid=2-s2.0-84937200376&doi=10.1134%2fS1061920815020065&partnerID=40&md5=eac5f98a7a7ff1ba3bf18339f96155a2"",,";;;;;;;;;;;;;;;;;;;;;;;;;;;;;;;;;;;;;;;;;;;;;;;;;;;;;;;;;;;;;;;;;;;;;;;;;;;
11;"Ferrari S., Kahl O., Kovalyuk V., Goltsman G.N., Korneev A., Pernice W.H.P.,""56594333800";56898793400;35778256000;7006771637;7006297830;16040560600;",https://www.scopus.com/inward/record.uri?eid=2-s2.0-84927750116&doi=10.1063%2f1.4917166&partnerID=40&md5=14bdb3f2574acb0407cbc266f7f55cd6"",,""Infrared devices"; Nanowires; Particle beams; Photodetectors; Photons; Silicon detectors; Silicon nitride; Internal quantum efficiency; Nanophotonic circuits; Near-infrared wavelength; Simultaneous detection; Single photon detection; Superconducting nanowire; Telecom wavelengths; Theoretical modeling;" Quantum efficiency""";;;;;;;;;;;;;;;;;;;;;;;;;;;;;;;;;;;;;;;;;;;;;;;;;;;;;;;
11;"Pereskokov A.V.,""6602950211";",https://www.scopus.com/inward/record.uri?eid=2-s2.0-84928251713&doi=10.1007%2fs11232-015-0278-y&partnerID=40&md5=46d3d99b23b434d3d6887a1920c2f57e"",""asymptotic eigenfunction"; asymptotic eigenvalue; logarithmic singularity; self-consistent field; spectral cluster;" two-dimensional oscillator"",";;;;;;;;;;;;;;;;;;;;;;;;;;;;;;;;;;;;;;;;;;;;;;;;;;;;;;;;;;;;;;;;;;;;;;
11;"Chumachenko E.N., Portnoi V.K., Logashina I.V.,""7004559856";7005646840;6506347069;",https://www.scopus.com/inward/record.uri?eid=2-s2.0-84953346900&doi=10.1007%2fs11015-015-0047-z&partnerID=40&md5=11c6a410d1b1e7909ec6bf2be6b95bee"",""mechanical properties of materials"; mechanical tests; modeling;" superplasticity"",""Mechanical properties"; Mechanical testing; Models; Superplasticity; Titanium alloys; Conducting tests; Mechanical properties of materials; Rate of deformation; Structural parameter; Superplastic conditions; Test method;" Materials properties""";;;;;;;;;;;;;;;;;;;;;;;;;;;;;;;;;;;;;;;;;;;;;;;;;;;;;;;;;;;
11;"Gorodetskii M.L., Demchenko Y.A., Zaitsev D.F., Krutikov V.N., Zolotarevskii Y.M., Lyaskovskii V.L.,""6603901575";55401006100;7006008640;7005345027;6507499285;6507487778;",https://www.scopus.com/inward/record.uri?eid=2-s2.0-84953225409&doi=10.1007%2fs11018-015-0639-9&partnerID=40&md5=fd4a49b2c2ab47d5b158586a725dbe83"",""optical microresonators";" whispering gallery type modes"",""Frequency standards"; Microwave oscillators; Optical resonators; Q factor measurement; Resonators; Fabrication Technologies; Highly stables; Micro resonators; Microwave signals; Optical frequency combs; Optical microresonators; Precision measurement; Whispering gallery;" Whispering gallery modes""";;;;;;;;;;;;;;;;;;;;;;;;;;;;;;;;;;;;;;;;;;;;;;;;;;;;;;;;
11;"Norman G., Saitov I., Stegailov V., Zhilyaev P.,""7102607294";36020574400;6603823822;35326075000;",https://www.scopus.com/inward/record.uri?eid=2-s2.0-84923782255&doi=10.1103%2fPhysRevE.91.023105&partnerID=40&md5=e7caa1f93fff36b11b60980a269f1e04"",,""Calculations"; Plasma density; Reflection; Ab initio calculations; Dielectric functions; Fresnel formula; Imaginary parts; Incident radiation; Kramers-Kronig transformation; Long-wavelength limits; Plasma frequencies;" Density functional theory""";;;;;;;;;;;;;;;;;;;;;;;;;;;;;;;;;;;;;;;;;;;;;;;;;;;;;;;;;;;;;
11;"Grines V., Medvedev T., Pochinka O., Zhuzhoma E.,""55978243000";57082921500;6507516545;6603572170;",https://www.scopus.com/inward/record.uri?eid=2-s2.0-84919724905&doi=10.1016%2fj.physd.2014.11.004&partnerID=40&md5=b25ab613f06673c672a25cbe345f3e39"",""Fan"; Magnetic field; Plasma;" Separator"",""Dynamical systems"; Electromagnetic field effects; Fans; Magnetic fields; Plasmas; Problem solving; Separators; Electrically conducting fluids; Orientable surfaces;" Magnetoplasma""";;;;;;;;;;;;;;;;;;;;;;;;;;;;;;;;;;;;;;;;;;;;;;;;;;;;;;;;;;;;
11;"Budkov Yu.A., Kolesnikov A.L., Georgi N., Kiselev M.G.,""46861146000";56258168600;35336260400;7005285779;",https://www.scopus.com/inward/record.uri?eid=2-s2.0-84923382210&doi=10.1209%2f0295-5075%2f109%2f36005&partnerID=40&md5=9bcbd046c9a37887806619ab1e835446"",,";;;;;;;;;;;;;;;;;;;;;;;;;;;;;;;;;;;;;;;;;;;;;;;;;;;;;;;;;;;;;;;;;;;;;;;;
11;"Imakaev M.V., Tchourine K.M., Nechaev S.K., Mirny L.A.,""35090177500";56375791300;7006930329;6603761549;",https://www.scopus.com/inward/record.uri?eid=2-s2.0-84919951683&doi=10.1039%2fc4sm02099e&partnerID=40&md5=6bbeba83379f716ad8320f98483d7de9"",,""Fractal dimension"; Topology; Constrained equilibriums; Dynamic property; Equilibrium state; Globular polymers; Polymer systems; Theoretical study; Topological constraints; Topological state;" Polymers""";;;;;;;;;;;;;;;;;;;;;;;;;;;;;;;;;;;;;;;;;;;;;;;;;;;;;;;;;;;;;;
11;"Shapoval A., Le Mouël J.-L., Shnirman M., Courtillot V.,""10144240900";7006534497;6602725009;7007184416;",https://www.scopus.com/inward/record.uri?eid=2-s2.0-84921459622&doi=10.1088%2f0004-637X%2f799%2f1%2f56&partnerID=40&md5=a6f5b4afef084ba19e057cbd55c174a7"",""chaos"; Sun: activity; Sun: evolution;" sunspots"",";;;;;;;;;;;;;;;;;;;;;;;;;;;;;;;;;;;;;;;;;;;;;;;;;;;;;;;;;;;;;;;;;;;;;
11;"Semenov A.G., Zaikin A.D.,""57189572950";7103103279;",https://www.scopus.com/inward/record.uri?eid=2-s2.0-84921047265&doi=10.1103%2fPhysRevB.91.024505&partnerID=40&md5=568837824cafa7aa69f66780bfa9a728"",,";;;;;;;;;;;;;;;;;;;;;;;;;;;;;;;;;;;;;;;;;;;;;;;;;;;;;;;;;;;;;;;;;;;;;;;;;;
11;"Vinogradova A., Naletova V., Turkov V.,""7006454131";7003443257;6701453027;",https://www.scopus.com/inward/record.uri?eid=2-s2.0-84945174662&doi=10.4028%2fwww.scientific.net%2fSSP.233-234.335&partnerID=40&md5=10b1c661cb9f31af88646f137be0d74a"",""Line conductor"; Magnetic field; Magnetic fluid;" Wetting"",""Cylinders (shapes)"; Magnetic fields; Magnetic fluids; Wetting; Axially symmetric; Axisymmetric; Coaxial cylinders; Free surfaces; General analytical solution; Isothermal magnetic fluids; Line conductors; Nonmagnetics;" Magnetism""";;;;;;;;;;;;;;;;;;;;;;;;;;;;;;;;;;;;;;;;;;;;;;;;;;;;;;;;;;
11;"De Palma G., Mari A., Giovannetti V., Holevo A.S.,""55781428900";24832078800;7004137815;6603727683;",https://www.scopus.com/inward/record.uri?eid=2-s2.0-84930222002&doi=10.1063%2f1.4921265&partnerID=40&md5=ea2bb3914ca6b0c0ee38b444c6159bf0"",,";;;;;;;;;;;;;;;;;;;;;;;;;;;;;;;;;;;;;;;;;;;;;;;;;;;;;;;;;;;;;;;;;;;;;;;;
