;Область, Авторы,Идентификаторы авторов,Ссылка,Ключевые слова автора,Ключевые слова указателя;;;;;;;;;;;;;;;;;;;;;;;;;;;;;;;;;;;;;;;;;;;;;;;;;;;;;;;;;;;;;;;;;;;;;;;;;;;;
13;"Polukhina E., Strelnikova A.,""57016670000";57195125526;",https://www.scopus.com/inward/record.uri?eid=2-s2.0-84951281008&partnerID=40&md5=328ed748798eb8b016a364dd0dffccac"",""Commodity"; Consumption; Cultural studies; Gift-exchange; Mixed of online and offline methods; Mobility of domestic items; Nethnography; Online communities;" Social solidarity"",";;;;;;;;;;;;;;;;;;;;;;;;;;;;;;;;;;;;;;;;;;;;;;;;;;;;;;;;;;;;;;;;;;
13;"Lazareva O.,""55311648900";",https://www.scopus.com/inward/record.uri?eid=2-s2.0-84983448720&doi=10.1186%2fs40176-015-0044-9&partnerID=40&md5=7df93ad85c337ebca93d63020b739101"",""J61, J31, J64a"",";;;;;;;;;;;;;;;;;;;;;;;;;;;;;;;;;;;;;;;;;;;;;;;;;;;;;;;;;;;;;;;;;;;;;;;;;;;
13;"Shirokanova A.,""36683200600";",https://www.scopus.com/inward/record.uri?eid=2-s2.0-84948985960&doi=10.1177%2f0037768615601980&partnerID=40&md5=4da8d86cbb77021ae11c47d6822f5305"",""Islam"; Multilevel analysis; Protestantism; Work ethic;" World Values Survey"",";;;;;;;;;;;;;;;;;;;;;;;;;;;;;;;;;;;;;;;;;;;;;;;;;;;;;;;;;;;;;;;;;;;;;;;
13;"Mozias P.M.,""57196746604";",https://www.scopus.com/inward/record.uri?eid=2-s2.0-85032900946&partnerID=40&md5=1492f88347cd14bbad12fdd115025b20"",""""""New normality"""""; China; Economic growth; Financial markets; Inflation; Investment platforms; Real estate;" Shadow banking"",";;;;;;;;;;;;;;;;;;;;;;;;;;;;;;;;;;;;;;;;;;;;;;;;;;;;;;;;;;;;;;;;;;;;
13;"Makarov I.A., Sokolova A.K., Stepanov I.A.,""57169907200";57200253291;57169933200;",https://www.scopus.com/inward/record.uri?eid=2-s2.0-84960848674&partnerID=40&md5=d3f2fef6286a0528146a7205f1e34466"",""Arctic"; International shipping; International trade routes; Northern Sea Route;" Russia's arctic zone"",""cargo handling"; cost; international trade; port operation; port trade; shipping; transportation economics; Arctic; Atlantic Ocean; North Sea;" Russian Federation""";;;;;;;;;;;;;;;;;;;;;;;;;;;;;;;;;;;;;;;;;;;;;;;;;;;;;;;;;;;
13;"Yudkevich M., Altbach P.G., Rumbley L.E.,""25924090500";16418407500;55611698800;",https://www.scopus.com/inward/record.uri?eid=2-s2.0-84954401151&doi=10.1007%2fs11125-015-9365-y&partnerID=40&md5=3f1bdb4c3669f5886642271f345ee07d"",""Excellence"; Global ranking; Higher education;" International"",";;;;;;;;;;;;;;;;;;;;;;;;;;;;;;;;;;;;;;;;;;;;;;;;;;;;;;;;;;;;;;;;;;;;;;
13;"Rotondi V., Stanca L.,""56901291900";6602267755;",https://www.scopus.com/inward/record.uri?eid=2-s2.0-84944028752&doi=10.1016%2fj.joep.2015.09.008&partnerID=40&md5=9fc3ce3d41926c875b9b3f672ce18142"",""Bribery"; Corruption; Particularism;" Universalism"",";;;;;;;;;;;;;;;;;;;;;;;;;;;;;;;;;;;;;;;;;;;;;;;;;;;;;;;;;;;;;;;;;;;;;;;
13;"Lucento A.,""56993956800";",https://www.scopus.com/inward/record.uri?eid=2-s2.0-84949214675&partnerID=40&md5=ab3d6cf1ae35c7bc8d87dd5edbe87e0e"",,";;;;;;;;;;;;;;;;;;;;;;;;;;;;;;;;;;;;;;;;;;;;;;;;;;;;;;;;;;;;;;;;;;;;;;;;;;;
13;"Khlevniuk O.,""40061091300";",https://www.scopus.com/inward/record.uri?eid=2-s2.0-84949204869&partnerID=40&md5=99b6d4ff3a85eced3637128a32fdc6f1"",,";;;;;;;;;;;;;;;;;;;;;;;;;;;;;;;;;;;;;;;;;;;;;;;;;;;;;;;;;;;;;;;;;;;;;;;;;;;
13;"Maksimenkova O., Alexey N.,""57191339634";55329014600;",https://www.scopus.com/inward/record.uri?eid=2-s2.0-84964744625&doi=10.1109%2fICL.2015.7318104&partnerID=40&md5=b39e880908b5775a1bfedc0bdd2e4341"",""blended learning"; collaborative learning; CSCL; education; SE; SEE;" software engineering"",""Application programs"; Computer supported cooperative work; Education; Life cycle; Selenium; Software engineering; Teaching; Web services; Application lifecycle managements; Blended learning; Collaborative learning; Collaborative services; Collaborative Web services; Computer Supported Collaborative Learning; CSCL; Professional software;" Engineering education""";;;;;;;;;;;;;;;;;;;;;;;;;;;;;;;;;;;;;;;;;;;;;;;;;;;;
13;"Glushchenko I.V.,""57190170933";",https://www.scopus.com/inward/record.uri?eid=2-s2.0-84978062893&doi=10.1080%2f10609393.2016.1187005&partnerID=40&md5=ecf94774978252bbbaac0e5af72c5386"",,";;;;;;;;;;;;;;;;;;;;;;;;;;;;;;;;;;;;;;;;;;;;;;;;;;;;;;;;;;;;;;;;;;;;;;;;;;;
13;"Kasprzhak A.G., Filinov N.B., Bayburin R.F., Isaeva N.V., Bysik N.V.,""57015325300";6506943618;57190172580;57190168105;57015407700;",https://www.scopus.com/inward/record.uri?eid=2-s2.0-84978039262&doi=10.1080%2f10609393.2015.1187007&partnerID=40&md5=1413358fc1a50c6383ecabbebe29e87f"",,";;;;;;;;;;;;;;;;;;;;;;;;;;;;;;;;;;;;;;;;;;;;;;;;;;;;;;;;;;;;;;;;;;;;;;;
13;"Viktorovna Antonova N.,""57008976600";",https://www.scopus.com/inward/record.uri?eid=2-s2.0-84950326631&doi=10.1177%2f0973258615614426&partnerID=40&md5=fa6bfab33c9f63c494b695dfd54d206d"",""active life position"; Advertising; interactivity; personal involvement; proactive position; psychological effectiveness;" trust"",";;;;;;;;;;;;;;;;;;;;;;;;;;;;;;;;;;;;;;;;;;;;;;;;;;;;;;;;;;;;;;;;;;;;;
13;"Shilov V.V., Silantiev S.A.,""57200388029";56018508000;",https://www.scopus.com/inward/record.uri?eid=2-s2.0-84962023358&doi=10.1109%2fHISTELCON.2015.7307312&partnerID=40&md5=1b828a177ada27a2e7a6b991309b1452"",""Aleksandr Schukarev"; Allan Marquand; Annibale Pastore; Benjamin Burack; Charles Macaulay; Charles Stanhope; John Venn; Jonathan Swift; logical machine; Martin Gardner; Pavel Khruschev; Ramon Lull; Semen Korsakov; Stanley Jevons;" William Hamilton"",""Biographies"; Aleksandr Schukarev; Allan Marquand; Annibale Pastore; Benjamin Burack; Charles Macaulay; Charles Stanhope; Hamiltons; John Venn; Jonathan Swift; Martin Gardner; Pavel Khruschev; Ramon Lull; Semen Korsakov; Stanley Jevons;" History""";;;;;;;;;;;;;;;;;;;;;;;;;;;;;;;;;;;;;;;;;;;;;
13;"Rozhkov K.L., Skriabina N.I.,""56769813100";56770008000;",https://www.scopus.com/inward/record.uri?eid=2-s2.0-84949227695&doi=10.1108%2fJPMD-06-2015-0021&partnerID=40&md5=98b4a1b619c73dfc7a7a463cedd73e37"",""Place benefit"; Place product; Product concept; Product technology; Resident lifestyle;" Typology"",";;;;;;;;;;;;;;;;;;;;;;;;;;;;;;;;;;;;;;;;;;;;;;;;;;;;;;;;;;;;;;;;;;;;;
13;"Safronov P.A.,""57188742262";",https://www.scopus.com/inward/record.uri?eid=2-s2.0-84962647896&doi=10.1080%2f10609393.2015.1148958&partnerID=40&md5=4fbb5648275e74319bb8b136a5446e57"",,";;;;;;;;;;;;;;;;;;;;;;;;;;;;;;;;;;;;;;;;;;;;;;;;;;;;;;;;;;;;;;;;;;;;;;;;;;;
13;"Filatova I.,""55340678200";",https://www.scopus.com/inward/record.uri?eid=2-s2.0-84956734298&doi=10.1080%2f10220461.2015.1115369&partnerID=40&md5=2534abe81ba2f41b1e10806acea93616"",""African National Congress"; Broederbond; Communist Party of the Soviet Union; National Party; Russia; South Africa; South African National Intelligence Service (NIS); Soviet State Committee for State Security (KGB);" Soviet Union"",";;;;;;;;;;;;;;;;;;;;;;;;;;;;;;;;;;;;;;;;;;;;;;;;;;;;;;;;;;;;;;;;;;;
13;"Antoci A., Sabatini F., Sodini M.,""6508368278";41961590000;26534851600;",https://www.scopus.com/inward/record.uri?eid=2-s2.0-84949529791&doi=10.1080%2f0022250X.2015.1022278&partnerID=40&md5=e33a181de0d81ca0573598fa985d098e"",""digital divide"; online networks; social capital; social participation;" well-being"",";;;;;;;;;;;;;;;;;;;;;;;;;;;;;;;;;;;;;;;;;;;;;;;;;;;;;;;;;;;;;;;;;;;;;
13;"Timofeevna V.N.,""57196702446";",https://www.scopus.com/inward/record.uri?eid=2-s2.0-85033672919&partnerID=40&md5=b2361f7ec48f912eaddb3f401fa92d18"",""Job Turnover"; Labor Market; Labor Mobility; Labor Turnover; Market Economies.; Reallocation;" Transition Countries"",";;;;;;;;;;;;;;;;;;;;;;;;;;;;;;;;;;;;;;;;;;;;;;;;;;;;;;;;;;;;;;;;;;;;;
13;"Klimova S.,""57195533398";",https://www.scopus.com/inward/record.uri?eid=2-s2.0-84968611449&partnerID=40&md5=09de861af086bd44e2cad45975f6fed8"",""Caucasian theme"; Polemos; Ressentiment;" War and peace"",";;;;;;;;;;;;;;;;;;;;;;;;;;;;;;;;;;;;;;;;;;;;;;;;;;;;;;;;;;;;;;;;;;;;;;;;
13;"Daniel M.,""55824230500";",https://www.scopus.com/inward/record.uri?eid=2-s2.0-84949533125&doi=10.1016%2fj.pragma.2015.07.002&partnerID=40&md5=c03da0940b44c53fd7262dd556a98820"",""Archi"; East Caucasian languages; Logophoric pronouns;" Reported speech"",";;;;;;;;;;;;;;;;;;;;;;;;;;;;;;;;;;;;;;;;;;;;;;;;;;;;;;;;;;;;;;;;;;;;;;;;
13;"Efendiev A., Sorokin P., Kozlova M.,""36008134200";56509164400;56735898600;",https://www.scopus.com/inward/record.uri?eid=2-s2.0-84958239902&partnerID=40&md5=761b80b4abadf3b2b7d1010d7db0f0e4"",,""economic growth"; farming system; industrial enterprise; rural development; rural economy; rural population; Belgorod;" Russian Federation""";;;;;;;;;;;;;;;;;;;;;;;;;;;;;;;;;;;;;;;;;;;;;;;;;;;;;;;;;;;;;;;;;;
13;"Kukshinov E.Y.,""57133020600";",https://www.scopus.com/inward/record.uri?eid=2-s2.0-84958950168&doi=10.4018%2fIJCBPL.2015100106&partnerID=40&md5=8ee21166de5a1e28df3fd0052a009798"",""Immersion"; Online Disinhibition Effect; Self-Concept; Self-Presentation;" Virtual Self"",";;;;;;;;;;;;;;;;;;;;;;;;;;;;;;;;;;;;;;;;;;;;;;;;;;;;;;;;;;;;;;;;;;;;;;;
13;"Kotomina O.V.,""56997363800";",https://www.scopus.com/inward/record.uri?eid=2-s2.0-84949495665&doi=10.1134%2fS2079970515040103&partnerID=40&md5=8c62887ce592bde5b243f7353e20fa3e"",""federal districts"; knowledge-intensive business services; Russia's regions; sector of knowledge-intensive business services; spatial distribution;" supply and demand"",""business service"; comparative study; knowledge; spatial distribution;" Russian Federation""";;;;;;;;;;;;;;;;;;;;;;;;;;;;;;;;;;;;;;;;;;;;;;;;;;;;;;;;;;;;;;;;;;
13;"Saritas O., Burmaoglu S.,""6506092892";53163130500;",https://www.scopus.com/inward/record.uri?eid=2-s2.0-84942980466&doi=10.1007%2fs11192-015-1671-x&partnerID=40&md5=85d750faa9e4566ddade3d73df77d6e7"",""Foresight"; Foresight methods; FTA;" Scientometrics"",";;;;;;;;;;;;;;;;;;;;;;;;;;;;;;;;;;;;;;;;;;;;;;;;;;;;;;;;;;;;;;;;;;;;;;;
13;"Kovaleva E.V., Mirkin B.G.,""56909717700";35428028600;",https://www.scopus.com/inward/record.uri?eid=2-s2.0-84947126382&doi=10.1007%2fs00357-015-9186-y&partnerID=40&md5=5a8bb37cf55efb1ebe6dee75543cd173"",""Bisecting k-means"; Cluster structure generator; Computational experiment; Divisive clustering; Principal directions; Random directions; Split base decomposition;" Uphierarchy"",";;;;;;;;;;;;;;;;;;;;;;;;;;;;;;;;;;;;;;;;;;;;;;;;;;;;;;;;;;;;;;;;;;;
13;"Riès S.K., Karzmark C.R., Navarrete E., Knight R.T., Dronkers N.F.,""36021907300";56871212400;8725200900;57202526480;6603880631;",https://www.scopus.com/inward/record.uri?eid=2-s2.0-84942303687&doi=10.1016%2fj.bandl.2015.07.007&partnerID=40&md5=8ce11ac7b7b0c811e65b2779b8c32480"",""Chronic stroke patients"; Language production; Left prefrontal cortex; Proactive control; Semantic interference;" Word selection"",""adult"; Article; brain function; brain region; clinical article; cognition; controlled study; executive function; female; human; left prefrontal cortex; male; mental task; prefrontal cortex; response time; semantics; task performance; word selection; aged; cerebrovascular accident; middle aged; pathology; pathophysiology; photostimulation; physiology; prefrontal cortex; psychology; reaction time; repetition priming; semantics; verbal behavior; Aged; Female; Humans; Male; Middle Aged; Photic Stimulation; Prefrontal Cortex; Reaction Time; Repetition Priming; Semantics; Stroke;" Verbal Behavior""";;;;;;;;;;;;;;;;;;;;;;;;
13;"Joshanloo M., Weijers D., Jiang D.-Y., Han G., Bae J., Pang J.S., Ho L.S., Ferreira M.C., Demir M., Rizwan M., Khilji I.A., Achoui M., Asano R., Igarashi T., Tsukamoto S., Lamers S.M.A., Turan Y., Sundaram S., Yeung V.W.L., Poon W.-C., Lepshokova Z.K., Panyusheva T., Natalia A.,""23392506000";55328554900;7401574306;55792745300;55982558500;55323858400;7402955669;7402787223;16300603100;57203250317;55983087500;15030695800;45161114900;7403249284;55983506700;35731594600;56270517800;7101967500;36603731100;57197954180;55982417800;55981866200;55981875400;",https://www.scopus.com/inward/record.uri?eid=2-s2.0-84942991211&doi=10.1007%2fs10902-014-9553-0&partnerID=40&md5=bcac55b5d8d98eaf92e765b6f379f4c7"",""Culture"; Fear of happiness; Fragility of happiness; Happiness;" Well-being"",";;;;;;;;;;;;;;;;;;;;;;;;;;;;;;;;;;;;;;;;;;;;;;;;;
13;"Brandsen T., Pape U.,""16678193800";56845094600;",https://www.scopus.com/inward/record.uri?eid=2-s2.0-84946494221&doi=10.1007%2fs11266-015-9646-3&partnerID=40&md5=ed8c8277c2359e8564f89e7907615698"",""Civil society"; Corporatism; Human services; Partnership;" Third sector"",""civil society"; corporate strategy; government relations; nonprofit organization; partnership approach; public sector;" Netherlands""";;;;;;;;;;;;;;;;;;;;;;;;;;;;;;;;;;;;;;;;;;;;;;;;;;;;;;;;;;;;;;;;
13;"Sorokin P.,""56509164400";",https://www.scopus.com/inward/record.uri?eid=2-s2.0-84939262581&doi=10.1007%2fs12108-015-9258-9&partnerID=40&md5=308d8ae637b8a971d683a270176eb991"",""Methodology"; Public sociology; Russian history;" Russian sociology"",";;;;;;;;;;;;;;;;;;;;;;;;;;;;;;;;;;;;;;;;;;;;;;;;;;;;;;;;;;;;;;;;;;;;;;;;
13;"Minnigaleeva G.A.,""56602857500";",https://www.scopus.com/inward/record.uri?eid=2-s2.0-84961167888&doi=10.4324%2f9781315866772&partnerID=40&md5=b7f3f110bd8e1fea535db45f3a517749"",,";;;;;;;;;;;;;;;;;;;;;;;;;;;;;;;;;;;;;;;;;;;;;;;;;;;;;;;;;;;;;;;;;;;;;;;;;;;
13;"Krasnopolskaya I., Skokova Y., Pape U.,""56637030400";56472814400;56845094600;",https://www.scopus.com/inward/record.uri?eid=2-s2.0-84946497774&doi=10.1007%2fs11266-015-9654-3&partnerID=40&md5=549319ad4d94a76b5e39afa36b4a1c2b"",""Government–nonprofit cooperation"; Nonprofit organization; Russia; Social policy; SONPOs;" Welfare state development"",""nonprofit organization"; service provision; social policy; state role; welfare provision;" Russian Federation""";;;;;;;;;;;;;;;;;;;;;;;;;;;;;;;;;;;;;;;;;;;;;;;;;;;;;;;;;;;;;;;
13;"Altbach P.G., Yudkevich M., Rumbley L.E.,""16418407500";25924090500;55611698800;",https://www.scopus.com/inward/record.uri?eid=2-s2.0-84941416210&doi=10.1007%2fs12564-015-9391-8&partnerID=40&md5=72f0154513aaccdcf9c2061fc264e0bf"",""Academic inbreeding"; Academic profession;" Faculty inbreeding"",";;;;;;;;;;;;;;;;;;;;;;;;;;;;;;;;;;;;;;;;;;;;;;;;;;;;;;;;;;;;;;;;;;;;;;;
13;"Salamon L.M., Toepler S.,""6603591625";6508392918;",https://www.scopus.com/inward/record.uri?eid=2-s2.0-84946501148&doi=10.1007%2fs11266-015-9651-6&partnerID=40&md5=96c6b6d599da28e1740172fe9afa1931"",""Government–nonprofit partnership"; New governance; New public management; Nonprofit organizations; Voluntary failure theory;" Welfare state"",""governance approach"; nonprofit organization; partnership approach; state role; theoretical study;" voluntary approach""";;;;;;;;;;;;;;;;;;;;;;;;;;;;;;;;;;;;;;;;;;;;;;;;;;;;;;;;;;;;;;;;
13;"Maksimenkova O., Podbelskiy P.,""57191339634";36245602900;",https://www.scopus.com/inward/record.uri?eid=2-s2.0-84957927034&doi=10.1109%2fICCSE.2015.7250248&partnerID=40&md5=e6adc5a231cd14b78a43cbdefe3457ca"",""datasets"; educational open data; open data; open educational resources;" teaching programming"",""Education computing"; Engineering education; Software engineering; Teaching; datasets; Educational process; Formative assessment; Open datum; Open educational resources; Problem based learning; Programming course; Teaching programming;" Education""";;;;;;;;;;;;;;;;;;;;;;;;;;;;;;;;;;;;;;;;;;;;;;;;;;;;;;;;;;
13;"Salamon L.M., Benevolenski V.B., Jakobson L.I.,""6603591625";56823508000;41461158700;",https://www.scopus.com/inward/record.uri?eid=2-s2.0-84946495767&doi=10.1007%2fs11266-015-9652-5&partnerID=40&md5=632552f90222f1476d84d74ad9459c70"",""Government regulation"; Nonprofit sector; Public administration; Public–private partnership; Russia; Social policy;" Socially oriented NPO"",""governance approach"; nonprofit organization; policy approach; public administration; public-private partnership; regulatory framework; social policy;" Russian Federation""";;;;;;;;;;;;;;;;;;;;;;;;;;;;;;;;;;;;;;;;;;;;;;;;;;;;;;;;;;;;
13;"Wegren S.K., Nikulin A., Trotsuk I., Golovina S., Pugacheva M.,""7004273823";56442152700;56442765000;32867692500;56442598600;",https://www.scopus.com/inward/record.uri?eid=2-s2.0-84933280504&doi=10.1080%2f1060586X.2014.986871&partnerID=40&md5=930071b273e0005a973cf415308e31a9"",""gender inequality"; gendered roles; occupational segregation; rural Russia;" value change"",""child care"; economic impact; gender disparity; gender role; income; rural economy; womens status;" Russian Federation""";;;;;;;;;;;;;;;;;;;;;;;;;;;;;;;;;;;;;;;;;;;;;;;;;;;;;;;;;;;;
13;"Salamon L.M.,""6603591625";",https://www.scopus.com/inward/record.uri?eid=2-s2.0-84946490792&doi=10.1007%2fs11266-015-9638-3&partnerID=40&md5=ebf0eb9614bdcaf74a53188626520c35"",""Central and Eastern Europe"; China; Government-nonprofit cooperation; Nonprofit organization;" Welfare state"",""intergovernmental relations"; nonprofit organization; state role; welfare provision; Central Asia; Central Europe; China; Eastern Europe;" Russian Federation""";;;;;;;;;;;;;;;;;;;;;;;;;;;;;;;;;;;;;;;;;;;;;;;;;;;;;;;;;;;;;;;
13;"Gorizontov L.,""56960451500";",https://www.scopus.com/inward/record.uri?eid=2-s2.0-84947054408&doi=10.1353%2fkri.2015.0071&partnerID=40&md5=e983e22f84136cc1550cb127a1769045"",,";;;;;;;;;;;;;;;;;;;;;;;;;;;;;;;;;;;;;;;;;;;;;;;;;;;;;;;;;;;;;;;;;;;;;;;;;;;
13;"Khachaturova M.R., Poimanova D.M.,""36968099600";56880419200;",https://www.scopus.com/inward/record.uri?eid=2-s2.0-84942757737&doi=10.1002%2fcrq.21131&partnerID=40&md5=ddfe2b9040650decf081398814d9b8ca"",,";;;;;;;;;;;;;;;;;;;;;;;;;;;;;;;;;;;;;;;;;;;;;;;;;;;;;;;;;;;;;;;;;;;;;;;;;;
13;"Kazun A.,""55948678700";",https://www.scopus.com/inward/record.uri?eid=2-s2.0-85017502047&partnerID=40&md5=419ffa5696329b38a46979df102b7ccf"",,""business cycle"; corporate strategy; law enforcement; nongovernmental organization; rationalization; reform process; violence;" Russian Federation""";;;;;;;;;;;;;;;;;;;;;;;;;;;;;;;;;;;;;;;;;;;;;;;;;;;;;;;;;;;;;;;;;;;;
13;"Vukovic N., Williams J.N.,""55960232500";7409579897;",https://www.scopus.com/inward/record.uri?eid=2-s2.0-84930621150&doi=10.1016%2fj.cognition.2015.05.017&partnerID=40&md5=965eac26a3f46999c9ec233a4cf3bf40"",""Embodied cognition"; Individual differences; Language comprehension; Perspective taking;" Spatial cognition"",""adult"; Article; classification; cognitive bias; comprehension; follow up; hand; human; human experiment; individuality; language; Latin square design; male; normal human; orientation; priority journal; response time; spatial learning; auditory stimulation; comprehension; individuality; linguistics; photostimulation; spatial behavior; Acoustic Stimulation; Adult; Comprehension; Humans; Individuality; Language; Linguistics; Male; Photic Stimulation;" Spatial Processing""";;;;;;;;;;;;;;;;;;;;;;;;;;;;;;;;;;;;;
13;"Novikova L.,""56959988000";",https://www.scopus.com/inward/record.uri?eid=2-s2.0-84947071379&doi=10.1353%2fkri.2015.0050&partnerID=40&md5=6a9b3a5f9644a9e5dd7a12374d480450"",,";;;;;;;;;;;;;;;;;;;;;;;;;;;;;;;;;;;;;;;;;;;;;;;;;;;;;;;;;;;;;;;;;;;;;;;;;;;
13;"Firat R.B., Boyer P.,""55440946000";7201390372;",https://www.scopus.com/inward/record.uri?eid=2-s2.0-84931273539&doi=10.1016%2fj.ssresearch.2015.05.006&partnerID=40&md5=5a7a6f2fb01e6b4ef45fe82e016d5900"",""Coalitional psychology"; Ethnic diversity; Health;" Well-being"",""ancestry group"; cultural diversity; demography; ethnic group; Europe; female; friend; health; human; human relation; male; minority group; questionnaire; social network; social support; trust; Continental Population Groups; Cultural Diversity; Ethnic Groups; Europe; Female; Friends; Health; Humans; Interpersonal Relations; Male; Minority Groups; Residence Characteristics; Social Networking; Social Support; Surveys and Questionnaires;" Trust""";;;;;;;;;;;;;;;;;;;;;;;;;;;;;;;;;;;;;;;;
13;"Iarskaia-Smirnova E., Romanov P.,""6506466504";23571229400;",https://www.scopus.com/inward/record.uri?eid=2-s2.0-84949235048&doi=10.4324%2f9780203111888&partnerID=40&md5=8fb72157dcf220d54c808eacdb45a126"",,";;;;;;;;;;;;;;;;;;;;;;;;;;;;;;;;;;;;;;;;;;;;;;;;;;;;;;;;;;;;;;;;;;;;;;;;;;
13;"Kozyrin A.N., Yalbulganov A.A.,""56458859100";56374482200;",https://www.scopus.com/inward/record.uri?eid=2-s2.0-84941025274&doi=10.1007%2fs10991-015-9169-4&partnerID=40&md5=058366d6478900571ca47a18de2bb2c2"",""Anti-dumping duty"; Anti-dumping measures; Customs union;" EurAsEC"",";;;;;;;;;;;;;;;;;;;;;;;;;;;;;;;;;;;;;;;;;;;;;;;;;;;;;;;;;;;;;;;;;;;;;;;
13;"Isaev L.M., Korotaev A.V.,""57196708868";57196724736;",https://www.scopus.com/inward/record.uri?eid=2-s2.0-85033700037&partnerID=40&md5=0d0d715a61353fd01fd4dce1b957412f"",""Al Ahmar"; Ansar Allah; Houthi; Revolution; Saleh; Yemen;" Zaidiyyah"",";;;;;;;;;;;;;;;;;;;;;;;;;;;;;;;;;;;;;;;;;;;;;;;;;;;;;;;;;;;;;;;;;;;;
13;"Avdasheva S., Kryuchkova P.,""7801623030";56133393500;",https://www.scopus.com/inward/record.uri?eid=2-s2.0-84949318681&doi=10.1016%2fj.irle.2014.04.003&partnerID=40&md5=512bb94ca49bab927d2af3dc4e974f3a"",""Antitrust"; Complaints; Legal errors; Public enforcement;" Russia"",";;;;;;;;;;;;;;;;;;;;;;;;;;;;;;;;;;;;;;;;;;;;;;;;;;;;;;;;;;;;;;;;;;;;;;
13;"Muradov K.Y.,""57193563152";",https://www.scopus.com/inward/record.uri?eid=2-s2.0-85033713856&partnerID=40&md5=16cd424d08cb73e0e824ea0b65ce226d"",""ASEAN"; Global value chains; Input-output tables; International trade; Russia; Statistics; Trade;" Value added"",";;;;;;;;;;;;;;;;;;;;;;;;;;;;;;;;;;;;;;;;;;;;;;;;;;;;;;;;;;;;;;;;;;;;
13;"Kovács E., Lyutov N., Mitrus L.,""57131322800";56497021500;57131461700;",https://www.scopus.com/inward/record.uri?eid=2-s2.0-84958933851&doi=10.4337%2f9781781000137.00021&partnerID=40&md5=bea602de345971b80ae362b5bef3c450"",,";;;;;;;;;;;;;;;;;;;;;;;;;;;;;;;;;;;;;;;;;;;;;;;;;;;;;;;;;;;;;;;;;;;;;;;;;
13;"Koptjevskaja-Tamm M., Rakhilina E., Vanhove M.,""26035387200";26967858600;26632702700;",https://www.scopus.com/inward/record.uri?eid=2-s2.0-84941591547&partnerID=40&md5=cd3d3cf6f273d9cae436105d9b8c8954"",,";;;;;;;;;;;;;;;;;;;;;;;;;;;;;;;;;;;;;;;;;;;;;;;;;;;;;;;;;;;;;;;;;;;;;;;;;
13;"Gambarato R.R., Medvedev S.A.,""56039359500";57098823200;",https://www.scopus.com/inward/record.uri?eid=2-s2.0-84957372635&doi=10.4018%2f978-1-4666-8502-4.ch008&partnerID=40&md5=e62f772f85a9b32a7d92035c2918a449"",,""Information and Communication Technologies"; Methodological approach; New media; Online fundraising; Political campaign; Theoretical framework;" Social sciences""";;;;;;;;;;;;;;;;;;;;;;;;;;;;;;;;;;;;;;;;;;;;;;;;;;;;;;;;;;;;;;;;;;;;
13;"Lukyanov F.,""24481505000";",https://www.scopus.com/inward/record.uri?eid=2-s2.0-84964687250&doi=10.1080%2f10611940.2015.1142340&partnerID=40&md5=830506abe68d4daf6bf79225be737cfe"",,";;;;;;;;;;;;;;;;;;;;;;;;;;;;;;;;;;;;;;;;;;;;;;;;;;;;;;;;;;;;;;;;;;;;;;;;;;;
13;"Rochlitz M., Kulpina V., Remington T., Yakovlev A.,""55948177300";56922232300;7004041812;36085487700;",https://www.scopus.com/inward/record.uri?eid=2-s2.0-84952299974&doi=10.1080%2f15387216.2015.1089411&partnerID=40&md5=8a72b25aa451fd6627cdb91f79b38495"",""bureaucracy"; career incentives; centralization; China; decentralization; economic performance; regional officials;" Russia"",""autonomy"; centralization; comparative study; decentralization; economic growth; incentive; performance assessment; policy approach; regional economy; China;" Russian Federation""";;;;;;;;;;;;;;;;;;;;;;;;;;;;;;;;;;;;;;;;;;;;;;;;;;;;;;;
13;"Derkachev P.V.,""57015381100";",https://www.scopus.com/inward/record.uri?eid=2-s2.0-84950972746&doi=10.1080%2f10609393.2015.1096146&partnerID=40&md5=654d908c3ac8451acb479191b4100f22"",,";;;;;;;;;;;;;;;;;;;;;;;;;;;;;;;;;;;;;;;;;;;;;;;;;;;;;;;;;;;;;;;;;;;;;;;;;;;
13;"Tarasenko A.,""56785560400";",https://www.scopus.com/inward/record.uri?eid=2-s2.0-84939524862&doi=10.1080%2f21599165.2015.1023895&partnerID=40&md5=fa8ed95d3efb38655853c5f1da919d14"",""civil society"; interest groups; Russia;" welfare reform"",";;;;;;;;;;;;;;;;;;;;;;;;;;;;;;;;;;;;;;;;;;;;;;;;;;;;;;;;;;;;;;;;;;;;;;;;
13;"Kasprzhak A.G., Bysik N.V.,""57015325300";57015407700;",https://www.scopus.com/inward/record.uri?eid=2-s2.0-84951028698&doi=10.1080%2f10609393.2015.1096148&partnerID=40&md5=46cc5b18d105ac4ddc7e0dad83503c56"",,";;;;;;;;;;;;;;;;;;;;;;;;;;;;;;;;;;;;;;;;;;;;;;;;;;;;;;;;;;;;;;;;;;;;;;;;;;
13;"Polivanova K.P., Sazonova E.V., Shakarova M.A.,""57015286600";57014988800;57015502300;",https://www.scopus.com/inward/record.uri?eid=2-s2.0-84950984855&doi=10.1080%2f10609393.2015.1096150&partnerID=40&md5=fc9d0fe1052efd20a9641f7ec8bea2a8"",,";;;;;;;;;;;;;;;;;;;;;;;;;;;;;;;;;;;;;;;;;;;;;;;;;;;;;;;;;;;;;;;;;;;;;;;;;
13;"Bysik N., Evstigneeva N., Isaeva N., Kukso K., Harris A., Jones M.,""57015407700";57190807348;57190168105;57188746478;7404039718;55491035700;",https://www.scopus.com/inward/record.uri?eid=2-s2.0-84983340483&doi=10.1080%2f02188791.2015.1056588&partnerID=40&md5=cbcb027d2e8a1b970da5aaadc8f060d0"",""distributed leadership"; managerial approaches; principal leadership; professional development; professional training;" retraining"",";;;;;;;;;;;;;;;;;;;;;;;;;;;;;;;;;;;;;;;;;;;;;;;;;;;;;;;;;;;;;;;;;
13;"Bolotov V., Valdman I., Kovaleva G., Pinskaya M.,""22733636900";57015302800;7005879054;56968021400;",https://www.scopus.com/inward/record.uri?eid=2-s2.0-84951121691&doi=10.1080%2f10609393.2015.1096145&partnerID=40&md5=949536e97131d2fc9d1dd0211198a10e"",,";;;;;;;;;;;;;;;;;;;;;;;;;;;;;;;;;;;;;;;;;;;;;;;;;;;;;;;;;;;;;;;;;;;;;;;;
13;"Letuchiy A.,""55823575400";",https://www.scopus.com/inward/record.uri?eid=2-s2.0-84954535699&doi=10.1418%2f81750&partnerID=40&md5=9aab875276a2e726241fbdaae05cbc13"",""Absolute tense interpretation"; Adjunct clauses; Relative tense interpretation; Russian;" Zero copula"",";;;;;;;;;;;;;;;;;;;;;;;;;;;;;;;;;;;;;;;;;;;;;;;;;;;;;;;;;;;;;;;;;;;;;;;
